"The sloppy dad saw the random stuff in the kitchen, and didn't know where to put it, where did he decide to place it?",cabinet,The random stuff is placed in cabinet in the kitchen. The sloppy dad didn't know where to put the random stuff in the kitchen so he decided to place it at the cabinet. Anything is not a place where random stuff can be put. Cupboard might not be found in the kitchen. The sloppy dad didn't place random stuff at michigan. The random stuff cant be placed on the table.,"the sloppy dad saw the random stuff in the kitchen, and didn't know where to put it, where did he decide to place it cabinet",Cabinet means drawer in UK English. In this question “stuff” refers to random things such as pots etc… So we conclude that he decided to keep all these items inside his drawer(cabinets). Hence the correct,"{'supports': 4, 'overall': 2, 'well_written': 1, 'related': 1, 'factual': 1, 'new_info': 1, 'unnecessary_info': 1, 'contrastive': 1}","{'supports': 0, 'overall': 1, 'well_written': 0, 'related': 0, 'factual': 0, 'new_info': 0, 'unnecessary_info': 1, 'contrastive': 0}","{'supports': 1, 'overall': 1, 'well_written': 1, 'related': 2, 'factual': 1, 'new_info': 0, 'unnecessary_info': 0, 'contrastive': 0}","{'supports': 2, 'overall': 3, 'well_written': 1, 'related': 1, 'factual': 1, 'new_info': 1, 'unnecessary_info': 0, 'contrastive': 0}","{'supports': 2, 'overall': 2, 'well_written': 2, 'related': 2, 'factual': 2, 'new_info': 3, 'unnecessary_info': 3, 'contrastive': 0}",0.79,0.58,0.89,0.84,-0.44,-0.79,0.240192230707631,0.665750285935683,0.254513905190311,-0.134534558799263,
He leaned the beam over the flooded gap to create a makeshift what?,bridge,Bridge is a structure making a path between two ends with a gap and leaning a beam over the flooded gap will create a path that is a makeshift bridge. New construction comes under a bridge and leaning a beam will not create what’s given in the other options.,a bridge is a structure that is made of a beam.,"Leaning a beam creates a make shift bridge for crossing water bodies like river etc. However this question seems to be confusing between ""a"" and ""the"". If we consider the question with ""the"", then it becomes clear. Also bridge needs","{'supports': 1, 'overall': 4, 'well_written': 1, 'related': 1, 'factual': 1, 'new_info': 2, 'unnecessary_info': 0, 'contrastive': 1}","{'supports': 0, 'overall': 2, 'well_written': 1, 'related': 1, 'factual': 0, 'new_info': 0, 'unnecessary_info': 1, 'contrastive': 0}","{'supports': 1, 'overall': 2, 'well_written': 2, 'related': 2, 'factual': 1, 'new_info': 0, 'unnecessary_info': 0, 'contrastive': 0}","{'supports': 2, 'overall': 2, 'well_written': 1, 'related': 1, 'factual': 1, 'new_info': 1, 'unnecessary_info': 0, 'contrastive': 1}","{'supports': 1, 'overall': 2, 'well_written': 1, 'related': 1, 'factual': 2, 'new_info': 1, 'unnecessary_info': 1, 'contrastive': 0}",0.81,0.67,0.87,0.85,-1.36,-0.77,0.0540738070435875,0.628828145522533,0.25717224993682,0.342997170285018,
John is getting something important.  What does this make him feel?,being happy,"People become happy and content on receiving something valuable. Receiving something important doesn't make people stoic, and doesn't necessarily cause headaches or make people want more.",getting something important is a feeling of being happy.,Being happy means feeling glad. The word “happy” refers to feeling joyful or pleased about someone/something . So john will get happier if he gets some good news from his workplace. He may also become sadder if he,"{'supports': 3, 'overall': 3, 'well_written': 1, 'related': 1, 'factual': 1, 'new_info': 1, 'unnecessary_info': 0, 'contrastive': 1}","{'supports': 0, 'overall': 1, 'well_written': 0, 'related': 0, 'factual': 0, 'new_info': 0, 'unnecessary_info': 1, 'contrastive': 0}","{'supports': 2, 'overall': 2, 'well_written': 2, 'related': 2, 'factual': 2, 'new_info': 0, 'unnecessary_info': 0, 'contrastive': 0}","{'supports': 2, 'overall': 3, 'well_written': 1, 'related': 1, 'factual': 1, 'new_info': 1, 'unnecessary_info': 0, 'contrastive': 1}","{'supports': 1, 'overall': 2, 'well_written': 2, 'related': 2, 'factual': 1, 'new_info': 3, 'unnecessary_info': 3, 'contrastive': 0}",0.66,0.34,0.86,0.86,-0.36,-0.22,-0.0700140042014005,0.97182531580755,0.563601861976635,-0.354005216196922,
What in a car could have an led?,dashboard,"Dashboard is the panel facing the driver of a vehicle or the pilot of an aircraft. Dashboard in a car could have an LED. Electronics is a branch of study and not an equipment to be placed on a dashboard. Electronic equipment is the type of electronic device and not the component. Display is the display technology. LCD, LED, ELD, PDP and QLED are the different types of display technology. PC board is a printed circuit board and it is not found on car dashboards.",dashboards are used to show the interior of cars.,LED stands for Light Emitting Diode. This light emitting diodes can also be used in cars (dashboards). Incorrect options such as headlights don’t make sense since they aren’t made up of lamps,"{'supports': 0, 'overall': 3, 'well_written': 0, 'related': 1, 'factual': 1, 'new_info': 1, 'unnecessary_info': 0, 'contrastive': 1}","{'supports': 1, 'overall': 3, 'well_written': 1, 'related': 1, 'factual': 1, 'new_info': 1, 'unnecessary_info': 1, 'contrastive': 1}","{'supports': 0, 'overall': 2, 'well_written': 1, 'related': 1, 'factual': 0, 'new_info': 0, 'unnecessary_info': 1, 'contrastive': 0}","{'supports': 1, 'overall': 1, 'well_written': 1, 'related': 1, 'factual': 1, 'new_info': 0, 'unnecessary_info': 0, 'contrastive': 0}","{'supports': 2, 'overall': 3, 'well_written': 1, 'related': 1, 'factual': 1, 'new_info': 2, 'unnecessary_info': 0, 'contrastive': 1}",0.56,0.63,0.48,0.85,0.83,-1.14,0.606976978666884,0.0592348877759092,0.105263157894737,0.450563556889583,
"The excavation workers had to take extra care to stay hydrated, what landscape might they be working?",desert,The excavation workers need to stay hydrated in desert. They might be working in desert landscape and had to take extra care. Excavation worker might not be working in city. Montana or store is not landscape. The excavation worker dont take extra care while working in egypt.,desert landscape might they be working,Excavators work mostly at drylands where water scarcity leads them to use more amount of water for their own safety while performing activities like digging holes etc. So if we talk about a place with lesser rainfall then surely it,"{'supports': 4, 'overall': 3, 'well_written': 1, 'related': 1, 'factual': 1, 'new_info': 1, 'unnecessary_info': 0, 'contrastive': 1}","{'supports': 0, 'overall': 1, 'well_written': 0, 'related': 0, 'factual': 0, 'new_info': 0, 'unnecessary_info': 1, 'contrastive': 0}","{'supports': 0, 'overall': 1, 'well_written': 0, 'related': 1, 'factual': 0, 'new_info': 0, 'unnecessary_info': 0, 'contrastive': 0}","{'supports': 2, 'overall': 3, 'well_written': 1, 'related': 1, 'factual': 1, 'new_info': 1, 'unnecessary_info': 0, 'contrastive': 1}","{'supports': 1, 'overall': 2, 'well_written': 1, 'related': 2, 'factual': 2, 'new_info': 2, 'unnecessary_info': 1, 'contrastive': 0}",0.54,0.46,0.83,0.85,-1.72,-0.42,-0.136082763487954,0.888888888888889,0.272165526975909,0.108147614087175,
"The person was shocked when the FBI talked to her about some facebook posts, what did the person want?",freedom of expression,A person has the right to express their thoughts abd beliefs on a social platform in a democratic country. The FBI has no right threaten him or capture him due to some facebook posts. A person usually does not expect money or compliments from the FBI. FBI is not a restaurant where one can get food and water. One cannot get freedom of information from the FBI.,facebook is a social network,"Freedom of speech is right to speak without fear of government retaliating for saying something unpopular or true. Facebook posts fall under free speech rights since they express opinions through words spoken, written, sung etc., Hence, the person wanted","{'supports': 4, 'overall': 3, 'well_written': 0, 'related': 1, 'factual': 1, 'new_info': 2, 'unnecessary_info': 0, 'contrastive': 1}","{'supports': 0, 'overall': 2, 'well_written': 0, 'related': 1, 'factual': 0, 'new_info': 0, 'unnecessary_info': 1, 'contrastive': 0}","{'supports': 0, 'overall': 0, 'well_written': 0, 'related': 1, 'factual': 0, 'new_info': 0, 'unnecessary_info': 0, 'contrastive': 0}","{'supports': 1, 'overall': 3, 'well_written': 1, 'related': 1, 'factual': 1, 'new_info': 1, 'unnecessary_info': 0, 'contrastive': 0}","{'supports': 1, 'overall': 1, 'well_written': 1, 'related': 1, 'factual': 2, 'new_info': 3, 'unnecessary_info': 3, 'contrastive': 1}",0.27,0.41,0.83,0.84,-1.57,-0.46,0,0.495073771488337,-0.077151674981046,-0.198029508595335,
"There are different kinds of Meningitis, but it is an illness that affects the what?",brain,"Meningitis is an illness that affects the brain as there is a swelling in meninges a part or portion of brain. While nursing home, Hospital and Doctor’s office being nonrelative terms and nail not a meninges.",Meningitis is a disease that affects the brain.,Meningitis refers to inflammations of membranous lining around spinal cord (meningeal) and/or fluid inside meninges known as CSF. As per definition all forms of Meningitis affect the Brain.,"{'supports': 0, 'overall': 4, 'well_written': 0, 'related': 1, 'factual': 1, 'new_info': 1, 'unnecessary_info': 0, 'contrastive': 1}","{'supports': 0, 'overall': 2, 'well_written': 1, 'related': 1, 'factual': 0, 'new_info': 1, 'unnecessary_info': 1, 'contrastive': 0}","{'supports': 4, 'overall': 3, 'well_written': 4, 'related': 4, 'factual': 1, 'new_info': 0, 'unnecessary_info': 0, 'contrastive': 0}","{'supports': 2, 'overall': 3, 'well_written': 1, 'related': 1, 'factual': 1, 'new_info': 1, 'unnecessary_info': 0, 'contrastive': 0}","{'supports': 3, 'overall': 3, 'well_written': 3, 'related': 3, 'factual': 3, 'new_info': 3, 'unnecessary_info': 1, 'contrastive': 0}",0.83,0.74,0.9,0.85,-0.51,-0.39,0.263157894736842,0.250313087160879,-0.146734796413356,0.127256952595156,
"The padding was covered with mold, he never would've seen it if he didn't pull up the what?",carpet,A carpet can be pulled up and one can see mold below it. All the other options are incorrect as they cannot be pulled up.,carpet is a type of flooring,Padding underneath the floor covering may get dirty due to foot traffic and thus needs regular cleanings. Carpets are generally made from woven fibers such as cotton (either alone or blended) or synthetic materials like,"{'supports': 1, 'overall': 4, 'well_written': 1, 'related': 1, 'factual': 1, 'new_info': 1, 'unnecessary_info': 0, 'contrastive': 1}","{'supports': 1, 'overall': 2, 'well_written': 1, 'related': 1, 'factual': 0, 'new_info': 1, 'unnecessary_info': 1, 'contrastive': 0}","{'supports': 0, 'overall': 1, 'well_written': 1, 'related': 1, 'factual': 2, 'new_info': 0, 'unnecessary_info': 0, 'contrastive': 0}","{'supports': 1, 'overall': 3, 'well_written': 1, 'related': 1, 'factual': 1, 'new_info': 2, 'unnecessary_info': 0, 'contrastive': 0}","{'supports': 1, 'overall': 2, 'well_written': 1, 'related': 2, 'factual': 2, 'new_info': 2, 'unnecessary_info': 2, 'contrastive': 0}",0.51,0.36,0.84,0.84,-0.78,-0.26,0.336336396998156,0.726273039202563,0.381770857785467,0,
Where do people go if they are looking for a taxi?,street corner,Taxis are usually parked at the street corner when it has no rides. People can usually find a taxi at the street corner if they are looking for one. People usually cannot find a taxi at an apartment. Space shuttle is an irrelevant option. Public place is a very vague answer. Taxi is generally not parked in a garden.,street corner people go if they are looking for a taxi,A street corner is where someone goes if they want to hail down a cab. You don’t look up at traffic lights when you’re trying to get somewhere fast. There isn’t much point stopping at them either. Weather isn,"{'supports': 1, 'overall': 4, 'well_written': 1, 'related': 1, 'factual': 1, 'new_info': 2, 'unnecessary_info': 0, 'contrastive': 1}","{'supports': 0, 'overall': 2, 'well_written': 0, 'related': 0, 'factual': 0, 'new_info': 0, 'unnecessary_info': 1, 'contrastive': 0}","{'supports': 0, 'overall': 1, 'well_written': 0, 'related': 1, 'factual': 0, 'new_info': 0, 'unnecessary_info': 0, 'contrastive': 0}","{'supports': 1, 'overall': 4, 'well_written': 1, 'related': 1, 'factual': 1, 'new_info': 2, 'unnecessary_info': 0, 'contrastive': 1}","{'supports': 2, 'overall': 2, 'well_written': 1, 'related': 2, 'factual': 2, 'new_info': 3, 'unnecessary_info': 2, 'contrastive': 0}",0.67,0.5,0.87,0.85,-1.29,-0.8,0.0653720450460614,1,0.408248290463863,0.277777777777778,
"All the movies always portray gasoline as the commodity, but he was convinced a garden would be the most valuable in a what?",wasteland,"A wasteland is an unused area of land that has become barren or overgrown. Hence he was convinced that a garden would be the most valuable in a wasteland, though all movies always portray gasoline as the commodity. A garden won't be the most valuable in a hop garden. A garden cannot be started in any of the places in the other options.","a garden is a commodity, but a garden is a wasteland.",In times of war people resort to eating grass for survival rather than eating meat. Hence a garden will be more useful at such time if everything else fails except fuel/gasoline. This question states that we already know that gasoline is,"{'supports': 4, 'overall': 2, 'well_written': 1, 'related': 1, 'factual': 1, 'new_info': 1, 'unnecessary_info': 0, 'contrastive': 1}","{'supports': 0, 'overall': 1, 'well_written': 0, 'related': 0, 'factual': 0, 'new_info': 0, 'unnecessary_info': 1, 'contrastive': 0}","{'supports': 1, 'overall': 1, 'well_written': 2, 'related': 1, 'factual': 1, 'new_info': 0, 'unnecessary_info': 0, 'contrastive': 0}","{'supports': 2, 'overall': 3, 'well_written': 1, 'related': 1, 'factual': 1, 'new_info': 1, 'unnecessary_info': 0, 'contrastive': 1}","{'supports': 1, 'overall': 1, 'well_written': 1, 'related': 2, 'factual': 3, 'new_info': 2, 'unnecessary_info': 3, 'contrastive': 0}",0.76,0.58,0.87,0.85,-1.21,-0.62,-0.136082763487954,0.888888888888889,0.378516649305113,-0.491473187182991,
"Since we aren't immortal, people should what?",expect to die,"Immortals are people who can never die. Mortals are people who can die. Humans are not immortals, hence they can die at some point. Paying bills is not related to not being an immortal. People usually do not buy pets because they are not immortals. People usually do not stay in only because they are not immortals. Eat corn is an irrelevant option.",expect to die is the only way to live.,Expect something means assume about future events without evidence. So since humans don't know they will live forever so expecting death makes sense.,"{'supports': 0, 'overall': 3, 'well_written': 1, 'related': 1, 'factual': 1, 'new_info': 1, 'unnecessary_info': 0, 'contrastive': 1}","{'supports': 0, 'overall': 2, 'well_written': 0, 'related': 0, 'factual': 0, 'new_info': 0, 'unnecessary_info': 1, 'contrastive': 0}","{'supports': 1, 'overall': 1, 'well_written': 2, 'related': 1, 'factual': 0, 'new_info': 0, 'unnecessary_info': 0, 'contrastive': 0}","{'supports': 1, 'overall': 3, 'well_written': 1, 'related': 1, 'factual': 1, 'new_info': 1, 'unnecessary_info': 0, 'contrastive': 0}","{'supports': 2, 'overall': 2, 'well_written': 3, 'related': 3, 'factual': 3, 'new_info': 2, 'unnecessary_info': 1, 'contrastive': 1}",0.25,0.18,0.83,0.82,-1.46,-1.18,0.134534558799263,0.588235294117647,0.166924465222397,0.264628062012482,
"Sean wanted to go to the Met, so he took a subway stop in what city?",new york city,"In a new york city, there is the Met. As Sean wanted to go to the Met, so he took a subway stop in new york city. There is no Met in large city or toronto or metropolis.",subways are in New York City.,"New York City is located at Manhattan Island in NY State USA (NY). Hence, it is the correct choice for this question. Other cities mentioned above are not related with arts & culture.","{'supports': 0, 'overall': 2, 'well_written': 0, 'related': 1, 'factual': 1, 'new_info': 1, 'unnecessary_info': 0, 'contrastive': 1}","{'supports': 0, 'overall': 1, 'well_written': 0, 'related': 0, 'factual': 0, 'new_info': 0, 'unnecessary_info': 1, 'contrastive': 0}","{'supports': 0, 'overall': 1, 'well_written': 1, 'related': 1, 'factual': 2, 'new_info': 2, 'unnecessary_info': 3, 'contrastive': 0}","{'supports': 2, 'overall': 3, 'well_written': 1, 'related': 1, 'factual': 1, 'new_info': 1, 'unnecessary_info': 0, 'contrastive': 1}","{'supports': 1, 'overall': 2, 'well_written': 2, 'related': 2, 'factual': 1, 'new_info': 3, 'unnecessary_info': 3, 'contrastive': 0}",0.56,0.39,0.85,0.84,-1.27,-0.86,0.132453235706504,0.378516649305113,-0.047836487323494,-0.095672974646988,
"The woman was yelling obscenities in public, and while it was entertaining for people passing by, what did her husband feel?",embarrassment,wife's yelling at husband in public entertains other people passing by and you feel embarrassment when people have fun of you. yelling cannot give happiness to husband if his wife is yelling. you dont feel fatigue due to yelling of other. fulfillment is not feeling you can have when someone is yelling. you cannot enjoy when your spouce is yelling,embarrassment is a feeling of embarrassment.,"Obscene language means something offensive. While we know this, using such words in front of others may make them feel uncomfortable. This makes us use the word 'embarrass'.","{'supports': 1, 'overall': 1, 'well_written': 0, 'related': 1, 'factual': 1, 'new_info': 0, 'unnecessary_info': 1, 'contrastive': 1}","{'supports': 1, 'overall': 2, 'well_written': 1, 'related': 1, 'factual': 0, 'new_info': 0, 'unnecessary_info': 1, 'contrastive': 0}","{'supports': 0, 'overall': 0, 'well_written': 1, 'related': 0, 'factual': 0, 'new_info': 0, 'unnecessary_info': 0, 'contrastive': 0}","{'supports': 0, 'overall': 2, 'well_written': 1, 'related': 1, 'factual': 0, 'new_info': 1, 'unnecessary_info': 1, 'contrastive': 0}","{'supports': 2, 'overall': 2, 'well_written': 3, 'related': 3, 'factual': 3, 'new_info': 3, 'unnecessary_info': 1, 'contrastive': 0}",0.19,0.13,0.85,0.82,-1.18,-0.92,0.198679853559757,-0.264906471413009,-0.654653670707977,-0.50395263067897,
What bounds a book?,cover,"Books are bound by a hard material made of paper called cover. Few pages are not hard material nad knowledge, many words and staples are not made of paper.",cover is the only thing that can be used to cover a book.,The bound books are those where all pages of text are stitched together at their sides using either string or glue or both. Bound books often refers to hardcover edition while loose leaf refers to softcover editions. Cover refers to outer,"{'supports': 3, 'overall': 3, 'well_written': 0, 'related': 1, 'factual': 1, 'new_info': 0, 'unnecessary_info': 0, 'contrastive': 1}","{'supports': 0, 'overall': 2, 'well_written': 0, 'related': 1, 'factual': 0, 'new_info': 0, 'unnecessary_info': 1, 'contrastive': 0}","{'supports': 1, 'overall': 2, 'well_written': 1, 'related': 2, 'factual': 2, 'new_info': 0, 'unnecessary_info': 0, 'contrastive': 0}","{'supports': 2, 'overall': 3, 'well_written': 1, 'related': 1, 'factual': 1, 'new_info': 1, 'unnecessary_info': 0, 'contrastive': 0}","{'supports': 2, 'overall': 2, 'well_written': 2, 'related': 2, 'factual': 2, 'new_info': 2, 'unnecessary_info': 1, 'contrastive': 0}",0.6,0.61,0.85,0.83,-0.52,-0.19,0.211702449609985,0.571428571428572,0.476190476190476,0.181568259800641,
"If you got a job as an undercover shopper you would buy products, then after doing a review you would what?",get money,Undercover shoppers are employees who get money for doing their job. They get money after doing reviews. Undercover shoppers do not compare prices or eat chicken after doing reviews. They also do not pay money or save money for doing their job.,undercover shopper is a job that requires you to buy products.,Under cover shoppers purchase products for their reviews and they may also get paid for these reviews. They don't sell products they bought at stores.,"{'supports': 1, 'overall': 4, 'well_written': 1, 'related': 1, 'factual': 1, 'new_info': 2, 'unnecessary_info': 0, 'contrastive': 1}","{'supports': 1, 'overall': 2, 'well_written': 1, 'related': 1, 'factual': 0, 'new_info': 1, 'unnecessary_info': 1, 'contrastive': 0}","{'supports': 1, 'overall': 1, 'well_written': 1, 'related': 1, 'factual': 1, 'new_info': 0, 'unnecessary_info': 0, 'contrastive': 0}","{'supports': 0, 'overall': 2, 'well_written': 1, 'related': 1, 'factual': 0, 'new_info': 1, 'unnecessary_info': 1, 'contrastive': 0}","{'supports': 1, 'overall': 2, 'well_written': 4, 'related': 2, 'factual': 2, 'new_info': 2, 'unnecessary_info': 0, 'contrastive': 0}",0.75,0.37,0.86,0.84,-0.6,-0.3,0.400163365332521,0.378516649305113,0.182574185835055,0.411475599898912,
"The student needed to  get some new pencils, where did he go?",store,Students mainly use pencils for study purpose. Stores sell stationery items like pens and pencils. Students go to the store when they need to buy pencils. Classroom is not a place where pencils are sold. Backpack is not a place where one can find new pencils. Cabinet does not generally have new pencils. Teacher is an irrelevant answer.,store is the place where you can buy pencils.,Store is used for buying things like shopping malls etc. Bookstore is not necessary since the question asks about getting something while school stores sell books. School also isn’t appropriate as schools don’t sell stationery items such as p,"{'supports': 0, 'overall': 4, 'well_written': 1, 'related': 1, 'factual': 1, 'new_info': 2, 'unnecessary_info': 0, 'contrastive': 1}","{'supports': 0, 'overall': 1, 'well_written': 0, 'related': 1, 'factual': 0, 'new_info': 0, 'unnecessary_info': 1, 'contrastive': 0}","{'supports': 1, 'overall': 2, 'well_written': 1, 'related': 1, 'factual': 0, 'new_info': 0, 'unnecessary_info': 0, 'contrastive': 0}","{'supports': 2, 'overall': 3, 'well_written': 1, 'related': 1, 'factual': 1, 'new_info': 2, 'unnecessary_info': 0, 'contrastive': 1}","{'supports': 2, 'overall': 2, 'well_written': 1, 'related': 2, 'factual': 3, 'new_info': 3, 'unnecessary_info': 3, 'contrastive': 0}",0.66,0.53,0.87,0.86,-1.52,-0.77,0.0563436169819011,0.571428571428572,0.200250469728704,-0.0465242105199235,
Where would you find a sloth that is not afraid of being hunted?,nature preserve,"Animals are not being hunted in natural preserves. Natural preserve is a place where you would find a sloth that is not afraid of being hunted. At zoo, a sloth may be hunted. A sloth can get hunted at tropical rainforest or at forest canopy. Commercial is not a place where sloth can be found.",nature preserves are often surrounded by nature.,"Sloth is very lazy animal found mainly in South America jungles . It prefers to live at trees , eats leaves etc and hardly goes anywhere else unless hungry for food . But if kept inside zoo then definitely they will be afraid of","{'supports': 1, 'overall': 3, 'well_written': 1, 'related': 1, 'factual': 0, 'new_info': 1, 'unnecessary_info': 0, 'contrastive': 1}","{'supports': 1, 'overall': 2, 'well_written': 1, 'related': 1, 'factual': 0, 'new_info': 1, 'unnecessary_info': 0, 'contrastive': 0}","{'supports': 1, 'overall': 1, 'well_written': 1, 'related': 1, 'factual': 1, 'new_info': 0, 'unnecessary_info': 0, 'contrastive': 0}","{'supports': 2, 'overall': 3, 'well_written': 1, 'related': 1, 'factual': 0, 'new_info': 1, 'unnecessary_info': 1, 'contrastive': 0}","{'supports': 2, 'overall': 2, 'well_written': 2, 'related': 2, 'factual': 2, 'new_info': 2, 'unnecessary_info': 2, 'contrastive': 0}",0.52,0.7,0.85,0.84,-1.16,-0.52,0.834622326111986,0.582181736427459,0.25048971643406,-0.0916698497028211,
"If I want to find more information about things in general, what am I seeking?",increased knowledge,Person has to look for increasing his knowledge if he want more information in general. Knowing more doesn't help you find more information in general.Wisdom cannot provide you general knowledge. Gaining knowledge cannot give you general knowledge always. Headache is not something that person seeks for.,"if i want to find more information about things in general, what am i seeking increased knowledge","Increased knowledge means learning new facts about something, hence we seek for this while reading books or articles etc.. We don't use the word 'information'.","{'supports': 0, 'overall': 3, 'well_written': 0, 'related': 1, 'factual': 1, 'new_info': 1, 'unnecessary_info': 0, 'contrastive': 1}","{'supports': 0, 'overall': 1, 'well_written': 0, 'related': 0, 'factual': 0, 'new_info': 0, 'unnecessary_info': 1, 'contrastive': 0}","{'supports': 2, 'overall': 1, 'well_written': 0, 'related': 1, 'factual': 1, 'new_info': 1, 'unnecessary_info': 0, 'contrastive': 0}","{'supports': 1, 'overall': 2, 'well_written': 1, 'related': 1, 'factual': 0, 'new_info': 1, 'unnecessary_info': 1, 'contrastive': 0}","{'supports': 2, 'overall': 2, 'well_written': 2, 'related': 2, 'factual': 1, 'new_info': 2, 'unnecessary_info': 2, 'contrastive': 0}",0.49,0.44,0.87,0.84,-1.09,-0.8,0.132453235706504,0.0556414884074657,0.210526315789474,-0.254513905190311,
