"Sam came to despise his sister.  On the other hand, she felt what for him?",admire,"Admire is to regard with respect or warm approval. Sam came to despise his sister. On the other hand, she felt admire for him. Despise is to feel contempt or a deep repugnance for. Love is a deep affection and not the opposite feeling of despise which his sister had for him. Worship is adoration for a deity whereas Sam was her brother. Cherish is to protect and care whereas Sam came to despise his sister who had a complete opposite feeling for Sam and it was not cherish. Honor is not an opposite of Despise what Sam’s sister had for him.",admire is a word that describes a feeling of admiration.,She feels admiration towards her brother despite coming to hate herself after some time. Hate is emotionally charged word whereas admiring someone means respecting them. Despising is something opposite of admirer. Dislike/disregard,"{'supports': 3, 'overall': 4, 'well_written': 0, 'related': 1, 'factual': 1, 'new_info': 2, 'unnecessary_info': 1, 'contrastive': 1}","{'supports': 1, 'overall': 3, 'well_written': 1, 'related': 1, 'factual': 0, 'new_info': 1, 'unnecessary_info': 0, 'contrastive': 0}","{'supports': 1, 'overall': 1, 'well_written': 2, 'related': 1, 'factual': 0, 'new_info': 0, 'unnecessary_info': 0, 'contrastive': 0}","{'supports': 2, 'overall': 3, 'well_written': 1, 'related': 1, 'factual': 1, 'new_info': 1, 'unnecessary_info': 0, 'contrastive': 1}","{'supports': 1, 'overall': 2, 'well_written': 2, 'related': 2, 'factual': 2, 'new_info': 1, 'unnecessary_info': 3, 'contrastive': 0}",0.69,0.65,0.83,0.84,-1.14,-0.64,0.489115988044518,0.653274579918488,0,-0.186096842079694,
Justin couldn't dance long because he experienced what?,fatigue,Justin couldn't dance long because he experienced fatigue. To dance long is not related with having fun or meeting people. A person dont experience to be mannual. Become tired cant be experienced.,Justin couldn't dance long because he experienced fatigue.,Fatigue means tiredness caused due to physical exertion. So after dancing for sometime justin felt exhausted (fatigued) hence he left the party early. Pain means feeling hurt/discomfort while d,"{'supports': 2, 'overall': 3, 'well_written': 0, 'related': 1, 'factual': 1, 'new_info': 0, 'unnecessary_info': 0, 'contrastive': 1}","{'supports': 0, 'overall': 1, 'well_written': 0, 'related': 0, 'factual': 0, 'new_info': 0, 'unnecessary_info': 1, 'contrastive': 0}","{'supports': 2, 'overall': 2, 'well_written': 3, 'related': 2, 'factual': 1, 'new_info': 1, 'unnecessary_info': 0, 'contrastive': 0}","{'supports': 2, 'overall': 3, 'well_written': 1, 'related': 1, 'factual': 1, 'new_info': 1, 'unnecessary_info': 0, 'contrastive': 0}","{'supports': 2, 'overall': 2, 'well_written': 1, 'related': 2, 'factual': 3, 'new_info': 3, 'unnecessary_info': 3, 'contrastive': 1}",0.9,0.7,0.92,0.85,-0.06,-0.05,0.123091490979333,0.604814736759006,0.222277112237194,-0.186096842079694,
"She had a bad habit of washing hands over one thousand times a day, what did she experience as a result?",dry skin,She experience dry skin as a result of washing hands over one thousand times a day. She had a bad habit of washing her hands again and again which results into the dry skin. Health is not due to a bad habit. To become wet is not a result that she experienced. She didnt experience skin irritation by washing hands again and again. Medium is not something to be experienced.,washing hands over one thousand times a day causes dry skin.,"Washing too much causes excessive loss of water from body leading to dehydration. As her skin got dried up due to lack of moisture, she experienced this symptom. Increased heart rate means having high","{'supports': 3, 'overall': 2, 'well_written': 1, 'related': 1, 'factual': 1, 'new_info': 1, 'unnecessary_info': 0, 'contrastive': 1}","{'supports': 0, 'overall': 2, 'well_written': 1, 'related': 0, 'factual': 0, 'new_info': 0, 'unnecessary_info': 1, 'contrastive': 0}","{'supports': 2, 'overall': 2, 'well_written': 1, 'related': 2, 'factual': 1, 'new_info': 0, 'unnecessary_info': 0, 'contrastive': 0}","{'supports': 1, 'overall': 3, 'well_written': 1, 'related': 1, 'factual': 1, 'new_info': 2, 'unnecessary_info': 0, 'contrastive': 0}","{'supports': 2, 'overall': 2, 'well_written': 1, 'related': 3, 'factual': 3, 'new_info': 3, 'unnecessary_info': 1, 'contrastive': 0}",0.7,0.64,0.89,0.85,-0.77,-0.59,-0.057166195047503,0.51434449987364,0.668647849835732,0.0982946374365981,
cats have how many apendages?,four legs,"Appendage refers to something that is attached. Four legs are attached to cats while four paws are not. Four legs are used to walk unlike tail, whiskers and two eyes.",four legs is the most common way to describe a cat.,Cats have two forepaws (legs) and two hind paws (legs). They also use their tails like fifth leg while climbing trees. So they have 4 legs altogether.,"{'supports': 4, 'overall': 2, 'well_written': 1, 'related': 1, 'factual': 0, 'new_info': 1, 'unnecessary_info': 1, 'contrastive': 1}","{'supports': 0, 'overall': 1, 'well_written': 0, 'related': 0, 'factual': 0, 'new_info': 0, 'unnecessary_info': 1, 'contrastive': 0}","{'supports': 2, 'overall': 2, 'well_written': 2, 'related': 2, 'factual': 2, 'new_info': 0, 'unnecessary_info': 0, 'contrastive': 0}","{'supports': 1, 'overall': 2, 'well_written': 1, 'related': 1, 'factual': 0, 'new_info': 1, 'unnecessary_info': 1, 'contrastive': 0}","{'supports': 4, 'overall': 4, 'well_written': 4, 'related': 4, 'factual': 4, 'new_info': 4, 'unnecessary_info': 4, 'contrastive': 0}",0.56,0.63,0.86,0.85,-0.69,-0.22,0.272165526975909,0.628828145522533,0.182574185835055,0.0890870806374748,
"They were baking together, the instructions called for sugar so they got it out of the what?",cupboard,"They got sugar out of the cupboard. They were baking together and in cupboard the instructions was called for sugar. They might not sugar from the hallway. Instructions for sugar was not in every home. Out of candy bar or soda pop, they dont get sugar.",the instructions call for sugar so they got it out of the cupboard,Cupboards are storage places where we keep food items including sugars. Sugar is also kept inside fridge hence refrigerator is ruled out. We don't put things like chocolates in cupboard unless mentioned. Coff,"{'supports': 4, 'overall': 2, 'well_written': 0, 'related': 1, 'factual': 1, 'new_info': 0, 'unnecessary_info': 1, 'contrastive': 1}","{'supports': 0, 'overall': 2, 'well_written': 0, 'related': 0, 'factual': 0, 'new_info': 0, 'unnecessary_info': 1, 'contrastive': 0}","{'supports': 2, 'overall': 1, 'well_written': 1, 'related': 1, 'factual': 1, 'new_info': 0, 'unnecessary_info': 0, 'contrastive': 0}","{'supports': 2, 'overall': 3, 'well_written': 1, 'related': 1, 'factual': 1, 'new_info': 1, 'unnecessary_info': 0, 'contrastive': 1}","{'supports': 2, 'overall': 2, 'well_written': 1, 'related': 2, 'factual': 1, 'new_info': 1, 'unnecessary_info': 3, 'contrastive': 0}",0.78,0.49,0.88,0.85,-0.92,-0.55,0.363136519601282,0.462910049886276,0.500626174321759,0.372193684159388,
Where do salesman work?,shop,"Saleaman work ina shop. Sales take place at a shop, so salesman is required there. Frontdoor is not a place for someone to work. Salesman dont work at office or toy store. At carshow, there are no salesman.",salesman work in shop,Salesmen work at shops. They sell things for customers. Shopkeepers also make purchases from suppliers. Salesperson sells things for money while broker buys and sells things without paying any amount of money.,"{'supports': 4, 'overall': 1, 'well_written': 0, 'related': 1, 'factual': 0, 'new_info': 1, 'unnecessary_info': 0, 'contrastive': 1}","{'supports': 0, 'overall': 1, 'well_written': 0, 'related': 0, 'factual': 0, 'new_info': 0, 'unnecessary_info': 1, 'contrastive': 0}","{'supports': 2, 'overall': 1, 'well_written': 1, 'related': 1, 'factual': 0, 'new_info': 0, 'unnecessary_info': 0, 'contrastive': 0}","{'supports': 2, 'overall': 3, 'well_written': 1, 'related': 1, 'factual': 1, 'new_info': 1, 'unnecessary_info': 0, 'contrastive': 1}","{'supports': 2, 'overall': 1, 'well_written': 2, 'related': 2, 'factual': 1, 'new_info': 2, 'unnecessary_info': 2, 'contrastive': 1}",0.69,0.56,0.85,0.86,-1.52,-0.42,-0.198679853559757,0.594811877479463,0.473684210526316,0.0592348877759092,
What can you use hear other people and be heard yourself?,telephone,"By using telephone, you can hear other people and get yourself be heard. Song is not a way to hear people. Radio is not used to be heard yourself.. With ears, you can hear other people but they cant hear you by your ears. Mouth cant help you to hear other people.",telephones are used to hear other people and be heard yourself.,"Telephones allow two way communication between people at different locations using wires and sound waves . Other options such as radio , TV etc arenot used for personal conversation. Hearing aid doesnt work without batteries. Wireless ear buds","{'supports': 4, 'overall': 4, 'well_written': 0, 'related': 1, 'factual': 1, 'new_info': 2, 'unnecessary_info': 0, 'contrastive': 1}","{'supports': 0, 'overall': 2, 'well_written': 1, 'related': 1, 'factual': 0, 'new_info': 1, 'unnecessary_info': 1, 'contrastive': 0}","{'supports': 2, 'overall': 1, 'well_written': 1, 'related': 1, 'factual': 0, 'new_info': 0, 'unnecessary_info': 0, 'contrastive': 0}","{'supports': 1, 'overall': 2, 'well_written': 1, 'related': 1, 'factual': 0, 'new_info': 1, 'unnecessary_info': 1, 'contrastive': 0}","{'supports': 2, 'overall': 1, 'well_written': 1, 'related': 1, 'factual': 1, 'new_info': 4, 'unnecessary_info': 4, 'contrastive': 0}",0.75,0.62,0.89,0.85,-0.97,-0.45,0,0.303433042454504,0.334855411264458,0.045501575519329,
The cat was annoying because it would not leave James alone.  Whenever he locked himself down for work it would find its way into where?,bedroom,One can work from the bedroom and not from outside or from the backyard. Bedroom is a room in the house unlike a microwave and meat loaf. Cats can find their way into the bedroom.,james locked himself down for work in his bedroom,"Everyone knows about cats. They like entering any place they want without permission. Therefore, this question isn't difficult at all. If a cat enters your room then it will surely look around. This means if we say ""wherever""","{'supports': 4, 'overall': 4, 'well_written': 1, 'related': 1, 'factual': 1, 'new_info': 2, 'unnecessary_info': 0, 'contrastive': 1}","{'supports': 0, 'overall': 1, 'well_written': 0, 'related': 0, 'factual': 0, 'new_info': 0, 'unnecessary_info': 1, 'contrastive': 0}","{'supports': 1, 'overall': 0, 'well_written': 1, 'related': 1, 'factual': 1, 'new_info': 0, 'unnecessary_info': 0, 'contrastive': 0}","{'supports': 2, 'overall': 4, 'well_written': 1, 'related': 1, 'factual': 1, 'new_info': 2, 'unnecessary_info': 0, 'contrastive': 1}","{'supports': 1, 'overall': 2, 'well_written': 1, 'related': 1, 'factual': 1, 'new_info': 1, 'unnecessary_info': 1, 'contrastive': 0}",0.22,0.58,0.85,0.85,-1.41,-0.74,-0.0629940788348712,0.952380952380953,0,0.423659272868162,
"They said they started what at first sight, well before their first kiss?",falling in love,"Falling in love is the development of strong feelings of attachment and love, usually towards another person. They said they started falling in love at first sight, well before their first kiss. Fall in love is not what started well before their first kiss, as it is about first sight before their first kiss. Smile is not what started well before their first kiss, as smiling at each other never always result in kissing. Embrace is not what started well before their first kiss, as it is not what happens in first sight. Asking questions is not what started well before their first kiss, as nobody starts asking questions at first sight.",falling in love is a common reaction to first sight.,Falling in love refers to romantic attraction between two people which begins after meeting each other for the first time. Well before means that this relationship existed prior to any interaction with the opposite gender member. There were no previous interactions before they fell in,"{'supports': 0, 'overall': 3, 'well_written': 0, 'related': 1, 'factual': 1, 'new_info': 1, 'unnecessary_info': 1, 'contrastive': 1}","{'supports': 0, 'overall': 2, 'well_written': 1, 'related': 1, 'factual': 0, 'new_info': 1, 'unnecessary_info': 1, 'contrastive': 0}","{'supports': 1, 'overall': 1, 'well_written': 1, 'related': 1, 'factual': 0, 'new_info': 0, 'unnecessary_info': 0, 'contrastive': 0}","{'supports': 2, 'overall': 3, 'well_written': 1, 'related': 1, 'factual': 1, 'new_info': 1, 'unnecessary_info': 0, 'contrastive': 1}","{'supports': 2, 'overall': 2, 'well_written': 1, 'related': 1, 'factual': 2, 'new_info': 3, 'unnecessary_info': 3, 'contrastive': 0}",0.77,0.79,0.85,0.85,-0.69,-0.42,0.445131907259726,0.057166195047503,-0.242535625036333,0.151716521227252,
"It is hard to predict a rebound in basketball, this is because the ball and rim are what?",round,"Round means to be circular in shape like the ball and rim in basketball, making it hard to predict a rebound. Rim can neither be punctured nor is full of air. Rim isn’t a ball to do the other options.",basketball is a sport where the ball and rim are round.,"Rebound is defined as the act of something returning back from where it came from after hitting another object. This means that the ball rebounds against anything and not just rims. Thus, basketball games involve many players making multiple shots at different angles","{'supports': 4, 'overall': 3, 'well_written': 1, 'related': 1, 'factual': 1, 'new_info': 1, 'unnecessary_info': 0, 'contrastive': 1}","{'supports': 1, 'overall': 3, 'well_written': 1, 'related': 1, 'factual': 0, 'new_info': 1, 'unnecessary_info': 0, 'contrastive': 0}","{'supports': 2, 'overall': 2, 'well_written': 1, 'related': 2, 'factual': 1, 'new_info': 0, 'unnecessary_info': 0, 'contrastive': 0}","{'supports': 2, 'overall': 3, 'well_written': 1, 'related': 1, 'factual': 1, 'new_info': 1, 'unnecessary_info': 0, 'contrastive': 0}","{'supports': 1, 'overall': 1, 'well_written': 1, 'related': 1, 'factual': 1, 'new_info': 1, 'unnecessary_info': 0, 'contrastive': 0}",0.76,0.56,0.87,0.84,-0.86,-0.56,0.594811877479463,0.77151674981046,0.668647849835732,0.544331053951818,
If you answering questions you only get credit if you're what?,correct,Credit means acknowledgement or praise given to someone when they are correct. So if you are answering questions you only get credit if you are correct. Answering questions can also be done without teaching and the other options does not give one credit while answering questions.,correct answers are given only if you are correct.,"You only get credit for your answers if they were right. So, if you are wrong then you wont get any credits even though you answered correctly. This question is about giving people points based upon their performance and not giving them anything at all isn","{'supports': 1, 'overall': 4, 'well_written': 1, 'related': 1, 'factual': 1, 'new_info': 2, 'unnecessary_info': 0, 'contrastive': 1}","{'supports': 0, 'overall': 1, 'well_written': 0, 'related': 0, 'factual': 0, 'new_info': 0, 'unnecessary_info': 1, 'contrastive': 0}","{'supports': 1, 'overall': 1, 'well_written': 1, 'related': 1, 'factual': 1, 'new_info': 0, 'unnecessary_info': 0, 'contrastive': 0}","{'supports': 1, 'overall': 4, 'well_written': 1, 'related': 1, 'factual': 1, 'new_info': 2, 'unnecessary_info': 0, 'contrastive': 1}","{'supports': 2, 'overall': 1, 'well_written': 1, 'related': 2, 'factual': 2, 'new_info': 2, 'unnecessary_info': 1, 'contrastive': 0}",0.23,0.71,0.85,0.88,-0.8,-0.22,0,1,0.182574185835055,0.108147614087175,
"Danny thought that the show was divine.   Lila disagreed.  She didn't think it was bad, but she thought it was what?",humdrum,"Humdrum means lacking excitement or variety; boringly monotonous. Danny thought that the show was divine. Lila disagreed. She didn't think it was bad, but she thought it was humdrum. Danny thought that the show was divine means it was not godless. Danny thought that the show was divine while Lila didn’t think it bad means it wasn’t horrible. Danny thought that the show was divine means it was not undivine. It is about the show or a display and they are non-living things and cannot be termed as mortal or immortal.",humdrum is a word that describes a lack of excitement or excitement.,Humdrum means ordinary or dull. There were no other options for this question.,"{'supports': 3, 'overall': 2, 'well_written': 0, 'related': 1, 'factual': 1, 'new_info': 2, 'unnecessary_info': 1, 'contrastive': 1}","{'supports': 1, 'overall': 2, 'well_written': 1, 'related': 1, 'factual': 0, 'new_info': 1, 'unnecessary_info': 0, 'contrastive': 0}","{'supports': 1, 'overall': 1, 'well_written': 1, 'related': 1, 'factual': 1, 'new_info': 0, 'unnecessary_info': 0, 'contrastive': 0}","{'supports': 0, 'overall': 1, 'well_written': 0, 'related': 0, 'factual': 1, 'new_info': 0, 'unnecessary_info': 1, 'contrastive': 0}","{'supports': 1, 'overall': 2, 'well_written': 1, 'related': 1, 'factual': 1, 'new_info': 0, 'unnecessary_info': 0, 'contrastive': 0}",0.51,0.37,0.85,0.82,-0.74,-1.08,0.350438322025231,0,0,0.100125234864352,
A percussion instrument can be obtained in what sort of place?,music store,A percussion instrument means any instrument that makes a sound when it is hit. Such instruments are usually tuned and used to compose music. Such musical instruments are obtained in a music store. Marching band does not sell perscussion instruments. Pawn shops usually do not have musical instruments.Orchestra is not a place. People usually do not always have percussion instruments in their own homes.,music stores sell percussion instruments.,"Percussive instruments like drums are available for purchase from Music stores where they come with instructions, accessories etc. These musical instruments are also sometimes used by musicians during concerts, ceremonies etc. Instrumental shops do not sell","{'supports': 3, 'overall': 3, 'well_written': 1, 'related': 1, 'factual': 1, 'new_info': 2, 'unnecessary_info': 1, 'contrastive': 1}","{'supports': 1, 'overall': 2, 'well_written': 1, 'related': 1, 'factual': 0, 'new_info': 0, 'unnecessary_info': 1, 'contrastive': 0}","{'supports': 1, 'overall': 2, 'well_written': 1, 'related': 1, 'factual': 2, 'new_info': 1, 'unnecessary_info': 0, 'contrastive': 0}","{'supports': 2, 'overall': 3, 'well_written': 1, 'related': 1, 'factual': 1, 'new_info': 1, 'unnecessary_info': 0, 'contrastive': 1}","{'supports': 2, 'overall': 2, 'well_written': 1, 'related': 2, 'factual': 2, 'new_info': 2, 'unnecessary_info': 1, 'contrastive': 1}",0.72,0.77,0.87,0.87,-1.31,-0.19,0.333848930444794,0.743160535617538,0.379628301182648,0.563601861976635,
"He had only experienced tangible and corporeal events in his life, but the hippy girl opened up his what side?",spiritual,Experiences are generally two types which are caused by spiritual and corporeal events. The hippy girl opened up his spiritual side. Insubstantial and mind are not sides of a person and the other options come under spiritual.,"he had only experienced tangible and corporeal events in his life, but the hippy girl opened up his spiritual side",Hippie girls are generally more interested in love than anything else. They tend to get involved with men much younger them. This question asks about experiences rather than actions/behaviour.,"{'supports': 4, 'overall': 4, 'well_written': 1, 'related': 1, 'factual': 1, 'new_info': 0, 'unnecessary_info': 0, 'contrastive': 1}","{'supports': 0, 'overall': 2, 'well_written': 1, 'related': 0, 'factual': 0, 'new_info': 1, 'unnecessary_info': 1, 'contrastive': 0}","{'supports': 2, 'overall': 2, 'well_written': 1, 'related': 2, 'factual': 1, 'new_info': 0, 'unnecessary_info': 0, 'contrastive': 0}","{'supports': 1, 'overall': 1, 'well_written': 0, 'related': 0, 'factual': 0, 'new_info': 0, 'unnecessary_info': 1, 'contrastive': 0}","{'supports': 1, 'overall': 1, 'well_written': 2, 'related': 1, 'factual': 1, 'new_info': 3, 'unnecessary_info': 2, 'contrastive': 1}",0.69,0.54,0.88,0.84,-0.27,-0.46,-0.153896752812773,0.346410161513775,0.780720058358827,-0.705023987910633,
James was contemplating the research results.  What was James doing?,thinking,"James was contemplating and thinking deeply about the research results. Contemplating answers to problems leads to discovery and excitement to buzzing and meaning to understanding, and not search results. Contemplating to think leads to reflection.",thinking is the action of contemplating.,Researchers may think about their work after obtaining some data from experimentations. They don't just sit idle with a blank face.,"{'supports': 0, 'overall': 2, 'well_written': 0, 'related': 1, 'factual': 1, 'new_info': 1, 'unnecessary_info': 0, 'contrastive': 1}","{'supports': 1, 'overall': 2, 'well_written': 1, 'related': 1, 'factual': 0, 'new_info': 1, 'unnecessary_info': 0, 'contrastive': 0}","{'supports': 1, 'overall': 1, 'well_written': 1, 'related': 1, 'factual': 1, 'new_info': 0, 'unnecessary_info': 0, 'contrastive': 0}","{'supports': 1, 'overall': 3, 'well_written': 1, 'related': 1, 'factual': 1, 'new_info': 1, 'unnecessary_info': 0, 'contrastive': 0}","{'supports': 1, 'overall': 1, 'well_written': 1, 'related': 1, 'factual': 0, 'new_info': 1, 'unnecessary_info': 1, 'contrastive': 1}",0.74,0.38,0.86,0.85,-1.26,-0.49,0.263157894736842,0.445131907259726,0.0592348877759092,-0.173421993904824,
where can you sit to work on your needlepoint near your front door?,livingroom,"One can sit inliving room while working on needlepoint. Also, a living room is the nearest to front door. All the other options are incorrect as one cannot sit there.",livingroom is the place to sit to work on needlepoint.,"If we say sitting room then it will become incorrect since this word means drawing room whereas if someone says ""living room"" they mean kitchen or dining room (depending upon how many rooms their house consists). So from this context we know that","{'supports': 3, 'overall': 3, 'well_written': 1, 'related': 1, 'factual': 1, 'new_info': 0, 'unnecessary_info': 0, 'contrastive': 0}","{'supports': 0, 'overall': 1, 'well_written': 0, 'related': 0, 'factual': 0, 'new_info': 0, 'unnecessary_info': 1, 'contrastive': 0}","{'supports': 1, 'overall': 1, 'well_written': 1, 'related': 1, 'factual': 1, 'new_info': 0, 'unnecessary_info': 0, 'contrastive': 0}","{'supports': 2, 'overall': 3, 'well_written': 1, 'related': 1, 'factual': 1, 'new_info': 1, 'unnecessary_info': 0, 'contrastive': 1}","{'supports': 0, 'overall': 0, 'well_written': 1, 'related': 1, 'factual': 1, 'new_info': 3, 'unnecessary_info': 3, 'contrastive': 4}",0.76,0.58,0.89,0.85,-0.77,-0.78,0.0629940788348712,0.77151674981046,0.845154254728517,-0.955533085905909,
"I have some food that I want to eat right now, where would I put it?",plate,Most of the Food needs to be put on plate before being eaten as Plate can be used to put the food.Food cannot be put in cup as cup is used to put the liquid items.Food cannot be put in the kitchen when person wants to eat right now. Food cannot be put in the pantry when person wants to eat right now as pantry is for storing the food. Food cannot be put in the jar before eating as jar is used to store the food.,plate is the only place where you can put food.,Plate holds food and we use plates for eating purpose. If you don’t have any place then you must buy one before putting your food inside it otherwise you will get hungry and lose focus during examination. You wont keep anything,"{'supports': 4, 'overall': 3, 'well_written': 0, 'related': 1, 'factual': 1, 'new_info': 2, 'unnecessary_info': 0, 'contrastive': 1}","{'supports': 0, 'overall': 1, 'well_written': 0, 'related': 0, 'factual': 0, 'new_info': 0, 'unnecessary_info': 1, 'contrastive': 0}","{'supports': 2, 'overall': 2, 'well_written': 1, 'related': 2, 'factual': 2, 'new_info': 0, 'unnecessary_info': 0, 'contrastive': 0}","{'supports': 2, 'overall': 3, 'well_written': 0, 'related': 1, 'factual': 0, 'new_info': 1, 'unnecessary_info': 1, 'contrastive': 0}","{'supports': 2, 'overall': 2, 'well_written': 1, 'related': 2, 'factual': 2, 'new_info': 5, 'unnecessary_info': 4, 'contrastive': 0}",0.6,0.64,0.85,0.85,-1.2,-0.72,-0.058925565098879,0.565752381856018,0.374634324632678,0.130558241966773,
Where might informational pamphlets be found?,library,"Out of all the options, the most fesiable place is a library thta has a collection of various phamplets on all type of information. A library is a sure shot place to have informational phampalets. All the other options are not fesiable as they might not have all types of informational phamplets.",library is a place where informational pamphlets can be found.,Informative material such as brochures etc may often be seen at libraries. They can also be available for purchase online from websites like Amazon.,"{'supports': 1, 'overall': 3, 'well_written': 0, 'related': 1, 'factual': 0, 'new_info': 1, 'unnecessary_info': 0, 'contrastive': 1}","{'supports': 1, 'overall': 3, 'well_written': 1, 'related': 1, 'factual': 0, 'new_info': 1, 'unnecessary_info': 1, 'contrastive': 0}","{'supports': 1, 'overall': 2, 'well_written': 1, 'related': 2, 'factual': 1, 'new_info': 0, 'unnecessary_info': 0, 'contrastive': 0}","{'supports': 1, 'overall': 3, 'well_written': 1, 'related': 1, 'factual': 0, 'new_info': 1, 'unnecessary_info': 1, 'contrastive': 0}","{'supports': 4, 'overall': 4, 'well_written': 4, 'related': 4, 'factual': 4, 'new_info': 4, 'unnecessary_info': 1, 'contrastive': 1}",0.44,0.4,0.84,0.83,-0.8,-0.76,0.445131907259726,0.445131907259726,0.300375704593055,0.198679853559757,
