What can an adult do that a young child cannot in the morning?,dress herself,An adult can dress herself in the morning. A young child cannot dress herself. An adult person cant give up or drink beer or marry in the morning. Work might not be done in the morning by an adult.,adult is a person,"Young children do not know how to put clothes themselves, they depend upon their parents for this task. Adults should know about getting dressed and putting up clothes before leaving home. This skill is developed with time.","{'supports': 1, 'overall': 3, 'well_written': 1, 'related': 1, 'factual': 0, 'new_info': 0, 'unnecessary_info': 0, 'contrastive': 0}","{'supports': 0, 'overall': 1, 'well_written': 0, 'related': 0, 'factual': 0, 'new_info': 0, 'unnecessary_info': 1, 'contrastive': 0}","{'supports': 0, 'overall': 0, 'well_written': 0, 'related': 0, 'factual': 0, 'new_info': 0, 'unnecessary_info': 0, 'contrastive': 0}","{'supports': 1, 'overall': 3, 'well_written': 1, 'related': 1, 'factual': 1, 'new_info': 1, 'unnecessary_info': 1, 'contrastive': 0}","{'supports': 2, 'overall': 1, 'well_written': 3, 'related': 2, 'factual': 2, 'new_info': 1, 'unnecessary_info': 0, 'contrastive': 0}",0.53,0.52,0.83,0.85,-1.96,-0.38,0.198679853559757,0.636284762975778,0.305505046330389,0.382691898587952,
"Billy likes eating breakfast in bed, but he doesn't do it often.  He likes his clean sheets too much. Why doesn't he eat breakfast in bed that often?",spills,Eating breakfast in bed regularly have more chances that you can spill on bedsheet andBilly likes clean bedsheet.Spill bedsheet doesn't give pleasure.Eating in bed doesn't cause indigestion always.eating in bed cannot be as convenient as eating on dining table.eating in bed doesn't make you guilty.,spills are a common cause of not eating breakfast in bed.,This question needs a bit more thought than just picking the obvious answer. Breakfast in bed sounds like fun if you don't care about getting messy. If someone wanted to avoid having their clothes get stained they wouldn't put them,"{'supports': 3, 'overall': 2, 'well_written': 0, 'related': 1, 'factual': 1, 'new_info': 2, 'unnecessary_info': 1, 'contrastive': 1}","{'supports': 0, 'overall': 1, 'well_written': 0, 'related': 0, 'factual': 0, 'new_info': 0, 'unnecessary_info': 1, 'contrastive': 0}","{'supports': 1, 'overall': 1, 'well_written': 2, 'related': 1, 'factual': 2, 'new_info': 1, 'unnecessary_info': 0, 'contrastive': 0}","{'supports': 1, 'overall': 4, 'well_written': 1, 'related': 1, 'factual': 1, 'new_info': 2, 'unnecessary_info': 0, 'contrastive': 1}","{'supports': 1, 'overall': 1, 'well_written': 1, 'related': 2, 'factual': 1, 'new_info': 1, 'unnecessary_info': 0, 'contrastive': 1}",0.69,0.66,0.86,0.83,-0.89,-0.42,0.125988157669742,0.411475599898912,-0.14638501094228,0,
If you're standing in line and the line isn't moving what might you feel?,anger,People feel angry when they hate something. People hate waiting in line therefore they feel anger. All other options are not feelings.,if you're standing in line and the line isn't moving what might you feel anger,Being stuck in queue for long time may lead to frustration and annoyed feelings. Standing idle with nothing happening will make us angry. We don't get upset if we stand idly without anything happening.,"{'supports': 4, 'overall': 4, 'well_written': 1, 'related': 1, 'factual': 1, 'new_info': 0, 'unnecessary_info': 0, 'contrastive': 1}","{'supports': 0, 'overall': 1, 'well_written': 0, 'related': 0, 'factual': 0, 'new_info': 0, 'unnecessary_info': 1, 'contrastive': 0}","{'supports': 1, 'overall': 1, 'well_written': 1, 'related': 1, 'factual': 1, 'new_info': 0, 'unnecessary_info': 0, 'contrastive': 0}","{'supports': 2, 'overall': 3, 'well_written': 1, 'related': 1, 'factual': 1, 'new_info': 1, 'unnecessary_info': 0, 'contrastive': 1}","{'supports': 2, 'overall': 2, 'well_written': 1, 'related': 2, 'factual': 2, 'new_info': 0, 'unnecessary_info': 1, 'contrastive': 0}",0.65,0.6,0.86,0.87,-0.79,-0.03,0,0.843274042711568,0.692820323027551,0.6,
Where is a razor likely to be found on vacation?,suitcase,A razor is likely to be found in suitcase on vacations. Box cutter is not available on vacation. A razor cant be found in a psycho's pocket. Barber shop or medicine cabinet is not found on vacation.,suitcases are used for traveling.,While travelling people carry their luggage with them and among other things they also take shaving kit for themselves. So where else will we look if not in a bag/suit case! Shower room is incorrect since shave is done,"{'supports': 0, 'overall': 2, 'well_written': 1, 'related': 1, 'factual': 0, 'new_info': 1, 'unnecessary_info': 0, 'contrastive': 1}","{'supports': 1, 'overall': 2, 'well_written': 1, 'related': 1, 'factual': 0, 'new_info': 1, 'unnecessary_info': 0, 'contrastive': 0}","{'supports': 0, 'overall': 1, 'well_written': 1, 'related': 1, 'factual': 1, 'new_info': 0, 'unnecessary_info': 0, 'contrastive': 0}","{'supports': 2, 'overall': 3, 'well_written': 1, 'related': 1, 'factual': 1, 'new_info': 1, 'unnecessary_info': 0, 'contrastive': 1}","{'supports': 1, 'overall': 2, 'well_written': 1, 'related': 2, 'factual': 1, 'new_info': 2, 'unnecessary_info': 1, 'contrastive': 0}",0.35,0.59,0.85,0.84,-1.09,-0.57,0.631578947368421,0.378516649305113,0.344123600805843,0.421052631578947,
If you have beans while eating breakfast you may experience what?,gas,Beans is gassy food andYou may experience gas if you eat gassy food.You feel fullness after eating any food.Beans doesn't cause indigestion. You gain energy from all the food.Beans doesn't cause stomach ache usually.,beans are a source of gas.,"Bean cause flatulence/gas if consumed with food like bread etc. This will make your stomach upset, causing indigestion. You feel hungry after having too much protein at lunchtime also. Eat more","{'supports': 2, 'overall': 3, 'well_written': 0, 'related': 1, 'factual': 1, 'new_info': 2, 'unnecessary_info': 0, 'contrastive': 1}","{'supports': 0, 'overall': 1, 'well_written': 0, 'related': 0, 'factual': 0, 'new_info': 0, 'unnecessary_info': 1, 'contrastive': 0}","{'supports': 0, 'overall': 0, 'well_written': 1, 'related': 1, 'factual': 0, 'new_info': 0, 'unnecessary_info': 0, 'contrastive': 0}","{'supports': 1, 'overall': 2, 'well_written': 1, 'related': 1, 'factual': 0, 'new_info': 1, 'unnecessary_info': 1, 'contrastive': 0}","{'supports': 1, 'overall': 1, 'well_written': 1, 'related': 3, 'factual': 3, 'new_info': 1, 'unnecessary_info': 1, 'contrastive': 1}",0.68,0.79,0.85,0.88,-0.91,-0.35,0.0601929265428846,0.354005216196922,-0.421350485800192,-0.120385853085769,
Where could you put a dollar that would make it hard to get out without breaking?,piggy bank,"Piggy bank is a money box, typically one shaped like a pig. You could put a dollar in a piggy bank that would make it hard to get out without breaking. Cash drawers are wide mouthed from where you can easily take out or keep in a dollar. Putting dollar in a purse is also easy to get it out as you can put your hand completely in it. Boxes aren’t usually used to put a dollar but even though if you keep it you can get it out so easily. Pockets can be surfed by our hands and so pocket isn’t the hard option.",piggy bank is a place where you can put a dollar that would make it hard to get out without breaking.,Piggy banks keep money safe for future use. They also help kids learn how to save their own earnings. Money can easily flow through credit cards while dollars can be kept inside a wallet. Coffee table is something we,"{'supports': 1, 'overall': 4, 'well_written': 1, 'related': 1, 'factual': 1, 'new_info': 1, 'unnecessary_info': 1, 'contrastive': 1}","{'supports': 1, 'overall': 2, 'well_written': 1, 'related': 1, 'factual': 0, 'new_info': 1, 'unnecessary_info': 1, 'contrastive': 0}","{'supports': 4, 'overall': 3, 'well_written': 2, 'related': 4, 'factual': 4, 'new_info': 1, 'unnecessary_info': 0, 'contrastive': 0}","{'supports': 2, 'overall': 3, 'well_written': 1, 'related': 1, 'factual': 1, 'new_info': 2, 'unnecessary_info': 0, 'contrastive': 1}","{'supports': 2, 'overall': 2, 'well_written': 1, 'related': 2, 'factual': 1, 'new_info': 0, 'unnecessary_info': 0, 'contrastive': 0}",0.84,0.7,0.89,0.85,-0.85,-0.64,0.641688947919748,0.577350269189626,0.077151674981046,0.412393049421161,
"The man tried to run, but he could not. He could that he could only move by doing what?",walking,"A person moves by walking and a person who could not run can only walk. One cant move by merely standing or standing still. He cant run, so he cant go quickly. Walking is always slow only.",walking is a way of moving.,"A person moves by walking and a person who could not run can only walk. One cant move by merely standing or standing still. He cant run, so he cant go quickly. Walking is always slow only.","{'supports': 2, 'overall': 4, 'well_written': 1, 'related': 1, 'factual': 1, 'new_info': 2, 'unnecessary_info': 0, 'contrastive': 1}","{'supports': 0, 'overall': 2, 'well_written': 0, 'related': 1, 'factual': 0, 'new_info': 0, 'unnecessary_info': 1, 'contrastive': 0}","{'supports': 1, 'overall': 1, 'well_written': 2, 'related': 1, 'factual': 1, 'new_info': 0, 'unnecessary_info': 0, 'contrastive': 0}","{'supports': 2, 'overall': 3, 'well_written': 1, 'related': 1, 'factual': 1, 'new_info': 1, 'unnecessary_info': 0, 'contrastive': 1}","{'supports': 2, 'overall': 2, 'well_written': 2, 'related': 2, 'factual': 2, 'new_info': 2, 'unnecessary_info': 0, 'contrastive': 0}",0.57,1,0.84,1,-0.79,0.82,0,0.874385649785188,0.150187852296528,0.566946709513841,
"God rested after building a lot of stuff, so what did he build?",everything,God is considered to have built the entire universe so god built everything. Compassion and imagination cannot be built and the other options are not a lot of stuff.,"God rested after building a lot of stuff, so what did he build everything","Creator created everything, then took his creations for granted. That implies creation was built by god. God didn’t create anything new at all. So the answer must be “everything”.","{'supports': 1, 'overall': 4, 'well_written': 1, 'related': 1, 'factual': 1, 'new_info': 2, 'unnecessary_info': 0, 'contrastive': 1}","{'supports': 0, 'overall': 1, 'well_written': 0, 'related': 0, 'factual': 0, 'new_info': 0, 'unnecessary_info': 1, 'contrastive': 0}","{'supports': 1, 'overall': 1, 'well_written': 0, 'related': 2, 'factual': 1, 'new_info': 0, 'unnecessary_info': 0, 'contrastive': 0}","{'supports': 2, 'overall': 3, 'well_written': 1, 'related': 1, 'factual': 1, 'new_info': 1, 'unnecessary_info': 0, 'contrastive': 1}","{'supports': 0, 'overall': 0, 'well_written': 1, 'related': 0, 'factual': 0, 'new_info': 0, 'unnecessary_info': 0, 'contrastive': 0}",0.55,0.51,0.86,0.88,-0.93,0.13,0,0.666666666666667,0.162221421130763,-0.0890870806374748,
Why do people socialize when they first get a new job?,meet new people,"People meets new people at new job. When they first get a new job, people socialize because they meet new people. People dont socialize for a small talk. At job, a person might not make friends. People might not get a raise by socialising at a new job. A job is not a place where people gets socialize to talk to people.",socializing when they first get a new job is a way to meet new people.,"As soon as we start working somewhere, we try to make friends with our colleagues for various reasons like making life easier at workplace, having someone to talk about problems related to your job etc. These days, most companies also organise events where","{'supports': 0, 'overall': 2, 'well_written': 0, 'related': 1, 'factual': 1, 'new_info': 2, 'unnecessary_info': 0, 'contrastive': 1}","{'supports': 1, 'overall': 3, 'well_written': 1, 'related': 1, 'factual': 0, 'new_info': 1, 'unnecessary_info': 0, 'contrastive': 0}","{'supports': 2, 'overall': 2, 'well_written': 2, 'related': 2, 'factual': 2, 'new_info': 1, 'unnecessary_info': 0, 'contrastive': 0}","{'supports': 1, 'overall': 3, 'well_written': 1, 'related': 1, 'factual': 0, 'new_info': 1, 'unnecessary_info': 0, 'contrastive': 0}","{'supports': 1, 'overall': 3, 'well_written': 1, 'related': 3, 'factual': 3, 'new_info': 3, 'unnecessary_info': 1, 'contrastive': 0}",0.82,0.64,0.9,0.86,-0.68,-0.35,0.300375704593055,0.300375704593055,0,0.550688791753935,
Why does a bodybuilder eat so much?,gain weight,Body builder needs to gain muscle in bulking phase soGainig muscle requires to eat more calories and result in gaining weight. Eating so much doesn't give you pleasant conversation.Body builder cannot store food in his body for winter. eating so much is not required to satisfy the hunger.Person doesn't eat lot of food for sounds of digestion,bodybuilders eat a lot to gain weight.,"Bodybuilders must consume more calories than they burn each day for muscle growth. As such, they often gain weight while training. In order to lose fat from their bodies without losing lean tissue mass, these individuals should reduce the amount of","{'supports': 4, 'overall': 3, 'well_written': 0, 'related': 1, 'factual': 1, 'new_info': 2, 'unnecessary_info': 0, 'contrastive': 1}","{'supports': 0, 'overall': 2, 'well_written': 1, 'related': 0, 'factual': 0, 'new_info': 0, 'unnecessary_info': 1, 'contrastive': 0}","{'supports': 1, 'overall': 1, 'well_written': 2, 'related': 1, 'factual': 0, 'new_info': 0, 'unnecessary_info': 0, 'contrastive': 0}","{'supports': 1, 'overall': 4, 'well_written': 1, 'related': 1, 'factual': 1, 'new_info': 2, 'unnecessary_info': 0, 'contrastive': 0}","{'supports': 3, 'overall': 2, 'well_written': 1, 'related': 4, 'factual': 2, 'new_info': 1, 'unnecessary_info': 0, 'contrastive': 0}",0.71,0.64,0.88,0.86,-1.2,-0.33,-0.247536885744169,0.534522483824849,0.0936585811581694,0.449073119510249,
"He kept throwing the stick away, but thanks to the dog the stick would always what?",come back,"Dogs generally play a game of fetch and when one throws something away, dogs come back with it, So thanks to the dog the stick always comes back. Come here comes under come back and the stick will be present even if there was no dog. The stick won't be what the other options say after throwing it away.",dogs are able to return sticks.,Throw means send something far from where you stand. If throw returns then it will return nearer to your place than before. So if a stick keeps returning towards his hand then surely he must keep sending them away. But since they were coming back,"{'supports': 3, 'overall': 3, 'well_written': 0, 'related': 1, 'factual': 1, 'new_info': 1, 'unnecessary_info': 0, 'contrastive': 1}","{'supports': 0, 'overall': 1, 'well_written': 0, 'related': 0, 'factual': 0, 'new_info': 0, 'unnecessary_info': 1, 'contrastive': 0}","{'supports': 4, 'overall': 2, 'well_written': 2, 'related': 2, 'factual': 1, 'new_info': 2, 'unnecessary_info': 1, 'contrastive': 1}","{'supports': 2, 'overall': 3, 'well_written': 1, 'related': 1, 'factual': 1, 'new_info': 1, 'unnecessary_info': 0, 'contrastive': 1}","{'supports': 0, 'overall': 1, 'well_written': 1, 'related': 0, 'factual': 2, 'new_info': 2, 'unnecessary_info': 4, 'contrastive': 4}",0.78,0.63,0.85,0.85,-1.43,-0.88,0,0.843274042711568,0.461690258438319,-0.410791918128875,
"He was on tilt and losing hand after hand, the playing cards were causing him great what?",anger,"When one loses a game after a game, they get irritated and hence get angry as they lose. All the other options are not what is caused when one loses hand after hand in a card game hence are incorrect.",anger is a feeling of anger.,If someone loses too many hands in poker then they get angry about their bad luck. They start yelling at people around them if they keep losing more than 3-4 hands consecutively. Tilt refers to getting emotionally,"{'supports': 1, 'overall': 4, 'well_written': 1, 'related': 1, 'factual': 1, 'new_info': 2, 'unnecessary_info': 0, 'contrastive': 1}","{'supports': 1, 'overall': 2, 'well_written': 0, 'related': 1, 'factual': 0, 'new_info': 0, 'unnecessary_info': 1, 'contrastive': 0}","{'supports': 0, 'overall': 1, 'well_written': 2, 'related': 1, 'factual': 1, 'new_info': 2, 'unnecessary_info': 1, 'contrastive': 1}","{'supports': 1, 'overall': 3, 'well_written': 1, 'related': 1, 'factual': 1, 'new_info': 1, 'unnecessary_info': 0, 'contrastive': 0}","{'supports': 2, 'overall': 2, 'well_written': 1, 'related': 2, 'factual': 1, 'new_info': 2, 'unnecessary_info': 1, 'contrastive': 1}",0.36,0.55,0.86,0.88,-1.11,-0.16,0.0540738070435875,0.743160535617538,0.228664780190012,0.58925565098879,
On what would you use a knob to change settings?,control panel,Control panel is a metal box which contains important electrical devices that control and monitor a mechanical process electrically. We would use a knob on control panel to change settings. Opening doors has a knob but aren’t used for change settings but for opening doors. A cell phone doesn’t have a knob on it to change settings. Television has the control panel with a knob which is used to change settings. Doorway has a knob to open and close the door but can’t be used to change settings.,knobs are used to change settings.,"Knobs are used for changing settings on different types of devices such as fans, air conditioners etc. They are not used for changing temperature in oven, changing clothes and changing music channel respectively. Weather changes with time whereas clothes don't","{'supports': 1, 'overall': 4, 'well_written': 1, 'related': 1, 'factual': 1, 'new_info': 2, 'unnecessary_info': 0, 'contrastive': 1}","{'supports': 0, 'overall': 2, 'well_written': 1, 'related': 1, 'factual': 0, 'new_info': 1, 'unnecessary_info': 1, 'contrastive': 0}","{'supports': 0, 'overall': 0, 'well_written': 2, 'related': 1, 'factual': 0, 'new_info': 0, 'unnecessary_info': 0, 'contrastive': 0}","{'supports': 2, 'overall': 4, 'well_written': 1, 'related': 1, 'factual': 1, 'new_info': 2, 'unnecessary_info': 0, 'contrastive': 1}","{'supports': 1, 'overall': 2, 'well_written': 1, 'related': 1, 'factual': 2, 'new_info': 3, 'unnecessary_info': 4, 'contrastive': 0}",0.46,0.45,0.86,0.85,-1.21,-0.9,0.378516649305113,0.874385649785188,-0.130744090092123,0.0481125224324688,
"He got tickets to go to performance of his idol, he had a lot of what for him?",admiration,Admiration means respect and warm approval. He got tickets to the performance of his idol because he had a lot admiration for him. One cannot have a lot what is given in the other options for an idol.,"he got tickets to go to performance of his idol, he had a lot of admiration for him","Adoration means feeling love, respect, etc., towards someone/something. The boy was very much excited about getting tickets from his favorite artist. So, we should select “admiration”. Fanaticism and enthusiasm don’","{'supports': 3, 'overall': 3, 'well_written': 1, 'related': 1, 'factual': 1, 'new_info': 2, 'unnecessary_info': 0, 'contrastive': 1}","{'supports': 0, 'overall': 2, 'well_written': 0, 'related': 0, 'factual': 0, 'new_info': 0, 'unnecessary_info': 1, 'contrastive': 0}","{'supports': 2, 'overall': 3, 'well_written': 1, 'related': 4, 'factual': 4, 'new_info': 1, 'unnecessary_info': 0, 'contrastive': 0}","{'supports': 1, 'overall': 4, 'well_written': 1, 'related': 1, 'factual': 1, 'new_info': 2, 'unnecessary_info': 0, 'contrastive': 1}","{'supports': 2, 'overall': 2, 'well_written': 2, 'related': 2, 'factual': 2, 'new_info': 1, 'unnecessary_info': 2, 'contrastive': 0}",0.71,0.71,0.91,0.87,-0.18,-0.07,0,0.77151674981046,0.305505046330389,0,
What is a parents primary duty?,care for children,Parents are always affectionate towards their child. Affection leads to caring. Good parenting starts with caring for your own child. Speaking freely is not a primary duty. Happiness of a child may not always be beneficial for valuable life lessons. Controlling a child sometimes has a negative outcomes. School child is an irrelevant option.,parents are responsible for their children.,"Children get their life from mothers womb. After they come out of mother’s womb, parent feed them with milk. Parents also teach their child how to talk and behave properly. They teach them about good things like love, friendship","{'supports': 2, 'overall': 3, 'well_written': 1, 'related': 1, 'factual': 1, 'new_info': 2, 'unnecessary_info': 0, 'contrastive': 1}","{'supports': 0, 'overall': 2, 'well_written': 1, 'related': 1, 'factual': 0, 'new_info': 0, 'unnecessary_info': 1, 'contrastive': 0}","{'supports': 4, 'overall': 3, 'well_written': 2, 'related': 4, 'factual': 4, 'new_info': 1, 'unnecessary_info': 0, 'contrastive': 0}","{'supports': 2, 'overall': 3, 'well_written': 1, 'related': 1, 'factual': 1, 'new_info': 1, 'unnecessary_info': 0, 'contrastive': 0}","{'supports': 1, 'overall': 2, 'well_written': 1, 'related': 2, 'factual': 2, 'new_info': 3, 'unnecessary_info': 1, 'contrastive': 0}",0.5,0.57,0.88,0.85,-0.73,-0.62,-0.0500626174321759,0.80952380952381,0.267261241912424,0.372193684159388,
What could guns do which could be illegal?,take life,Take life means killing someone which is illegal according to the law. Guns are weapons that can shoot bullets from it which can kill someone. Using guns to kill is a real crime and guns may not do other options which could be illegal.,guns can kill people.,"Guns kill people thus they are used for taking lives illegally sometimes. Gunshots may cause damage too. They also rob and steal. Hence, gunshot wounds are treated at hospitals. However none of these options describe","{'supports': 1, 'overall': 3, 'well_written': 1, 'related': 1, 'factual': 0, 'new_info': 2, 'unnecessary_info': 0, 'contrastive': 0}","{'supports': 0, 'overall': 1, 'well_written': 0, 'related': 0, 'factual': 0, 'new_info': 0, 'unnecessary_info': 1, 'contrastive': 0}","{'supports': 3, 'overall': 3, 'well_written': 2, 'related': 3, 'factual': 2, 'new_info': 1, 'unnecessary_info': 1, 'contrastive': 0}","{'supports': 2, 'overall': 3, 'well_written': 1, 'related': 1, 'factual': 1, 'new_info': 1, 'unnecessary_info': 0, 'contrastive': 1}","{'supports': 2, 'overall': 2, 'well_written': 2, 'related': 2, 'factual': 1, 'new_info': 1, 'unnecessary_info': 1, 'contrastive': 0}",0.58,0.59,0.88,0.87,-1.02,-0.23,0.123091490979333,0.603022689155527,0.444554224474387,0.53802758684897,
Where might you feel cramped in a cubicle?,work,Work is an activity involving mental or physical effort done in order to achieve a purpose of result. We might feel cramped in a cubicle at work. Cramped means uncomfortably small whereas bank are spacious and well-designed. Constructing office space means it is under construction where there cannot be a cubicle. Home office is a workspace at home and doesn’t need a cubicle. Office building is a set of offices and are not divided in cubicles.,cubicles are used for work.,"Crammed means to make something more full than usual. There may be many things inside a cube such as papers, pens etc., thus they don’t get crammed (full) if someone tries to put them all together at once. So","{'supports': 0, 'overall': 3, 'well_written': 1, 'related': 1, 'factual': 1, 'new_info': 1, 'unnecessary_info': 0, 'contrastive': 1}","{'supports': 0, 'overall': 1, 'well_written': 0, 'related': 1, 'factual': 0, 'new_info': 0, 'unnecessary_info': 1, 'contrastive': 0}","{'supports': 2, 'overall': 1, 'well_written': 1, 'related': 2, 'factual': 1, 'new_info': 0, 'unnecessary_info': 0, 'contrastive': 0}","{'supports': 2, 'overall': 3, 'well_written': 1, 'related': 1, 'factual': 1, 'new_info': 1, 'unnecessary_info': 0, 'contrastive': 1}","{'supports': 1, 'overall': 1, 'well_written': 2, 'related': 1, 'factual': 1, 'new_info': 0, 'unnecessary_info': 0, 'contrastive': 0}",0.56,0.35,0.83,0.83,-1.47,-0.94,0.12524485821703,0.400163365332521,0,0.222565953629863,
What do you do to weapons when you want to gather them?,stockpile,When you want weapons just to gather them then you are doing its stockpile. You dont gather the weapons because you want to buy them. Weapons are not gathered for the purpose of oversupply. Superabundance or plentitude is not an activity,stockpile is the only way to gather weapons.,You store weapons if they are lying around for future use otherwise they will rust away. Collect is also possible however it means collect all available ones at once while stockpiling implies storing weapons with intentions of using later on whereas collection just refers to taking,"{'supports': 0, 'overall': 4, 'well_written': 1, 'related': 1, 'factual': 1, 'new_info': 2, 'unnecessary_info': 0, 'contrastive': 1}","{'supports': 0, 'overall': 1, 'well_written': 0, 'related': 0, 'factual': 0, 'new_info': 0, 'unnecessary_info': 1, 'contrastive': 0}","{'supports': 1, 'overall': 2, 'well_written': 1, 'related': 1, 'factual': 1, 'new_info': 0, 'unnecessary_info': 0, 'contrastive': 0}","{'supports': 2, 'overall': 4, 'well_written': 1, 'related': 1, 'factual': 1, 'new_info': 2, 'unnecessary_info': 0, 'contrastive': 1}","{'supports': 2, 'overall': 3, 'well_written': 2, 'related': 1, 'factual': 1, 'new_info': 2, 'unnecessary_info': 1, 'contrastive': 0}",0.67,0.59,0.85,0.84,-1.1,-0.33,0.0629940788348712,0.571428571428572,0.250313087160879,0.372193684159388,
