Question,Correct Choice,Ground Truth Explanation,Generated Explanation (T5),Generated Explanation (LLaMA),Ground Truth Ratings,T5 Ratings,LLaMA Ratings,T5 Similarity,LLaMA Similarity,T5 BERTScore,LLaMA BERTScore,T5 BLEURT,LLaMA BLEURT,Kendall Tau (Ground Truth vs T5),Kendall Tau (Ground Truth vs LLaMA),Krippendorff's Alpha
Sam turned on the projector and showed his powerpoint presentation to his partners.  Where might he be?,meeting,Powerpoint presentation are shown in meetings where business partners are present. Powerpoint presentation are not shown at theaters or conference. show films or movies are not a place.,meeting is a place where people gather to discuss a project.,Meeting has been mentioned in the sentence so we know sam went somewhere before showing his ppt . Presentation can only be shown when there is audience present. So meeting should be correct answer choice. Question: If I had been able to,"{""supports"": 4, ""overall"": 3, ""well_written"": 0, ""related"": 1, ""factual"": 0, ""new_info"": 0, ""unnecessary_info"": 0, ""contrastive"": 1}","{""supports"": 1, ""overall"": 2, ""well_written"": 1, ""related"": 1, ""factual"": 0, ""new_info"": 1, ""unnecessary_info"": 1, ""contrastive"": 0}","{""supports"": 2, ""overall"": 2, ""well_written"": 0, ""related"": 1, ""factual"": 1, ""new_info"": 1, ""unnecessary_info"": 0, ""contrastive"": 0}",0.4000000059604645,0.449999988079071,0.87,0.84,-1.15,-1.01,0.2646280620124816,0.5714285714285715,
If you are starting a fire on purpose and are caught what will happen?,go to jail,If you are caught while starting a fire on purpose then you will have to go to jail. Death might not happen by starting a fire on purpose. Burns dont happens if a person is caught. Warmth is not a correct option. A person might not get a reward on being caught when starting a fire on purpose.,if you are starting a fire on purpose and are caught what will happen go to jail,Starting fires deliberately is illegal and you have to face consequences when getting caught doing so. Law enforcement officials will put you behind bars. Question: People who live in high altitude places often experience which type of depression? Cor,"{""supports"": 3, ""overall"": 4, ""well_written"": 1, ""related"": 1, ""factual"": 1, ""new_info"": 2, ""unnecessary_info"": 0, ""contrastive"": 1}","{""supports"": 0, ""overall"": 1, ""well_written"": 0, ""related"": 0, ""factual"": 0, ""new_info"": 0, ""unnecessary_info"": 1, ""contrastive"": 0}","{""supports"": 0, ""overall"": 2, ""well_written"": 1, ""related"": 1, ""factual"": 0, ""new_info"": 1, ""unnecessary_info"": 1, ""contrastive"": 0}",0.8100000023841858,0.550000011920929,0.9,0.86,-1.08,-0.25,0.0,0.14673479641335554,
What is it called when you are killing people because they are bad?,vengeance,Vengeance means punishment inflicted or retribution exacted for an injury or wrong. It is called vengeance when you are killing people because they are bad. Killing people is not a war. War is between countries or group of people and not restricted to a particular person. Get arrested is the action taken by police for the crime done and is not called as when you are killing people. Joy and killing people are in no way interrelated and killing people doesn’t bring joy and so irrelevant. Going to prison is when you are convicted for killing peoples and not because you are bad and killing peoples.,vengeance is a term used to describe the act of killing someone because they are bad.,Killing someone because you think they did wrong to you or killed your loved ones is called revenge. All the other options are not correct.,"{""supports"": 4, ""overall"": 4, ""well_written"": 1, ""related"": 1, ""factual"": 1, ""new_info"": 3, ""unnecessary_info"": 1, ""contrastive"": 1}","{""supports"": 1, ""overall"": 2, ""well_written"": 1, ""related"": 1, ""factual"": 0, ""new_info"": 1, ""unnecessary_info"": 1, ""contrastive"": 0}","{""supports"": 2, ""overall"": 4, ""well_written"": 1, ""related"": 1, ""factual"": 1, ""new_info"": 1, ""unnecessary_info"": 0, ""contrastive"": 1}",0.8299999833106995,0.5299999713897705,0.85,0.85,-0.87,-0.84,0.5882352941176471,0.7431605356175384,
Why might someone be going into a trance?,loss of control,Trance is the state of unconsciousness of surroundings thereby causing loss of control. Loss control is reason for going into trance. Other options won't cause trance.,loss of control might someone be going into a trance,Trance is defined as being unaware of surroundings when the person loses consciousness temporarily. All these answers mean different thing but none of them mean losing consciousness so they are wrong. Loss of control means loosing control of,"{""supports"": 1, ""overall"": 3, ""well_written"": 0, ""related"": 1, ""factual"": 1, ""new_info"": 1, ""unnecessary_info"": 0, ""contrastive"": 1}","{""supports"": 0, ""overall"": 1, ""well_written"": 0, ""related"": 0, ""factual"": 0, ""new_info"": 0, ""unnecessary_info"": 1, ""contrastive"": 0}","{""supports"": 2, ""overall"": 3, ""well_written"": 1, ""related"": 1, ""factual"": 1, ""new_info"": 1, ""unnecessary_info"": 0, ""contrastive"": 1}",0.7200000286102295,0.9200000166893004,0.87,0.88,-0.63,0.09,0.0700140042014005,0.7431605356175384,
"What room, that doesn't normally have a side chair, helps you work from home?",office,Work can be done from an office room. There is no side chair in an office room. Bedroom or bathroom is not a place from where we can work from home. Building or table is not a room.,office is a room that doesn't normally have a side chair.,Office is a room used for working purposes so it has desks and tables but no sidechair. All the other rooms mentioned donot require any furniture except bedroom. Question: Which animal's name comes from the Greek word,"{""supports"": 4, ""overall"": 3, ""well_written"": 0, ""related"": 1, ""factual"": 1, ""new_info"": 1, ""unnecessary_info"": 0, ""contrastive"": 1}","{""supports"": 0, ""overall"": 1, ""well_written"": 0, ""related"": 0, ""factual"": 0, ""new_info"": 0, ""unnecessary_info"": 1, ""contrastive"": 0}","{""supports"": 1, ""overall"": 3, ""well_written"": 1, ""related"": 1, ""factual"": 0, ""new_info"": 1, ""unnecessary_info"": 1, ""contrastive"": 0}",0.7300000190734863,0.5299999713897705,0.87,0.86,-0.86,-0.7,-0.06299407883487121,0.15877683720748895,
How does a bishop move from one place to another?,chess game,Bishop is the name of a piece in chess who can move when the game of chess is running. A bishop won’t be in a car and a queen is a person and not a way to move. The bishop in the other options won’t move from one place to another.,chess is a game where bishops move from one place to another.,Bishop moves on board from one square to any other unoccupied square diagonally except its first row. Ches game is played between two players and they both have bishops to play. Other games are not similar to chesses but none,"{""supports"": 0, ""overall"": 1, ""well_written"": 1, ""related"": 1, ""factual"": 1, ""new_info"": 1, ""unnecessary_info"": 0, ""contrastive"": 1}","{""supports"": 0, ""overall"": 2, ""well_written"": 1, ""related"": 1, ""factual"": 0, ""new_info"": 0, ""unnecessary_info"": 1, ""contrastive"": 0}","{""supports"": 2, ""overall"": 3, ""well_written"": 1, ""related"": 1, ""factual"": 1, ""new_info"": 1, ""unnecessary_info"": 0, ""contrastive"": 0}",0.75,0.6399999856948853,0.88,0.84,-1.13,-0.57,0.06622661785325219,0.06299407883487121,
What does an emotional person tend to be?,expressive,A person is called emotional when he shows a lot of emotions. A person who shows a lot of emotions is called expressive. Emotional people are not always excited or drunk. Headache is not related to being an emotional person. Eating everyday is not related to being emotional.,expressiveness is the ability to express emotions.,Emotional persons often tends to behave differently from others and their expressions might change suddenly because they have high feelings about some thing. They are expressive when compared to calm persons. Calm people usually keep there expression same. Different behaviour doesnt mean,"{""supports"": 0, ""overall"": 4, ""well_written"": 1, ""related"": 1, ""factual"": 1, ""new_info"": 2, ""unnecessary_info"": 0, ""contrastive"": 1}","{""supports"": 1, ""overall"": 2, ""well_written"": 1, ""related"": 1, ""factual"": 0, ""new_info"": 1, ""unnecessary_info"": 0, ""contrastive"": 0}","{""supports"": 2, ""overall"": 3, ""well_written"": 1, ""related"": 1, ""factual"": 1, ""new_info"": 1, ""unnecessary_info"": 0, ""contrastive"": 1}",0.5299999713897705,0.6600000262260437,0.86,0.86,-0.67,-0.33,0.5006261743217589,0.36004114991154784,
"If people are shot in the head by a bullet, what is the likely result?",die suddenly,"Head holds the most important organ of the body, brain. A person cannot be alive without a brain. If someone is shot in the brain, he dies immediately. Believe in god, complete high school and cross river are irrelevant options. Migraine is not the result of gun shot wound in the head.",bullets cause death.,Death occurs when brain gets damaged due to bullets hitting the head of the victim. Dying instantly without any pain is death. Injury can happen but there should be some evidence of injury on the body otherwise death has occurred.,"{""supports"": 3, ""overall"": 4, ""well_written"": 1, ""related"": 1, ""factual"": 1, ""new_info"": 2, ""unnecessary_info"": 0, ""contrastive"": 1}","{""supports"": 0, ""overall"": 1, ""well_written"": 0, ""related"": 0, ""factual"": 0, ""new_info"": 0, ""unnecessary_info"": 1, ""contrastive"": 0}","{""supports"": 2, ""overall"": 3, ""well_written"": 1, ""related"": 1, ""factual"": 1, ""new_info"": 2, ""unnecessary_info"": 0, ""contrastive"": 1}",0.4799999892711639,0.6000000238418579,0.85,0.86,-1.3,-0.33,0.0,0.9770084209183943,
"The security detail had to keep an eye on the entire crowd, they were constantly scanning all the what?",faces,There are different faces in the crowd. The security detail were constantly scanning all the faces. Focus cant be scanned. They dont scan person's head or potato or body.,"the security detail had to keep an eye on the entire crowd, they were constantly scanning all the faces",Scan refers to searching using computer vision techniques through images or videos so we need some camera system to scan faces. It might look similar but facial recognition has nothing to do with this question because its a different technique used only to recognize faces without any,"{""supports"": 3, ""overall"": 3, ""well_written"": 1, ""related"": 1, ""factual"": 1, ""new_info"": 0, ""unnecessary_info"": 0, ""contrastive"": 1}","{""supports"": 1, ""overall"": 2, ""well_written"": 1, ""related"": 1, ""factual"": 0, ""new_info"": 1, ""unnecessary_info"": 1, ""contrastive"": 0}","{""supports"": 2, ""overall"": 3, ""well_written"": 1, ""related"": 1, ""factual"": 1, ""new_info"": 1, ""unnecessary_info"": 0, ""contrastive"": 1}",0.8399999737739563,0.5699999928474426,0.9,0.84,0.11,-0.4,0.21693045781865616,0.8432740427115679,
What would you be if you comfort friend?,friendly,"When friend is sad, we should comfort them by understanding their situation and showing friendly gesture. In no means we can comfort a friend by cooking or making a tea. Also hug is not necessary to comfort friend and being hurtful is an opposite thing of comfort.",comforting friends is a way to be friendly.,Friendly means nice and helpful to others when they need help. You should never make someone unfriendly because being unfriendly is against human nature. Being unhelpful makes no sense because everyone needs some sort of help every now and then so,"{""supports"": 3, ""overall"": 2, ""well_written"": 0, ""related"": 1, ""factual"": 0, ""new_info"": 1, ""unnecessary_info"": 0, ""contrastive"": 1}","{""supports"": 1, ""overall"": 3, ""well_written"": 1, ""related"": 1, ""factual"": 0, ""new_info"": 1, ""unnecessary_info"": 0, ""contrastive"": 0}","{""supports"": 2, ""overall"": 4, ""well_written"": 1, ""related"": 1, ""factual"": 1, ""new_info"": 2, ""unnecessary_info"": 0, ""contrastive"": 1}",0.6499999761581421,0.3899999856948852,0.87,0.85,-1.06,-0.54,0.5380275868489703,0.6978631577988531,
Where would a soprano sing live for money?,opera house,A soprano would sing live at an opera house for money. Soprano dont sing in a movie. A soprano might not sing live in choit or choir. Theater is not a place where a soprano sing.,opera houses are generally located in the city.,"Opera houses host live performance of operas and their main performers are sopranos because they have high pitched voice . Sopranos do not belong in choirs , churches nor concert halls so those places are out of context for this","{""supports"": 0, ""overall"": 3, ""well_written"": 1, ""related"": 1, ""factual"": 1, ""new_info"": 2, ""unnecessary_info"": 0, ""contrastive"": 1}","{""supports"": 1, ""overall"": 2, ""well_written"": 1, ""related"": 1, ""factual"": 0, ""new_info"": 0, ""unnecessary_info"": 1, ""contrastive"": 0}","{""supports"": 2, ""overall"": 4, ""well_written"": 1, ""related"": 1, ""factual"": 1, ""new_info"": 2, ""unnecessary_info"": 0, ""contrastive"": 1}",0.4900000095367431,0.75,0.85,0.87,-1.05,-0.22,-0.05006261743217588,0.5714285714285715,
What do you do after you reproduce?,raise children,"You need to raise children after you reproduce. You cant accidently or somehow got pregnant after you reproduce. After you reproduce you dont immediately have children. Offsprings do not, immediately, came into existence after you reproduce. 'Extra copies of gang' do not suits with the given question.","after you reproduce, you raise children.",After reproduction parents takes care of childrens till they become adult enough to survive on their own. Parents raises kids. Question: Who has control over the government? Correct Choice: citizens Explan,"{""supports"": 2, ""overall"": 2, ""well_written"": 0, ""related"": 1, ""factual"": 1, ""new_info"": 1, ""unnecessary_info"": 1, ""contrastive"": 1}","{""supports"": 1, ""overall"": 2, ""well_written"": 1, ""related"": 1, ""factual"": 0, ""new_info"": 0, ""unnecessary_info"": 1, ""contrastive"": 0}","{""supports"": 0, ""overall"": 1, ""well_written"": 0, ""related"": 0, ""factual"": 0, ""new_info"": 0, ""unnecessary_info"": 1, ""contrastive"": 0}",0.6499999761581421,0.4399999976158142,0.88,0.83,-1.07,-0.61,0.3338489304447943,0.3500700210070025,
"The shark realized it was in northern california, where was it likely?",tomales bay,Tomales bay is in northern california. Sharks are there at tomales bay. Sea world is not a place at northern california. Tropical waters or great oceans are not there at northern california. Sharks are not there in acquarium.,northern california is a state in the southern part of the country.,Sharks swim around 30 miles per day so they travel hundreds of miles before arriving near California coastline. Tomale Bay lies on north part of San Francisco bay area whereas Monterey Bay lies on south side of san frn,"{""supports"": 2, ""overall"": 2, ""well_written"": 1, ""related"": 1, ""factual"": 0, ""new_info"": 2, ""unnecessary_info"": 0, ""contrastive"": 1}","{""supports"": 0, ""overall"": 1, ""well_written"": 0, ""related"": 0, ""factual"": 0, ""new_info"": 0, ""unnecessary_info"": 1, ""contrastive"": 0}","{""supports"": 2, ""overall"": 3, ""well_written"": 1, ""related"": 1, ""factual"": 1, ""new_info"": 1, ""unnecessary_info"": 0, ""contrastive"": 0}",0.5,0.75,0.84,0.83,-1.25,-0.4,-0.06299407883487121,0.6190476190476191,
What type of areas have parking lots for stores?,urban area,Stores are small shopping places which are seen in urban areas. These places have designated parking lots. Other options do not have stores or parking lots specifically for stores.,urban areas have parking lots for stores.,Parking lot is found only near shopping malls or retail store so it is used when we go out for shopping hence parking lot is usually located around cities or towns because these places require transportation facilities nearby.Parking lot,"{""supports"": 0, ""overall"": 4, ""well_written"": 1, ""related"": 1, ""factual"": 1, ""new_info"": 1, ""unnecessary_info"": 0, ""contrastive"": 1}","{""supports"": 0, ""overall"": 1, ""well_written"": 1, ""related"": 0, ""factual"": 0, ""new_info"": 0, ""unnecessary_info"": 1, ""contrastive"": 0}","{""supports"": 2, ""overall"": 3, ""well_written"": 1, ""related"": 1, ""factual"": 1, ""new_info"": 1, ""unnecessary_info"": 0, ""contrastive"": 1}",0.8500000238418579,0.699999988079071,0.91,0.87,-0.83,-0.29,0.12524485821702988,0.40016336533252067,
The audience got up at intermission and bought pop corn.  What might they be watching?,movies,Movie is a cinema film with a short break called an intermission. The audience who got up at intermission were watching a movie. All the other options are not something that can be watched.,movies are a type of entertainment.,"Movies were shown before the internet came into existence so we get our entertainement only through television sets. It's a old fashioned word used when referring to theatre plays. All the others don't make sense because ""audience"" doesn","{""supports"": 0, ""overall"": 2, ""well_written"": 0, ""related"": 1, ""factual"": 0, ""new_info"": 1, ""unnecessary_info"": 0, ""contrastive"": 1}","{""supports"": 1, ""overall"": 2, ""well_written"": 1, ""related"": 1, ""factual"": 0, ""new_info"": 1, ""unnecessary_info"": 0, ""contrastive"": 0}","{""supports"": 2, ""overall"": 3, ""well_written"": 1, ""related"": 1, ""factual"": 1, ""new_info"": 2, ""unnecessary_info"": 0, ""contrastive"": 1}",0.5400000214576721,0.5099999904632568,0.87,0.85,-1.15,-0.59,0.47368421052631565,0.5006261743217588,
A motorcycle is quicker because it isn't as what as a car?,heavy,"Car is a heavy vehicle and not an obese vehicle. Motorcycle is not a heavy vehicle and being heavy makes vehicles go slower while being shiny, red and expensive do not.",motorcycle is quicker because it isn't as heavy as a car,Motorcycles have less weight compare to cars so they accelerate faster due to their lighter weights. Speed alone does not mean acceleration but the acceleration depends on how fast the vehicle gets up speed.,"{""supports"": 0, ""overall"": 4, ""well_written"": 0, ""related"": 1, ""factual"": 1, ""new_info"": 2, ""unnecessary_info"": 0, ""contrastive"": 1}","{""supports"": 1, ""overall"": 3, ""well_written"": 1, ""related"": 1, ""factual"": 0, ""new_info"": 1, ""unnecessary_info"": 0, ""contrastive"": 0}","{""supports"": 2, ""overall"": 4, ""well_written"": 1, ""related"": 1, ""factual"": 1, ""new_info"": 2, ""unnecessary_info"": 0, ""contrastive"": 0}",0.800000011920929,0.6800000071525574,0.87,0.87,-0.72,-0.05,0.3423811916311629,0.44455422447438714,
Is there a way for people going into trance to see things that do not exist?,hallucination,Hallucination means imagining unreal things which are things that don't exist. People in trance can have hallucinations. Other options may not cause one to see things that don't exist.,hallucination is a way for people going into trance to see things that do not exist.,Trance is mental state when someone sees images that don't really exists but appear real so they are known as Hallucinations. All the other options are not correct. Question: Which word best describes the woman on this street corner,"{""supports"": 4, ""overall"": 4, ""well_written"": 1, ""related"": 1, ""factual"": 1, ""new_info"": 2, ""unnecessary_info"": 0, ""contrastive"": 1}","{""supports"": 1, ""overall"": 3, ""well_written"": 1, ""related"": 1, ""factual"": 0, ""new_info"": 1, ""unnecessary_info"": 0, ""contrastive"": 0}","{""supports"": 0, ""overall"": 2, ""well_written"": 1, ""related"": 0, ""factual"": 0, ""new_info"": 0, ""unnecessary_info"": 1, ""contrastive"": 0}",0.8999999761581421,0.699999988079071,0.91,0.86,0.22,-0.04,0.7008766440504623,-0.05292561240249632,
"Where might I ruin some papers if I place my coffee mug there, and it spills?",desktop,"We work on desktop with papers and if we place coffee mug on desktop, it spills and some papers might get ruined. However we do not work on table hence papers are not lying on table. While cupboard and shilf are not meant to put papers and similarly we do not take papers in kitchen","coffee mugs are usually placed on the desktop, and spills are usually found on the floor.","Desktop is flat surface on top of table or computer system. You keep files, documents, pictures etc.,on this desk so anything placed on it gets spoiled when liquid falls on it. The rest options are not correct because they describe places","{""supports"": 4, ""overall"": 3, ""well_written"": 1, ""related"": 1, ""factual"": 1, ""new_info"": 0, ""unnecessary_info"": 0, ""contrastive"": 1}","{""supports"": 2, ""overall"": 3, ""well_written"": 1, ""related"": 1, ""factual"": 1, ""new_info"": 1, ""unnecessary_info"": 0, ""contrastive"": 0}","{""supports"": 2, ""overall"": 3, ""well_written"": 1, ""related"": 1, ""factual"": 1, ""new_info"": 2, ""unnecessary_info"": 0, ""contrastive"": 1}",0.7300000190734863,0.6499999761581421,0.86,0.86,-0.96,-0.76,0.6190476190476191,0.4761904761904763,
What do you compete against someone in?,in competition,You compete against someone in a competition because it’s a contest in which people participate to establish superiority in a particular area. Fair isn’t a valid answer because it’s a travelling show with games and rides. False start isn’t a valid answer as a race will be invalid if a racer started before the official start signal. Being competitive isn’t the valid answer as there maybe competitors who’re not competitive. Practice isn’t the valid because one doesn’t practice among their competitors.,competition is a game,You only compete when there is two competitors present. Only thing that both need to win so they have common interest. In this case there are 2 persons. They have different motives but same objective so its competition between these two.,"{""supports"": 3, ""overall"": 4, ""well_written"": 1, ""related"": 1, ""factual"": 1, ""new_info"": 1, ""unnecessary_info"": 0, ""contrastive"": 1}","{""supports"": 0, ""overall"": 1, ""well_written"": 0, ""related"": 0, ""factual"": 0, ""new_info"": 0, ""unnecessary_info"": 1, ""contrastive"": 0}","{""supports"": 2, ""overall"": 3, ""well_written"": 0, ""related"": 1, ""factual"": 1, ""new_info"": 1, ""unnecessary_info"": 0, ""contrastive"": 1}",0.6399999856948853,0.6399999856948853,0.82,0.83,-1.77,-0.97,0.0,0.8743856497851876,
What does a child learn to do in a lake?,row boat,"One needs to learn to row boat which is done in a lake while driving, going out to play and beginning school are not. Rowing boat is an activity while becoming adult is not.",row boat is a boat,Rowboat is used to row on water surface in lakes etc. Learn how to ride a horse is not relevant for this question because horses shouldnt be kept in lakes. Paddle boats cant be used in large bodies of water.,"{""supports"": 1, ""overall"": 3, ""well_written"": 1, ""related"": 1, ""factual"": 1, ""new_info"": 1, ""unnecessary_info"": 0, ""contrastive"": 1}","{""supports"": 0, ""overall"": 1, ""well_written"": 0, ""related"": 1, ""factual"": 0, ""new_info"": 0, ""unnecessary_info"": 1, ""contrastive"": 0}","{""supports"": 2, ""overall"": 3, ""well_written"": 1, ""related"": 1, ""factual"": 1, ""new_info"": 1, ""unnecessary_info"": 0, ""contrastive"": 1}",0.5899999737739563,0.6200000047683716,0.84,0.86,-1.89,-0.9,0.0,0.8498365855987976,
"A man was driving himself to the airport, where did he put his luggage?",trunk,"When the man is driving towards airport, he will keep his luggage at back in trunk of vehicle. While a man is driving towards airport, he cannot keep it in closet as he does not carry cupboard. Hotels are not used while driving and sidewalk and bus stop are invalid options as they are not in driving towards airport.",trunks are used for storing luggage.,Trunk is used for carrying heavy items such as suitcase when travelling on road. Hoodie is clothes worn during winter season. It doesnt mean anything else. Question: If you were asked to solve a problem how should you go,"{""supports"": 4, ""overall"": 4, ""well_written"": 0, ""related"": 1, ""factual"": 1, ""new_info"": 2, ""unnecessary_info"": 0, ""contrastive"": 1}","{""supports"": 1, ""overall"": 3, ""well_written"": 1, ""related"": 1, ""factual"": 0, ""new_info"": 1, ""unnecessary_info"": 1, ""contrastive"": 0}","{""supports"": 1, ""overall"": 2, ""well_written"": 1, ""related"": 1, ""factual"": 0, ""new_info"": 1, ""unnecessary_info"": 1, ""contrastive"": 0}",0.4900000095367431,0.4199999868869781,0.84,0.83,-1.54,-0.91,0.3034330424545042,0.3034330424545042,
"The atheist extolled virtues of secular thought, what ideas was he likely opposing?",religious,"Atheist is the one who dont believe in religion. Religious views are ideas that are opposed by an atheist. Church, eternal or Unpredictable is not an idea. Atheist are monastic.",religious ideas are not a good idea to atheists.,"Secularism mean no religion therefore, Atheists believe there should be no religions. So, He believes in no religion so, Religion is being opposed here. Question: If I were a cowboy, this might happen to","{""supports"": 1, ""overall"": 2, ""well_written"": 0, ""related"": 1, ""factual"": 0, ""new_info"": 1, ""unnecessary_info"": 1, ""contrastive"": 1}","{""supports"": 0, ""overall"": 2, ""well_written"": 0, ""related"": 0, ""factual"": 0, ""new_info"": 0, ""unnecessary_info"": 1, ""contrastive"": 0}","{""supports"": 1, ""overall"": 2, ""well_written"": 0, ""related"": 1, ""factual"": 0, ""new_info"": 1, ""unnecessary_info"": 1, ""contrastive"": 0}",0.5299999713897705,0.4300000071525574,0.87,0.86,-0.62,-0.77,0.6054055145966812,0.8346223261119857,
