John was cleaning up and found pics from his trip to California in something old.  What did he probablt find them in?,suitcase,Old things are usually kept safely for the purpose of memories and preservation. A suitcase is a safe place to keep old pictures and other things. People do not keep their belongings in a television. People generally do not keep photos in the attic just like that. People do not keep old photos in the fridge. Newspaper is an irrelevant option.,a suitcase is a type of luggage used for packing.,Suitcases are used when travling therefore they store items such as clothes and documents during travel. Hence there is high probability that john finds pictures in his suitses while cleanigg house because those were taken on california trips,"{""supports"": 0, ""overall"": 4, ""well_written"": 1, ""related"": 1, ""factual"": 1, ""new_info"": 2, ""unnecessary_info"": 0, ""contrastive"": 1}","{""supports"": 1, ""overall"": 2, ""well_written"": 1, ""related"": 1, ""factual"": 0, ""new_info"": 1, ""unnecessary_info"": 1, ""contrastive"": 0}","{""supports"": 1, ""overall"": 2, ""well_written"": 1, ""related"": 1, ""factual"": 0, ""new_info"": 1, ""unnecessary_info"": 1, ""contrastive"": 0}",0.5400000214576721,0.6100000143051147,0.85,0.84,-1.02,-0.95,0.2646280620124816,0.2646280620124816,
Where is a man likely to keep his sunglasses?,shirt pocket,men wear shirts. Shirt pocket is a good place to keep sunglasses. Sunglasses cant be stored at a drugstore. Men dont keep purse with them. Jeans pocket or bag is not a good place to keep sunglasses.,sunglasses are typically kept in a shirt pocket.,Sunglasses protect eyes from sun light when its bright outside so they should ideally go inside pockets while going outdoor. They shouldnt go on top of car because it doesnt matter much whether we lose those during ride but loosing it,"{""supports"": 1, ""overall"": 4, ""well_written"": 1, ""related"": 1, ""factual"": 1, ""new_info"": 2, ""unnecessary_info"": 0, ""contrastive"": 1}","{""supports"": 1, ""overall"": 2, ""well_written"": 1, ""related"": 1, ""factual"": 0, ""new_info"": 1, ""unnecessary_info"": 1, ""contrastive"": 0}","{""supports"": 2, ""overall"": 3, ""well_written"": 1, ""related"": 1, ""factual"": 1, ""new_info"": 1, ""unnecessary_info"": 0, ""contrastive"": 1}",0.8600000143051147,0.5699999928474426,0.87,0.85,-0.38,-0.62,0.40016336533252067,0.6666666666666667,
Where should I have a map that I want to use soon?,posession,If one has a map in posession that is owns a map they can keep it anywhere and use it whenever they want. All the other options are rigid places but not everyone can have them.,map is a map,"Possesion means having some thing physically so you could use it when needed. You don't need maps on internet , and they aren't stored there either. Maps in library wouldn't help much because they mightn't have","{""supports"": 0, ""overall"": 2, ""well_written"": 0, ""related"": 1, ""factual"": 1, ""new_info"": 0, ""unnecessary_info"": 0, ""contrastive"": 1}","{""supports"": 1, ""overall"": 1, ""well_written"": 0, ""related"": 1, ""factual"": 0, ""new_info"": 0, ""unnecessary_info"": 1, ""contrastive"": 0}","{""supports"": 2, ""overall"": 3, ""well_written"": 1, ""related"": 1, ""factual"": 1, ""new_info"": 1, ""unnecessary_info"": 0, ""contrastive"": 1}",0.5600000023841858,0.5799999833106995,0.84,0.85,-1.84,-0.58,0.11470786693528087,0.3785166493051126,
"The man was sick of not attracting women and began to practice grooming, what was his goal?",looking good,"Grooming is the practice of brushing and cleaning which makes one look good. Looking good can attract the people of the opposite sex, so his goal was to look good. All the other options were not his goal as they do not attract women.",grooming is a way of looking good.,"Grooming is about looking better and getting attention because of how we look. Looking well gives us confidence too. Question: There is no such thing as bad weather, only unsuitable clothes What this quote says is... ? Cor","{""supports"": 4, ""overall"": 4, ""well_written"": 1, ""related"": 1, ""factual"": 1, ""new_info"": 1, ""unnecessary_info"": 0, ""contrastive"": 1}","{""supports"": 0, ""overall"": 2, ""well_written"": 1, ""related"": 1, ""factual"": 0, ""new_info"": 0, ""unnecessary_info"": 1, ""contrastive"": 0}","{""supports"": 0, ""overall"": 1, ""well_written"": 0, ""related"": 0, ""factual"": 0, ""new_info"": 0, ""unnecessary_info"": 1, ""contrastive"": 0}",0.8700000047683716,0.75,0.86,0.85,-0.71,-0.76,0.0,-0.0700140042014005,
"The had a reputation for celebrating in a  debaucherous manner, what often happened as a result?",drunkenness,"Extreme celebrations can lead to drunkenness and not to fighting. Extreme celebration is called debauchery. Drunkenness refers to the state of being drunk unlike enjoyment, having fun and hang over.",celebrating in a debaucherous manner is often associated with drunkenness.,"Debauchery mean excessive indulgence in sex, drink, etc., especially by public officials; profligacy. Drunkenness means drunk. Drinking alcohalic liquor causes intoxicated feeling and dizziness.","{""supports"": 0, ""overall"": 3, ""well_written"": 1, ""related"": 1, ""factual"": 1, ""new_info"": 1, ""unnecessary_info"": 0, ""contrastive"": 1}","{""supports"": 1, ""overall"": 3, ""well_written"": 1, ""related"": 1, ""factual"": 0, ""new_info"": 1, ""unnecessary_info"": 1, ""contrastive"": 0}","{""supports"": 1, ""overall"": 3, ""well_written"": 1, ""related"": 1, ""factual"": 1, ""new_info"": 1, ""unnecessary_info"": 0, ""contrastive"": 0}",0.8100000023841858,0.6600000262260437,0.87,0.85,0.06,-0.45,0.1764705882352941,0.5882352941176471,
How should a person's health improve after getting in shape?,feeling better,Getting in shape refers to losing cholesterol which increases health and makes us feel good. All other options do not necessarily happen on getting in shape.,getting in shape is a way to improve one's health.,Getting into shape implies losing weight and gaining muscles. These both result in improvement in fitness level but this doesnt mean ones overall health improves automatically. Only thing which can lead to improved health condition is following proper diet along with exercise.,"{""supports"": 0, ""overall"": 3, ""well_written"": 0, ""related"": 1, ""factual"": 0, ""new_info"": 1, ""unnecessary_info"": 0, ""contrastive"": 1}","{""supports"": 0, ""overall"": 3, ""well_written"": 1, ""related"": 1, ""factual"": 0, ""new_info"": 1, ""unnecessary_info"": 1, ""contrastive"": 0}","{""supports"": 1, ""overall"": 3, ""well_written"": 1, ""related"": 1, ""factual"": 1, ""new_info"": 2, ""unnecessary_info"": 0, ""contrastive"": 0}",0.8100000023841858,0.7900000214576721,0.9,0.87,-0.26,0.03,0.47368421052631565,0.45056355688958294,
After the sun has risen what happens at the end of the day?,sun set,Sunset happens at end of day. Sunset happens after sunrise has taken place. Deep dive or below doesnt happen at end of day. Sun dont fall or lowers in sky.,sun sets after the sun has risen,Sun rises in morning and sets down at evening so answer should be sunset.,"{""supports"": 4, ""overall"": 3, ""well_written"": 0, ""related"": 1, ""factual"": 1, ""new_info"": 1, ""unnecessary_info"": 0, ""contrastive"": 1}","{""supports"": 0, ""overall"": 2, ""well_written"": 0, ""related"": 1, ""factual"": 0, ""new_info"": 0, ""unnecessary_info"": 1, ""contrastive"": 0}","{""supports"": 2, ""overall"": 3, ""well_written"": 1, ""related"": 1, ""factual"": 1, ""new_info"": 1, ""unnecessary_info"": 0, ""contrastive"": 0}",0.5199999809265137,0.6800000071525574,0.87,0.85,-0.77,-0.67,0.05292561240249632,0.6190476190476191,
James went to the best steakhouse outside of the South.  Where is James?,michigan,Michigan is not in south. As James went to the best steakhouse outside of the South so James is in michigan. James is not in a dairy farm. Florida abd texas might not have the best steakhouse. James might not be in a building.,michigan is a state in the southern part of the united states.,Michigan has the best steakhouses according to this question and therefore james went there when he left south . Question: How did the writer know that the man worked on a farm? Correct Choice: because the man said so,"{""supports"": 3, ""overall"": 3, ""well_written"": 0, ""related"": 1, ""factual"": 1, ""new_info"": 0, ""unnecessary_info"": 0, ""contrastive"": 1}","{""supports"": 0, ""overall"": 2, ""well_written"": 0, ""related"": 0, ""factual"": 0, ""new_info"": 0, ""unnecessary_info"": 1, ""contrastive"": 0}","{""supports"": 0, ""overall"": 1, ""well_written"": 0, ""related"": 0, ""factual"": 0, ""new_info"": 0, ""unnecessary_info"": 1, ""contrastive"": 0}",0.6299999952316284,0.7300000190734863,0.83,0.84,-1.33,-0.46,0.12104550653376049,0.06299407883487121,
Where might you find a row of apple tree?,park,Park is a public place with aisles where people can walk and the aisles in parks have trees on either sides in rows. So park is where one might find rows of apple trees. Not all of Washington state and New York has rows of apple trees and the other options might not have rows of apple trees.,park is a place where you can find apple trees.,Apple trees grow on farms but they could have been planted there because somebody liked apples. If its grown then its not necessarily found only on farm. Its possible to find some apples somewhere else too. Therefore option 1 is correct answer,"{""supports"": 3, ""overall"": 2, ""well_written"": 1, ""related"": 1, ""factual"": 0, ""new_info"": 1, ""unnecessary_info"": 0, ""contrastive"": 1}","{""supports"": 0, ""overall"": 2, ""well_written"": 1, ""related"": 1, ""factual"": 0, ""new_info"": 0, ""unnecessary_info"": 1, ""contrastive"": 0}","{""supports"": 2, ""overall"": 3, ""well_written"": 1, ""related"": 1, ""factual"": 1, ""new_info"": 1, ""unnecessary_info"": 0, ""contrastive"": 1}",0.7799999713897705,0.4399999976158142,0.88,0.84,-0.69,-0.7,0.10012523486435176,0.7715167498104596,
When people have a birthday what normally happens?,receive gifts,Giving gifts to birthday person is a common trend. People usually recieve gifts during their birthdays. Loud sounds are specific to birthdays. Work in teams is an irrelevant option. People generally do not kiss eachother on birthdays. Talking to eachother is not restricted to only birthdays.,birthdays are a time for giving and receiving gifts.,People celebrate their birthdays by having parties and receiving gifts. Birthdays are occasions when family and friends come together and exchange greetings and presents. It's true that some people don't get any present on their birthdays,"{""supports"": 4, ""overall"": 3, ""well_written"": 1, ""related"": 1, ""factual"": 1, ""new_info"": 1, ""unnecessary_info"": 0, ""contrastive"": 1}","{""supports"": 1, ""overall"": 3, ""well_written"": 1, ""related"": 1, ""factual"": 0, ""new_info"": 1, ""unnecessary_info"": 0, ""contrastive"": 0}","{""supports"": 1, ""overall"": 4, ""well_written"": 1, ""related"": 1, ""factual"": 1, ""new_info"": 2, ""unnecessary_info"": 0, ""contrastive"": 0}",0.7099999785423279,0.6600000262260437,0.86,0.87,-0.76,-0.14,0.5948118774794626,0.5143444998736397,
"People wanted to get to their destination quickly, what did they invent?",vehicles,People use different modes of transporation to reach their destination quickly. These modes of transportation are called vehicle. Confession is an irrelevant option. Toilets do not help people in fast transportation. National park or supermarket are not modes of transportation.,vehicles are used to travel quickly.,Vehicle is anything that moves such as car etc. People want to reach fast so they made vehicle and this makes it right answer compared to others which were wrong answers.,"{""supports"": 3, ""overall"": 4, ""well_written"": 1, ""related"": 1, ""factual"": 1, ""new_info"": 0, ""unnecessary_info"": 0, ""contrastive"": 1}","{""supports"": 0, ""overall"": 2, ""well_written"": 0, ""related"": 0, ""factual"": 0, ""new_info"": 0, ""unnecessary_info"": 1, ""contrastive"": 0}","{""supports"": 2, ""overall"": 3, ""well_written"": 0, ""related"": 1, ""factual"": 0, ""new_info"": 1, ""unnecessary_info"": 0, ""contrastive"": 1}",0.4699999988079071,0.4199999868869781,0.86,0.85,-1.09,-0.96,0.12104550653376049,0.604814736759006,
What is another way to say someone is a failure?,amount to nothing,If someone's efforts amounts to nothing then that can be considered as failure of that person. Person doesnt get insulted only when he fails.Holding back cannot be considered as failure but it may lead to failure in future.Illusion are not real so cannot be considered as failure even though you have illusion of something. Lower expectations of success doesnt mean failure.,a failure is a failure.,"Amount to nothing means the same thing when said about someone who has failed. Failure is a word used for someone who fails so they become worthless. Question: In the sentence ""This man is my brother"", ________.","{""supports"": 4, ""overall"": 3, ""well_written"": 1, ""related"": 1, ""factual"": 1, ""new_info"": 1, ""unnecessary_info"": 1, ""contrastive"": 1}","{""supports"": 0, ""overall"": 2, ""well_written"": 1, ""related"": 1, ""factual"": 0, ""new_info"": 0, ""unnecessary_info"": 1, ""contrastive"": 0}","{""supports"": 1, ""overall"": 2, ""well_written"": 1, ""related"": 1, ""factual"": 0, ""new_info"": 1, ""unnecessary_info"": 1, ""contrastive"": 0}",0.5199999809265137,0.4399999976158142,0.85,0.85,-1.41,-0.8,0.12725695259515554,0.4708709557974188,
Playing chess is like most things where practice helps to build your what at it?,skill,A skill is an ability of a person that can be built over time by practce like in playing game of chess. All the other options are not related to what can be built like in game of chess henec are incorrect.,playing chess is like most things where practice helps to build your skill at it,Skill is something which needs constant practice so it remains sharp. It has nothing to do with knowledge. Skills need constant practice but knowledge doesn't require practice unless we want to improve our skills on certain topic. Question: Who would,"{""supports"": 3, ""overall"": 3, ""well_written"": 0, ""related"": 1, ""factual"": 1, ""new_info"": 0, ""unnecessary_info"": 0, ""contrastive"": 1}","{""supports"": 1, ""overall"": 3, ""well_written"": 1, ""related"": 1, ""factual"": 1, ""new_info"": 1, ""unnecessary_info"": 0, ""contrastive"": 0}","{""supports"": 2, ""overall"": 3, ""well_written"": 1, ""related"": 1, ""factual"": 1, ""new_info"": 1, ""unnecessary_info"": 0, ""contrastive"": 1}",0.6100000143051147,0.5299999713897705,0.85,0.85,-0.75,-0.39,0.42340489921997054,0.7715167498104596,
Where could you find some large pieces of paper that are not for sale?,artist's studio,"Artists work on large pieces of paper, but due to a lot of changes and mistakes, the artist studio has a lot of large pieces of paper. All the other options are incorrect as they do not have large pieces of paper.",artist's studios are often used for making art.,An artist has lots of unused papers lying around in their studios but they donot sell those papers. They use these papers for various projects. So artists studio should have big sheets of paper because they arent using them commercially rather using them,"{""supports"": 4, ""overall"": 3, ""well_written"": 1, ""related"": 1, ""factual"": 1, ""new_info"": 2, ""unnecessary_info"": 0, ""contrastive"": 1}","{""supports"": 1, ""overall"": 3, ""well_written"": 1, ""related"": 1, ""factual"": 0, ""new_info"": 1, ""unnecessary_info"": 0, ""contrastive"": 0}","{""supports"": 2, ""overall"": 3, ""well_written"": 1, ""related"": 1, ""factual"": 1, ""new_info"": 1, ""unnecessary_info"": 0, ""contrastive"": 0}",0.5899999737739563,0.8100000023841858,0.86,0.87,-0.73,-0.26,0.635850784457874,0.7443873683187766,
"The snake was cold, what did it seek?",warm place,"As the snake was cold so it seeks a warm place. A cold snake may not seek a wooded area. Blanket dont fits here. Sleeping bag might not be seeked by a cold snake. When a snake is cold, it might not seek tropical forest.",cold places are warm.,Snake looks for warm places when they get too cold. It is correct answer because there were no other choices.,"{""supports"": 0, ""overall"": 2, ""well_written"": 1, ""related"": 1, ""factual"": 1, ""new_info"": 1, ""unnecessary_info"": 0, ""contrastive"": 1}","{""supports"": 0, ""overall"": 1, ""well_written"": 0, ""related"": 0, ""factual"": 0, ""new_info"": 0, ""unnecessary_info"": 1, ""contrastive"": 0}","{""supports"": 0, ""overall"": 1, ""well_written"": 0, ""related"": 0, ""factual"": 0, ""new_info"": 0, ""unnecessary_info"": 1, ""contrastive"": 0}",0.5099999904632568,0.7599999904632568,0.86,0.85,-1.58,-0.83,0.0700140042014005,0.0700140042014005,
The lizard tried to stay cool by resting in what sort of location?,shady spot,"Shady spots are places free from sunlight, therefore they are cool. Sunny place, garden, rocks may or may not be cool as they can have sunlight and dirt is not a place.",shady spot is the only place where a lizard would be likely to rest.,"Shade means protective cover of leaves/trees/etc., from sun light and heat. Lizards seek shades during hot weather condition when they need protection from heat due to their cold blooded nature. Other choices do not mean same thing","{""supports"": 2, ""overall"": 4, ""well_written"": 1, ""related"": 1, ""factual"": 1, ""new_info"": 0, ""unnecessary_info"": 0, ""contrastive"": 1}","{""supports"": 0, ""overall"": 2, ""well_written"": 1, ""related"": 1, ""factual"": 0, ""new_info"": 0, ""unnecessary_info"": 1, ""contrastive"": 0}","{""supports"": 2, ""overall"": 3, ""well_written"": 1, ""related"": 1, ""factual"": 1, ""new_info"": 2, ""unnecessary_info"": 0, ""contrastive"": 1}",0.5199999809265137,0.4300000071525574,0.86,0.85,-1.09,-0.49,0.20025046972870353,0.5714285714285715,
"If someone saved up for a new bass, where would they go to get it?",music store,"Music store is a place which sells musical instruments like bass. So if someone saved up for a new bass, they’d go to the music store to get it. Barbershop quartette is not a place for a bass to be sold in and bass isn’t sold in places in the other options.",music stores sell bass.,Bass guitar costs lot of money so many people save money for buying this instrument. They might look online but only some stores have stock of these instruments available .They need to physically check out their product before purchasing so they visit music stores to,"{""supports"": 2, ""overall"": 4, ""well_written"": 1, ""related"": 1, ""factual"": 1, ""new_info"": 2, ""unnecessary_info"": 0, ""contrastive"": 1}","{""supports"": 0, ""overall"": 1, ""well_written"": 0, ""related"": 0, ""factual"": 0, ""new_info"": 0, ""unnecessary_info"": 1, ""contrastive"": 0}","{""supports"": 2, ""overall"": 3, ""well_written"": 1, ""related"": 1, ""factual"": 1, ""new_info"": 1, ""unnecessary_info"": 0, ""contrastive"": 0}",0.7799999713897705,0.6899999976158142,0.87,0.85,-1.04,-0.12,0.0,0.8095238095238096,
Where are there more than 1 trillion planets like earth?,universe,Universe have more than trillion planets like earth.God's creation is not scientifically proven thing.stopped ball is not place.gravity is not place where planets can be but its kind of force. milky way contain our galaxy and have billions of planets.,the universe is the only place where there are more than 1 trillion planets like earth.,There must exist many places like our planet but this question asks about number of planets so universes answer should have been right because its numbered with 2 zeros. Sun has only 8 planets around itself so thats not correct choice either.,"{""supports"": 4, ""overall"": 4, ""well_written"": 1, ""related"": 1, ""factual"": 1, ""new_info"": 2, ""unnecessary_info"": 0, ""contrastive"": 1}","{""supports"": 0, ""overall"": 2, ""well_written"": 1, ""related"": 1, ""factual"": 0, ""new_info"": 0, ""unnecessary_info"": 1, ""contrastive"": 0}","{""supports"": 2, ""overall"": 3, ""well_written"": 1, ""related"": 1, ""factual"": 1, ""new_info"": 1, ""unnecessary_info"": 0, ""contrastive"": 1}",0.7099999785423279,0.550000011920929,0.87,0.84,-0.96,-0.57,-0.10012523486435176,0.8743856497851876,
What might lock after someone drives in?,gate,"A gate can lock after someone drives in it to protect. All the other options like mouth, doorknobs etc. are not something that can close itself.",gate might lock after someone drives in,Gates have locks on both sides so when two vehicles enter gates they get locked together and this prevents any vehicle entering through same side again. Only gate has such feature out of the given options.,"{""supports"": 2, ""overall"": 4, ""well_written"": 1, ""related"": 1, ""factual"": 1, ""new_info"": 1, ""unnecessary_info"": 0, ""contrastive"": 1}","{""supports"": 0, ""overall"": 2, ""well_written"": 0, ""related"": 0, ""factual"": 0, ""new_info"": 0, ""unnecessary_info"": 1, ""contrastive"": 0}","{""supports"": 1, ""overall"": 3, ""well_written"": 1, ""related"": 1, ""factual"": 0, ""new_info"": 1, ""unnecessary_info"": 0, ""contrastive"": 0}",0.7699999809265137,0.6000000238418579,0.89,0.86,-0.52,-0.19,0.06537204504606135,0.7029594915666377,
What is a place that sells food but does not usually sell suntan lotion?,grocery store,"At grocery store, food is available. At grocery store, suntan lotion is not sold. At deli counter, food is not sold. At pharmacy, suntan lotion is available. At shop, suntan lotion can be found. Beach bag is not a place.",grocery stores sell food but do not usually sell suntan lotion.,"Groceries stores mainly have fruits and vegetables, bakery items etc., they rarely offer any sun tan lotion products because sun tan lotions are cosmetics so there are no such places available on internet. Question:","{""supports"": 4, ""overall"": 1, ""well_written"": 0, ""related"": 1, ""factual"": 0, ""new_info"": 0, ""unnecessary_info"": 0, ""contrastive"": 1}","{""supports"": 1, ""overall"": 3, ""well_written"": 1, ""related"": 1, ""factual"": 1, ""new_info"": 1, ""unnecessary_info"": 0, ""contrastive"": 0}","{""supports"": 1, ""overall"": 3, ""well_written"": 1, ""related"": 1, ""factual"": 0, ""new_info"": 1, ""unnecessary_info"": 1, ""contrastive"": 0}",0.8600000143051147,0.7300000190734863,0.89,0.86,-0.26,-0.3,0.16692446522239715,0.16692446522239715,
Where might someone need a small table?,apartment,"Someone might need a small table in apartment. Small table is not needed in kitchen. Demonstration is not a place. At furniture store, someone might not need a small table. A small table might not be needed in a corner.",apartment might someone need a small table,Small tables are used when space is limited so they are commonly found in apartments. Other places have large rooms to accomodate larger sized furniture. People who live in houses don't use these type of tables. Question:,"{""supports"": 2, ""overall"": 2, ""well_written"": 1, ""related"": 1, ""factual"": 1, ""new_info"": 1, ""unnecessary_info"": 0, ""contrastive"": 1}","{""supports"": 0, ""overall"": 1, ""well_written"": 0, ""related"": 0, ""factual"": 0, ""new_info"": 0, ""unnecessary_info"": 1, ""contrastive"": 0}","{""supports"": 2, ""overall"": 4, ""well_written"": 1, ""related"": 1, ""factual"": 1, ""new_info"": 2, ""unnecessary_info"": 0, ""contrastive"": 1}",0.7599999904632568,0.7599999904632568,0.89,0.87,-1.33,-0.42,-0.0700140042014005,0.8468097984399411,
The aorta is the main artery in what area of the body?,torso,The aorta artery originates from the heart and extends to abdomen. This whole area is known as torso. All the other body parts are just mere parts and aorta is not a part of them.,aorta is the main artery in torso,Torso is the upper part of human's abdomen and thorax (chest) thus Aorta(main blood vessel) goes through this region of body. Other parts are incorrect because they donot have such big vessels going into,"{""supports"": 3, ""overall"": 3, ""well_written"": 1, ""related"": 1, ""factual"": 1, ""new_info"": 2, ""unnecessary_info"": 0, ""contrastive"": 1}","{""supports"": 0, ""overall"": 1, ""well_written"": 0, ""related"": 1, ""factual"": 0, ""new_info"": 0, ""unnecessary_info"": 1, ""contrastive"": 0}","{""supports"": 2, ""overall"": 3, ""well_written"": 1, ""related"": 1, ""factual"": 1, ""new_info"": 1, ""unnecessary_info"": 0, ""contrastive"": 1}",0.8500000238418579,0.8100000023841858,0.89,0.87,-0.58,-0.23,-0.16903085094570333,0.8743856497851876,
What can occur in fencing if you are not careful?,severe injuries,Fencing requires use of equipments that are very sharp and Person can get severe injuries by those sharp equipment in fencing if he is not careful. Competition in fencing doesn't happen due to carelessness. Players doesn't get fever if dont be careful in fencing.Perspiration doesn't always happen in fencing.Small cuts occurs even though the person is careful in fencing.,fencing is a sport that requires a lot of physical effort and skill.,Fencers must use appropriate equipment to avoid any kind of injury during competition but still there are chances of getting injured if someone crosses line or uses wrong technique while attacking opponent because when both players try to hit each other using sword then,"{""supports"": 1, ""overall"": 3, ""well_written"": 0, ""related"": 1, ""factual"": 1, ""new_info"": 2, ""unnecessary_info"": 0, ""contrastive"": 1}","{""supports"": 1, ""overall"": 2, ""well_written"": 1, ""related"": 1, ""factual"": 0, ""new_info"": 1, ""unnecessary_info"": 1, ""contrastive"": 0}","{""supports"": 2, ""overall"": 3, ""well_written"": 1, ""related"": 1, ""factual"": 1, ""new_info"": 1, ""unnecessary_info"": 0, ""contrastive"": 0}",0.7699999809265137,0.7699999809265137,0.85,0.85,-0.55,-0.46,0.2646280620124816,0.5238095238095238,
