"The lizard was at the zoo, the protester stole it and returned it to the what?",wild,The protestor wanted to take the animal from the zoo and returned it to its original place which can anywhere in wild. While garden can be a place but it is not somewhere a lizard belongs.All the other options are also not home to lizards.,lizards are wild animals.,Lizards live outside world therefore they should be kept inside zoos. It is illegal to steal animals living outdoors and keep those animals within human society but protesters did so anyway. They took it back into its natural habitat.,"{""supports"": 0, ""overall"": 3, ""well_written"": 0, ""related"": 1, ""factual"": 1, ""new_info"": 1, ""unnecessary_info"": 0, ""contrastive"": 1}","{""supports"": 0, ""overall"": 1, ""well_written"": 0, ""related"": 0, ""factual"": 0, ""new_info"": 0, ""unnecessary_info"": 1, ""contrastive"": 0}","{""supports"": 2, ""overall"": 3, ""well_written"": 1, ""related"": 1, ""factual"": 1, ""new_info"": 1, ""unnecessary_info"": 0, ""contrastive"": 1}",0.6000000238418579,0.75,0.87,0.86,-1.78,-0.23,0.13245323570650439,0.3785166493051126,
"The people wanted to take the scenic route, they chose the highway that cut through the what?",countryside,"Countryside highways are passing through farm’s, field’s and mountains with lush green scenic views. Whereas Atlas and Developed lands are not the option for a scenic route. Highways don’t usually cut through beaches and the whole of United States.",highways are often used to travel through countryside.,Countryside refers to rural area outside cities and towns. People want to see beautiful views while traveling so they choose scenic routes which passes through countrysides. Other terms have different meanings but none of those refer to areas around,"{""supports"": 0, ""overall"": 4, ""well_written"": 1, ""related"": 1, ""factual"": 1, ""new_info"": 2, ""unnecessary_info"": 0, ""contrastive"": 1}","{""supports"": 1, ""overall"": 2, ""well_written"": 1, ""related"": 1, ""factual"": 0, ""new_info"": 1, ""unnecessary_info"": 1, ""contrastive"": 0}","{""supports"": 2, ""overall"": 3, ""well_written"": 1, ""related"": 1, ""factual"": 1, ""new_info"": 2, ""unnecessary_info"": 0, ""contrastive"": 1}",0.7799999713897705,0.6499999761581421,0.85,0.85,-0.98,-0.27,0.2646280620124816,0.5714285714285715,
"He lowered and raised the bucket but it was empty, the what had run dry?",well,"A well can run dry which otherwise stores water and a bucket can be lowered into it unlike into a dishwasher. A garden shed, utility closet and a laundry do not store water.",lowering and raising the bucket is a way of lowering and raising the bucket.,Well refers to water tank which runs out when there is no supply of water. There were only two answers left so I picked this answer.,"{""supports"": 4, ""overall"": 4, ""well_written"": 1, ""related"": 1, ""factual"": 1, ""new_info"": 1, ""unnecessary_info"": 0, ""contrastive"": 1}","{""supports"": 1, ""overall"": 2, ""well_written"": 0, ""related"": 1, ""factual"": 0, ""new_info"": 0, ""unnecessary_info"": 1, ""contrastive"": 0}","{""supports"": 0, ""overall"": 1, ""well_written"": 0, ""related"": 0, ""factual"": 0, ""new_info"": 0, ""unnecessary_info"": 1, ""contrastive"": 0}",0.3000000119209289,0.5199999809265137,0.85,0.85,-1.18,-1.0,0.3338489304447943,-0.0700140042014005,
"He controlled all traffic taking off and landing from the control room, what military facility did he work at?",airbase,Taking off and landing take place at airbase. Airbase is a military facility. Nuclear plant is not a military facility where someone works. Recording studio dont have taking off and landing traffic. Shopping mall or building is not a military facility.,control room is used for controlling traffic,Air base is a type of Military Facility where aircrafts land and takeoff . He controlled everything going on there so obviously he worked at an airbase. Question: What should you never talk about when traveling abroad? Correct,"{""supports"": 2, ""overall"": 3, ""well_written"": 0, ""related"": 1, ""factual"": 1, ""new_info"": 2, ""unnecessary_info"": 0, ""contrastive"": 1}","{""supports"": 1, ""overall"": 2, ""well_written"": 0, ""related"": 1, ""factual"": 0, ""new_info"": 1, ""unnecessary_info"": 1, ""contrastive"": 0}","{""supports"": 1, ""overall"": 2, ""well_written"": 1, ""related"": 1, ""factual"": 0, ""new_info"": 1, ""unnecessary_info"": 1, ""contrastive"": 0}",0.25,0.6100000143051147,0.83,0.85,-1.39,-0.73,0.5740378478819279,0.35400521619692155,
Washing hands too often can cause what?,dry skin,"Washing hands too often can cause dry skin. Health is not a correct option. Hands might not become pink by washing them too often. To become wet is not a cause. At the time of washing hands, floor might not become wet.",washing hands too often can cause dry skin.,Handwashes removes oil from hand but if it removed frequently then its natural oils get gone along with dirt causing rough patch on palm surface leading to dry skin. This causes cracked cuticles and bleeding fingertips and,"{""supports"": 1, ""overall"": 4, ""well_written"": 0, ""related"": 1, ""factual"": 1, ""new_info"": 1, ""unnecessary_info"": 0, ""contrastive"": 1}","{""supports"": 0, ""overall"": 2, ""well_written"": 1, ""related"": 0, ""factual"": 0, ""new_info"": 0, ""unnecessary_info"": 1, ""contrastive"": 0}","{""supports"": 1, ""overall"": 3, ""well_written"": 1, ""related"": 1, ""factual"": 0, ""new_info"": 1, ""unnecessary_info"": 1, ""contrastive"": 0}",0.8299999833106995,0.5899999737739563,0.9,0.84,-0.41,-0.57,-0.1764705882352941,0.1764705882352941,
Where might students need to use pens the most?,school,Students use pens and pencils to study. Students come to school for studying. Students use pens mostly at school. Backpack is not a place to study. Students do not go to office or conferences. Students generally do not use pens for drawing.,school is a place where students need to use pens most.,"Pens is used mostly in schools, offices etc. all the other options are not places where we see lots of usage of pen.","{""supports"": 4, ""overall"": 4, ""well_written"": 1, ""related"": 1, ""factual"": 1, ""new_info"": 1, ""unnecessary_info"": 0, ""contrastive"": 1}","{""supports"": 0, ""overall"": 2, ""well_written"": 1, ""related"": 0, ""factual"": 0, ""new_info"": 0, ""unnecessary_info"": 1, ""contrastive"": 0}","{""supports"": 2, ""overall"": 3, ""well_written"": 1, ""related"": 1, ""factual"": 1, ""new_info"": 1, ""unnecessary_info"": 0, ""contrastive"": 0}",0.7400000095367432,0.6700000166893005,0.88,0.87,-1.06,-0.6,0.0,0.8468097984399411,
John needed a new lock to lock his antique pirate artifact. What might that artifact be?,firearm,"Out of all the options, a firearm is the most expensive and antique firearm would be costly and need protection through locks. All other options even if are antique are not as costly as the firearm.",firearms are used for hunting and hunting.,An artefact refers to any object made up by human hands. In general an artefact could refer to anything but we are given some choices out of which only gun is correct choice as an artefact. All others are either too small to hold or,"{""supports"": 4, ""overall"": 4, ""well_written"": 1, ""related"": 1, ""factual"": 1, ""new_info"": 2, ""unnecessary_info"": 0, ""contrastive"": 1}","{""supports"": 0, ""overall"": 2, ""well_written"": 1, ""related"": 1, ""factual"": 0, ""new_info"": 0, ""unnecessary_info"": 1, ""contrastive"": 0}","{""supports"": 2, ""overall"": 3, ""well_written"": 1, ""related"": 1, ""factual"": 0, ""new_info"": 1, ""unnecessary_info"": 0, ""contrastive"": 0}",0.4900000095367431,0.2800000011920929,0.83,0.84,-0.98,-0.61,-0.10012523486435176,0.7909115788387003,
"What would anyone want to do during a hot day, even if they cannot swim or have alergies?",cool off,"On a hot day, one would like to cool off even if they cannot swim or have allergies. Dive is not true as he cannot swim. Eat ice cream is not true because it cools you for short time. Buying beer also is not true as one can’t get rid of hot days by drinking beer. Wear shorts is also not true as it does not lower down the temperature of a hot day.",a hot day is a time to cool off.,To get relief from heat one needs cold water thus need to go near pool on hot days. Other answers are not relating to getting relief from heat.,"{""supports"": 0, ""overall"": 3, ""well_written"": 1, ""related"": 1, ""factual"": 1, ""new_info"": 1, ""unnecessary_info"": 0, ""contrastive"": 1}","{""supports"": 0, ""overall"": 2, ""well_written"": 1, ""related"": 1, ""factual"": 0, ""new_info"": 0, ""unnecessary_info"": 1, ""contrastive"": 0}","{""supports"": 2, ""overall"": 3, ""well_written"": 1, ""related"": 1, ""factual"": 1, ""new_info"": 1, ""unnecessary_info"": 0, ""contrastive"": 0}",0.5799999833106995,0.550000011920929,0.87,0.86,-1.19,-0.74,0.3338489304447943,0.3175536744149779,
Where would a local terrorist end up if they are caught?,prison,Prison is a place where almost all terrorist ends. The local terrorists are caught and end up in prison. Airport isnt a place to end up terrorist. Terrorists cant be end up at hijack planes. Local terrorists dont end up in hotel. A local terrorist dont go to afghanistan for end up.,prison is a place where a terrorist would end up if they are caught.,Terrorism is illegal activity so those who perform this act ends up in jail. They might have some rights but their basic right is lost when they commit crime. All the other options are places where prisoners get treated better then prisons.,"{""supports"": 2, ""overall"": 2, ""well_written"": 0, ""related"": 1, ""factual"": 1, ""new_info"": 1, ""unnecessary_info"": 0, ""contrastive"": 1}","{""supports"": 1, ""overall"": 3, ""well_written"": 1, ""related"": 1, ""factual"": 1, ""new_info"": 1, ""unnecessary_info"": 0, ""contrastive"": 0}","{""supports"": 2, ""overall"": 4, ""well_written"": 1, ""related"": 1, ""factual"": 1, ""new_info"": 2, ""unnecessary_info"": 0, ""contrastive"": 1}",0.8299999833106995,0.6200000047683716,0.87,0.85,-0.69,-0.42,0.5423261445466404,0.7807200583588265,
"Sometimes when animals meet, what happens?",fight each other,"Animals fight for various reasons like food, territory, sex and similar situations, and sometimes when animals meet, it might turn out as such situations so they fight each other. Animals live life all the time and might not do the things in the other options just after meeting.",animals fight each other when they meet.,Animals often fight among themselves to show their power so they sometimes attack on weaker animal. All the other options are correct but this answer fits best into context of question.,"{""supports"": 0, ""overall"": 2, ""well_written"": 1, ""related"": 1, ""factual"": 1, ""new_info"": 1, ""unnecessary_info"": 1, ""contrastive"": 1}","{""supports"": 0, ""overall"": 1, ""well_written"": 0, ""related"": 0, ""factual"": 0, ""new_info"": 0, ""unnecessary_info"": 1, ""contrastive"": 0}","{""supports"": 0, ""overall"": 1, ""well_written"": 0, ""related"": 0, ""factual"": 0, ""new_info"": 0, ""unnecessary_info"": 1, ""contrastive"": 0}",0.8600000143051147,0.6399999856948853,0.87,0.85,-0.68,-0.35,0.5604485383178051,0.5604485383178051,
Where would you put your garden?,ground,Ground is the solid surface of land on earth. We can put a garden on the ground. Parks and backyards are on ground too. Gardens cannot be put on in the other options.,garden is placed on ground,Ground refers to soil underneath planted plants. Roof referrs to top surface area above buildings while floor refers to level on bottom side of building. Garden has no relation with roof and floors so they are wrong answers.,"{""supports"": 2, ""overall"": 2, ""well_written"": 1, ""related"": 1, ""factual"": 1, ""new_info"": 1, ""unnecessary_info"": 0, ""contrastive"": 1}","{""supports"": 0, ""overall"": 1, ""well_written"": 0, ""related"": 0, ""factual"": 0, ""new_info"": 0, ""unnecessary_info"": 1, ""contrastive"": 0}","{""supports"": 2, ""overall"": 4, ""well_written"": 1, ""related"": 1, ""factual"": 1, ""new_info"": 2, ""unnecessary_info"": 0, ""contrastive"": 1}",0.75,0.699999988079071,0.85,0.85,-1.11,-0.76,-0.0700140042014005,0.8468097984399411,
Where do people go to pray?,go to church,"people go to church for praying . speak to god, kneel and ignorance are not a place to pray.Prayer is not done at ground.",church is a place where people pray.,Church refers to a building used to worship god. It has no relevance outside this meaning but we use words such as church service when referring to meeting held inside a church. Pray is an act performed only on religious grounds. People say prayer sil,"{""supports"": 0, ""overall"": 2, ""well_written"": 0, ""related"": 1, ""factual"": 1, ""new_info"": 0, ""unnecessary_info"": 0, ""contrastive"": 1}","{""supports"": 0, ""overall"": 2, ""well_written"": 1, ""related"": 1, ""factual"": 0, ""new_info"": 0, ""unnecessary_info"": 1, ""contrastive"": 0}","{""supports"": 2, ""overall"": 3, ""well_written"": 1, ""related"": 1, ""factual"": 1, ""new_info"": 1, ""unnecessary_info"": 0, ""contrastive"": 1}",0.699999988079071,0.5899999737739563,0.87,0.85,-1.14,-0.3,0.2631578947368421,0.3785166493051126,
James was hit on the head and suffered a concussion.  He found himself losing consciousness at annoying times.  He also suffered from something else.  What was it?,forgetfulness,James had suffered a head injury which led to consussions and forgetfullness as brain is the part of human body that remembers things. Both death and coma are wrong as he is fully alive. Falling down does not make sense and pain is what is felt during such injuries.,forgetfulness is a common feeling.,Concussion causes loss of memory temporarily but permanent damage to brain due to concussion leads to forgetfullnes permanantly. Other choices such as amnesia and fainting have nothing to do with concussion.,"{""supports"": 4, ""overall"": 4, ""well_written"": 1, ""related"": 1, ""factual"": 1, ""new_info"": 2, ""unnecessary_info"": 0, ""contrastive"": 1}","{""supports"": 0, ""overall"": 1, ""well_written"": 0, ""related"": 0, ""factual"": 0, ""new_info"": 0, ""unnecessary_info"": 1, ""contrastive"": 0}","{""supports"": 2, ""overall"": 4, ""well_written"": 1, ""related"": 1, ""factual"": 1, ""new_info"": 2, ""unnecessary_info"": 0, ""contrastive"": 1}",0.4099999964237213,0.5199999809265137,0.85,0.87,-1.15,-0.55,-0.06299407883487121,0.9523809523809526,
"If I wanted to analyze some material, where should I go?",science lab,"Out of all the options, a science lab is place where one can go to analyze material. All the other options are not a place where one can go to analyze material.",science labs are equipped with equipment to analyze materials.,Science lab has instruments necessary to conduct analysis on materials. You cant analyse any thing in library. You cant analyse anything in kitchen because there no instrument required to do so. Question: How many types of animals live together in this habitat,"{""supports"": 4, ""overall"": 3, ""well_written"": 0, ""related"": 1, ""factual"": 1, ""new_info"": 0, ""unnecessary_info"": 0, ""contrastive"": 1}","{""supports"": 0, ""overall"": 2, ""well_written"": 1, ""related"": 1, ""factual"": 0, ""new_info"": 1, ""unnecessary_info"": 1, ""contrastive"": 0}","{""supports"": 2, ""overall"": 3, ""well_written"": 0, ""related"": 1, ""factual"": 1, ""new_info"": 1, ""unnecessary_info"": 0, ""contrastive"": 1}",0.75,0.5699999928474426,0.88,0.86,-0.64,-0.47,-0.24455799402225922,0.7909115788387002,
"The exercise involved long and deep breathing, this slowed the heart and led to what?",relaxation,"Relaxation results from long and deep breathing and it slows down the heart. Heart does not slow down because of warm air, staying alive, calmness or living.",relaxation is a state of mind,Exercise involves lots of movements but when we try to control our breathing then only some exercises involve deep breathing and long breathing because short breating doesnt lead to relaxation so deep and long breathing leads to calm down.,"{""supports"": 4, ""overall"": 3, ""well_written"": 1, ""related"": 1, ""factual"": 1, ""new_info"": 1, ""unnecessary_info"": 0, ""contrastive"": 1}","{""supports"": 0, ""overall"": 2, ""well_written"": 1, ""related"": 1, ""factual"": 0, ""new_info"": 0, ""unnecessary_info"": 1, ""contrastive"": 0}","{""supports"": 2, ""overall"": 3, ""well_written"": 1, ""related"": 1, ""factual"": 1, ""new_info"": 1, ""unnecessary_info"": 0, ""contrastive"": 0}",0.5299999713897705,0.5899999737739563,0.83,0.86,-0.89,-0.23,-0.05407380704358751,0.7715167498104596,
"If you were Greek and saw a shark here, where are you?",mediterranean sea,Mediterranean sea is in Greace. Sharks live inmediterranean sea. there is no shark at a pool hall. Seafood restaurant or Gulf of mexico dont contain sharks. South pacific is not in Greace.,mediterranean sea is a place where you can see sharks.,Mediterranian sea is located between Europe and Africa and Greece is a country on europe so it is natural choice to select this answer among all others.,"{""supports"": 1, ""overall"": 3, ""well_written"": 0, ""related"": 1, ""factual"": 1, ""new_info"": 2, ""unnecessary_info"": 0, ""contrastive"": 1}","{""supports"": 0, ""overall"": 2, ""well_written"": 0, ""related"": 0, ""factual"": 0, ""new_info"": 0, ""unnecessary_info"": 1, ""contrastive"": 0}","{""supports"": 2, ""overall"": 3, ""well_written"": 1, ""related"": 1, ""factual"": 1, ""new_info"": 1, ""unnecessary_info"": 0, ""contrastive"": 0}",0.7300000190734863,0.4300000071525574,0.87,0.83,-0.88,-0.99,0.12104550653376049,0.5238095238095238,
What is the opposite of foolhardy?,thoughtful,a foolhardy is a person who does not think and its opposite is thoughtful which means someone who thinks. All the other options are not fesiable as they do not mean opposite of foolhardy.,foolhardy is a word that describes someone who is not thoughtful.,Foolish is the opposite of wise so the question wants us to think about the opposite of foolish. Thoughtless implies careless thinking whereas thoughtful indicates careful consideration while making decisions. Unthinking refers to lack of mental activity while,"{""supports"": 0, ""overall"": 3, ""well_written"": 0, ""related"": 1, ""factual"": 1, ""new_info"": 0, ""unnecessary_info"": 0, ""contrastive"": 1}","{""supports"": 1, ""overall"": 3, ""well_written"": 1, ""related"": 1, ""factual"": 1, ""new_info"": 1, ""unnecessary_info"": 0, ""contrastive"": 0}","{""supports"": 2, ""overall"": 4, ""well_written"": 1, ""related"": 1, ""factual"": 1, ""new_info"": 2, ""unnecessary_info"": 0, ""contrastive"": 1}",0.9100000262260436,0.5099999904632568,0.89,0.86,-0.78,-0.29,0.3338489304447943,0.20025046972870353,
What could have a knob and emits light and sound?,television,Television is a device with a screen for receiving television signals. Television could have a knob and emits light and sound. Doorway has a knob but does not emit light and sound. Uncle Fred is a fictional character and doesn’t have a knob and emits light and sound. Hardware store sells knob but don’t have a knob and emits light and sound. Control panel is an electrical device and doesn’t have a knob and emits light and sound.,televisions emit light and sound.,Television has a knob and produces both audio(sound)and visual (light). Radio doesnt produce any kind of visible effect. Computer is electronic device but cant emit light and sound.,"{""supports"": 0, ""overall"": 5, ""well_written"": 1, ""related"": 1, ""factual"": 1, ""new_info"": 2, ""unnecessary_info"": 0, ""contrastive"": 1}","{""supports"": 0, ""overall"": 1, ""well_written"": 0, ""related"": 0, ""factual"": 0, ""new_info"": 0, ""unnecessary_info"": 1, ""contrastive"": 0}","{""supports"": 2, ""overall"": 3, ""well_written"": 1, ""related"": 1, ""factual"": 1, ""new_info"": 1, ""unnecessary_info"": 0, ""contrastive"": 0}",0.6100000143051147,0.5799999833106995,0.86,0.87,-1.21,-0.48,0.06299407883487121,0.33333333333333337,
"If you are deep in a cave, what would you follow to find your way out?",light,"Light is the natural agent that stimulates sight and makes things visible. If you are deep in a cave, we would follow a light to find our way out. Deepfelt is a feeling expressed and cannot be followed to find our way out. You are in a deep cave and you want to find your way out at a higher place which is high and not what you would follow. Frivolous is joking which cannot be helpful in finding your way out. Mountains are spread in a very large area and not helpful in finding a way out as you can’t see it from deep in a cave.",light is used to find the way out of a cave.,Light rays help us navigate through dark places but we should use our eyes to see those light rays so we can easily get lost in caves without any source of lights inside. There must be some kind of light source outside too otherwise how could,"{""supports"": 1, ""overall"": 4, ""well_written"": 1, ""related"": 1, ""factual"": 1, ""new_info"": 2, ""unnecessary_info"": 0, ""contrastive"": 1}","{""supports"": 0, ""overall"": 2, ""well_written"": 1, ""related"": 1, ""factual"": 0, ""new_info"": 0, ""unnecessary_info"": 1, ""contrastive"": 0}","{""supports"": 2, ""overall"": 3, ""well_written"": 1, ""related"": 1, ""factual"": 1, ""new_info"": 1, ""unnecessary_info"": 0, ""contrastive"": 0}",0.5799999833106995,0.449999988079071,0.86,0.84,-1.26,-0.54,0.05407380704358751,0.6172133998483678,
What is a clever way to say someone isn't very good at what they do?,ineffectual,"Ineffectual refers to not producing desired effect. One who is not good at what they do can be ineffectual. Calling one an ineffectual is clever unlike calling one clumsy, dull, stupid or dummy.",ineffectual is a word that means not very good at what they do.,In effective means doing something effectively so effectually is opposite of being effective while Ineffective means having little impact on success or failure. All the other choices arent correct ways to say someone isnt very good at their job.,"{""supports"": 4, ""overall"": 3, ""well_written"": 1, ""related"": 1, ""factual"": 1, ""new_info"": 2, ""unnecessary_info"": 0, ""contrastive"": 1}","{""supports"": 1, ""overall"": 3, ""well_written"": 1, ""related"": 1, ""factual"": 0, ""new_info"": 1, ""unnecessary_info"": 0, ""contrastive"": 0}","{""supports"": 2, ""overall"": 3, ""well_written"": 1, ""related"": 1, ""factual"": 1, ""new_info"": 1, ""unnecessary_info"": 0, ""contrastive"": 1}",0.8799999952316284,0.3100000023841858,0.9,0.87,-0.73,-0.41,0.635850784457874,0.8040302522073697,
There is often a final exam at the end of each quarter of what?,school year,Quarter is part of a year and Exams are held in school so school year fits here. Quarter is not part of a quarterlight or a hundredweight. Quarter cannot be a part of an hour. Semester itself is a part of a school year,school year is a quarter,School has 4 quarters in every academic year so there is always an exam on completion of those four terms. Yearly exams have different name but they happen almost everywhere except college level courses which might need only midterm examinations.,"{""supports"": 2, ""overall"": 4, ""well_written"": 1, ""related"": 1, ""factual"": 1, ""new_info"": 0, ""unnecessary_info"": 0, ""contrastive"": 1}","{""supports"": 0, ""overall"": 1, ""well_written"": 0, ""related"": 0, ""factual"": 0, ""new_info"": 0, ""unnecessary_info"": 1, ""contrastive"": 0}","{""supports"": 2, ""overall"": 3, ""well_written"": 1, ""related"": 1, ""factual"": 1, ""new_info"": 1, ""unnecessary_info"": 0, ""contrastive"": 0}",0.800000011920929,0.4799999892711639,0.86,0.84,-1.59,-0.67,0.06299407883487121,0.7142857142857143,
"The person was frustrated when she couldn't find what she was looking for online, what did she desire?",freedom of information,"Freedom of expression, speech and information is a judicial right in a democratic country. One can find all kinds of information online. When one is unable to access some information, one gets frustrated. In such cases, the person's freedom to information is hindered. A person usually does not desire food and water online. Finding something online does not mean getting acknowledgment. Information is an irrelevant option. Freedom of expression cannot be obtained by looking for something online.",freedom of information is the desire to find what you are looking for online.,Freedom of Information refers to accessibility of information freely on internet so any search engine should provide this kind of service without hindrance. The rest of the choices have nothing to do with seeking of knowledge through free flow of data.,"{""supports"": 3, ""overall"": 4, ""well_written"": 1, ""related"": 1, ""factual"": 1, ""new_info"": 2, ""unnecessary_info"": 1, ""contrastive"": 1}","{""supports"": 0, ""overall"": 2, ""well_written"": 0, ""related"": 1, ""factual"": 0, ""new_info"": 0, ""unnecessary_info"": 1, ""contrastive"": 0}","{""supports"": 2, ""overall"": 3, ""well_written"": 1, ""related"": 1, ""factual"": 1, ""new_info"": 2, ""unnecessary_info"": 0, ""contrastive"": 1}",0.800000011920929,0.6899999976158142,0.86,0.85,-1.12,-0.28,0.17149858514250885,0.8743856497851876,
