Question,Choices,Ground Truth Explanation,Correct Choice,T5 Prediction,LLaMA Prediction
A reaching advantage can help a boxer achieve what?,"being ahead, fall, speed., victory, new option",A boxer can achieve victory with help of a reaching advantage. Being ahead and fall cant be achieved. Reaching advantage cannot help in achieving a new option and speed.,victory,victory,victory
"If a person wants to put some excitement into his routine, he learn how to do what?","play hockey, basketball, dance, go somewhere, express information","A person can learn how to do dance. Dance can put some excitement into a person's routine.A person cant play hockey to put some excitement in his routine. Someone dont do basketball. He cant put excitement if he go somewhere. If he express information, he cant put some excitement in his routine.",dance,dance,dance
What area would you find a large number of wheat fields?,"countryside, mill, bread, eat cake, farmer's field","Countryside is an area where you would find a large number of wheat fields. Wheat fields cant be found in a mill. Eat cake is not a correct option. Bread is not an area to find wheat fields. In a farmer's field, you cannot find a large number of wheat fields.",countryside,countryside,countryside
What might an elderly person install a railing on to help them pull themselves up?,"deck, stairwell, flight of stairs, feet, house","Railing is available at a stairwell to help old people to move easily. RAiling cannot be installed on a deck or a flight of stairs. Feet is not a place on which railing can be installed. On house itself, it is not possible to install a railing",stairwell,stairwell,stairwell
Where would you store a stack of paper when not immediately needed?,"notebook, cabinet, classroom, suitcase, portfolio",Papers which are not to be used immediately can be stored in a cabinet as it is used for storing things. All the other options are incorrect as they are not used for storing papers.,cabinet,cabinet,cabinet
What is the goal of driving to work?,"speeding ticket, use gas, go fast, anxiety, get to work",The purpose of Driving to work is to get to work as Person goes to work place to work. speeding ticket is not purpose of driving to work. Person don't drive to work to use gas or to get anxiety.Person doesn't drive to work to go fast.,get to work,get to work,get to work
"If there is a bird at my window, what is it likely sitting on?","cage, forest, a ledge, windowsill, countryside",Windowsill is the piece of wood forming the bottom part of the window where birds may sit on. Birds won't want to sit on cages and windows don't have shelves. The other options aren't objects to sit on.,windowsill,windowsill,windowsill
John watches the well dressed people from a catwalk above the stage.  He listens to them speak rehearsed lines while the audience listens.  Where is he/,"theatre, new york city, fashion show, construction site, school play",Theatre has well dressed people while school play does not. Audience listens in a theatre and not in New York city. Lines are rehearsed in a theatre and not in a fashion show or a construction site.,theatre,theatre,theatre
Where would the Air Force keep an airplane?,"airport terminal, military base, sky, hanger, airplane hangar","Air Force is a branch of the armed forces concerned with fighting or defence in the air. All armed forces equipment are stored in the military base. So, Air Force keeps their airplane in the military base. Military base has hanger and airplane hangar. Sky is not a place to store something and Air Force does not keep an airplane in the airport.",military base,military base,airplane hangar
What would happen to a person if he or she achieved something?,"try to learn, need assistance, jump in the air, thank god, feel proud",People feel good about themselves when they achieve something. Feeling good about oneself means feeling proud. Trying to learn is not somethin people feel after achieving something. Need assistance is an irrelevant option. People do not always jump on the air after achieving something. People do not always thank god after achieving something.,feel proud,feel proud,feel proud
"The children saw superman fly overhead, what did they exclaim as a result?","ouch, skip, enjoyed, awesome, watch television","Awesome is used as an exclamation while skipping, enjoying and watching television are not. One yells awesome when they see superman and not yell ouch.",awesome,awesome,awesome
"John tried to gain money, but all of his attempts to improve himself only did what to his income?","reduce, loss, waste, lost, lose weight","People generally try to improve their work performance expecting increase in their income, so John also tried to improve himself but his income only reduced. Income cannot lose weight and trying to improve ourselves will not do to income what the other options have given.",reduce,reduce,reduce
What is usually next to a door?,"apartment, office, wall, building, kitchen","Wall is a continuous vertical brick or stone structure that encloses or divides an area of land. Wall is usually next to a door. Apartments has doors and are not usually next to a door. Office has a door, but you can’t say that office is usually next to a door. Building is not usually next to a door. Kitchen comes with an open room concept and you can’t find it usually next to door.",wall,wall,apartment
What might cause someone to stop driving a car?,"going someplace, car crash, boredom, get sleepy, moving","Being sleepy may disturb your vision and you cannot drive safely and causes you to stop driving car.If person wants to go someplace it requires driving car.In car crash car gets stopped it self.boredom doesn't cause someone to stop car.If one wants to be moving, it require driving.",get sleepy,getting sleepy,Invalid Prediction
"The crab was being shipped to be eaten, where was he heading?","gulf of mexico, north sea, fish market, picnic basket, grocery store","Grocery store is a retail shop that primarily sells food, either fresh or preserved. The crab was being shipped to be eaten, he was heading to grocery store. Gulf of Mexico is a habitat for the crabs and the crabs are not being shipped to Gulf of Mexico. North Sea is the ocean and no human being lives here in North Sea, and the crabs are not being shipped to North Sea. Fisherman catches a crab and sells in a fish market which is near the coastal areas. Picnic basket is not for shipping of crabs.",grocery store,grocery store,grocery store
Where does a furnace usually heat?,"basement, antarctic, house, cellar, heat building",A furnace is a heating unit used to heat up an entire house and not just the basement. No one lives in the antarctic. Furnaces don't heat the cellar and is not used in hot buildings.,house,house,house
Where would you get  a map that shows locations that can only be walked to?,"cafeteria, classroom, truck stop, amusement park, gas station","Amusement parks are generally large in size and have many rides. For easy navigation, the maps have locations where one can walk and go. All the other options do not require maps and are not related to walking and going.",amusement park,amusement park,amusement park
When is an electric storm likely to occur?,"summer, weather report, america, hot, tropics","An electric storm is likely to occur in summer. An electric storm might not occur in a weather report or hot. In america or tropics, electric storm dont occur.",summer,summer,summer
What does a person miss when a tree hits power lines?,"indoor plumbing, feel special, electricity, headache, forest","When a tree hits power lines, those power lines tend to get cut. Power lines supply electricity to a specific region. When power lines get cut, one does not get electricity. Indoor plumbing does not get affected when a tree hits power lines. Feel special and forest are irrelevant options. A person usually does not miss getting headaches.",electricity,electricity,electricity
"The place was special to them, you couldn't find it on just any what?","map, device, area, almost anywhere, location","A map shows location of all places on the earth. People use a map when they are looking for a specific place. Some remote places might not be found on a map. People do not use a device to find a place. Area, almost anywhere and location are irrelevant options.",map,map,location
What can you store silicone in?,"artificial breasts, tube, bag, hardware store, contact lens",Silicone is stored in a tube. silicon cant be stored in artificial breast. silicon cant be stored in a bag. Silicon is not a hardware. contact lens is not a place where silicone can be kept,tube,tube,tube
When seeing people play a game and your team is loosing what might you feel?,"excitement, envy, stress, anxious, entertaining","When team is losing, we feel stressed. Stress is caused when there are more chances to lose a game and seeing others playing well. Excitement is not caused when our team is losing. Envy is not the result of seing someone playing. We dont feel anxious when team is losing. It is not entertaining to see team losing.",stress,stress,stress
"The teacher was arranging and sorting papers at her desk, needing paper clips she opened up the left what?","work, drawer, university, desktop, window",A drawer is a place where one stores their paperclips and it is a part of desk. A desk can have both right and left drawer. All the other options are incorrect as they are not a place with apperclips or are not in/on a desk,drawer,drawer,drawer
"James thought that the desk was built with solidity, but when he rapped on it he could hear what?","openness, instability, hollowness, strange sounds, weakness","James thought that the desk was built with solidity, but when he rapped on it he could hear hollowness. Openness cant be heard. Instability of the desk cant be heard. Weakness cant be heard by rapping on the desk. A person may not heard strange sounds if the desk was built with solidity.",hollowness,hollowness,hollowness
Where would a special ficus be found?,"botanical garden, doctor's office, in a sea, public place, arboretum",Botanical garden is place where plants are grown for scientific study and display to the public so Special ficus can be found in the botanical garden grown by some scientific method. Doctor's office is not place where plants can be grown. Ficus cannot be found in a sea. Public place cannot have special ficus tree.Arboretum cannot have special ficus always.,botanical garden,botanical garden,botanical garden
"The animals didn't have any sense of shame.  They just had sex by the water, and sometimes dipped in to do what?","feel pain, bathe, die of cancer, copulate, attack",Bathing means to wash one's body with water which is something animals do. The animals didn't have shame as they had sex by the river and dipped in to bathe. Animals won't want to feel pain or die of cancer and they may not dip in water to do the other options.,bathe,bathe,Invalid Prediction
What happens when someone trips when going for run?,"falling down, sweating, get tired, flying, working out","Tripping is catching one's foot on something and stumble and fall down. So when someone trips, they fall down. All the other options are not what happens when someone trips.",falling down,falling down,falling down
Where might many bottles of glue be stored?,"art room, garage, kitchen, cabinet, closed container",A cabinet is a storage location to store a lot of things so many glue bottles can be stored there. Art room and kitchen are not storage locations and the other options are not storage locations for glue bottles.,cabinet,cabinet,cabinet
Everybody wants to be the frontman or play guitar in a what?,"case, concert, rock band, toy store, music room",Rock band means a number of musicians who play rock music together and frontman means the lead singer of a pop or rock group. Guitar is a stringed musical instrument which is played in a rock band which is where everybody wants to be the frontman in. Concert comes under rock band and people don't play guitar or be frontman in other options.,rock band,rock band,rock band
If you're going on vacation on a deserted island what are you hoping to achieve?,"panic, having fun, relaxation, solitude, peace","Deserted island is a remote island where no people live, so such places will be peaceful and free from chaos. Hence you hope to achieve peace on vacation on a deserted island. Vacation on deserted island doesn't necessarily give panic and other options come under peace.",peace,peace,peace
What will a contraceptive device avoid the creation of?,"person, drug store, pharmacy, drugstore, children",Contraceptives helps to prevent reproduction. Person cant be created by using contraceptive devices during sex. Drugstore or Pharmacy cant be created. Children is person only.,person,person,children
What does a chicken do in a joke?,"produce eggs, lay eggs, become food, cross road, looks for cars","Crossing road involves moving while looking for cars does not. Chickens can cross the road and it can take place without force whereas producing eggs, laying eggs and becoming food do not.",cross road,cross road,Invalid Prediction
"When the woman put her belonging  in the drawstring bag, how did she want her things to stay?","safe, department store, military, tied up, airport","The woman put her belongings in the drawstring bag when she wants her things to stay safe.Departmental store ,Military and Airport are not a way in which things stays.Nobody want their things get tied up in bag.",safe,safe,safe
"The professor spoke in a reserved, conservative, and laconic tone, what kind of language was he avoiding?A","bombastic, loquacious, verbose, talkative, prolix","Loquacious means tending to talk a great deal or talkative. The professor spoke in a reserved, conservative, and laconic tone, he was avoiding loquacious kind of language. Bombastic is high sounding whereas he was not speaking loudly but was laconic or short. Verbose is wordy while the professor was more precise than not expressing in more words than are needed. Talkative is chatty whereas he spoke in a reserved and concise speech while talkative is to talk about anything. Prolix is tediously lengthy and not what kind of language he was avoiding.",loquacious,bombastic,loquacious
What drinking vessel can overflow if filled with too much water?,"riverbed, sewer, drain, creek, glass","A glass is a small vessel and if too much water is filled inside it, it overflows. All the other options are incorrect because they are not a type of drinking vessel.",glass,glass,glass
Where could there by tens of thousands of people playing baseball?,"america, canada, pitchers mitt, park, sporting goods store",America is a country with population 32 crores and tens of thousands of people comes under 32 crores so that many people paying baseball could be in america. Pitchers mitt is a glove and not a place and Canada people might not play baseball. The other options are small places to have tens of thousands of people.,america,america,america
"She sure didn't have a green thumb, every time she thought she was making grow something it would what?","growth, flowering, ground, die, plants","As she did not have green thumb, it meant that anything she put her hands on would not survive which means die. All other options are not related to her not having a green thumb.",die,die,die
If there are a lot of people waiting to order at the fast food restaurant where you decided to have lunch what must you do before you get to order?,"grab the food, get full, pouring coffee, getting in line, eath",A line is a sequence of people awaiting their turn to be attended to or to proceed. One needs to get in line if there are a lot of people waiting to order at the fast food restaurant. One cannot do all the other options when there are a lot of people ahead in a fast food restaurant.,getting in line,getting in line,Invalid Prediction
What could hydrogen be added to to cause it to explode?,"universe, chemistry lab, ocean, texas, air",Hydrogen when added to air it explodes. Universe doesn’t happen when hydrogen is added to it. Chemistry lab doesn’t happen when hydrogen is added to it. Ocean doesn’t happen when hydrogen is added to it. Texas doesn’t happen when hydrogen is added to it.,air,air,air
If you get in a fight after getting drunk where are you likely to end up?,"bar, jail, raise hell, liquor store, gutter",violenting with someone after getting drunk is crime andFor doing crime police takes you to jail. police doesn't take you to bar or liquor shop after violence. Getting in fight after drunk doesn't end in raising hell.You don't end up in gutter after fight.,jail,jail,jail
Where do most people get carrots?,"salad, store, cellar, supermarket, field","Carrots are sold in a store which is a building unlike a salad, cellar and field. Store usually only sells food while supermarket does not sell food alone.",store,store,store
What happens if you eat hamburger that's very big?,"hungry, choking, get full, lose weight, getting fat",You get full when you eat large meal and A very big hamberger is large meal for normal person.You cannot feel hungry after you eat a very big hamburger. Choking doesn't happen if you eat properly. you cannot lose weight by eating a very big hamburger.Eating any size of hamburger regularly can make you fat.,get full,get full,get full
"While moving the antique a wooden rod fell out, but since it was just part of the chimes what was still functional?","hardware store, old clock, broom closet, puzzle, old houses","An old clock is still functional since rod has fallen out of it. The chimes are present in old clocks. While moving the antique a wooden rod fell out, but since it was just part of the chimes so the old clock was still functional. Broom closet cant be functional. Puzzle is not functional or non functional. Hardware store dont have the chimes. The chimes is just not the part of the old houses.",old clock,old clock,hardware store
What causes hard breathing when you are sick,"live, sigh, blood, respiration, cough","Cough occurs when one is sick and it leads to hard breathing unlike sighing, living or respiration. Blood does not occur when one is sick.",cough,cough,cough
John didn't know why it was called blowing. You didn't blow.  There was no blowing.  What was done instead of blowing?,"sucking, breathe in, inhale, breathing in, sucking","Sucking means to blow hard into the mouth, which is the opposite of blowing. If there was no blowing, it means that sucking was taking place. Breathing and inhaling are not the exact opposite of blowing.",sucking,sucking,sucking
"If someone is fiddling a fiddle at random, what song are they likely to play next?","dancing about, unpredictable, being happy, troubles, they play cricket",Song can be predicted by its music but if artist is playing violin randomly then unpredictable song is likely to play.Dancing about cannot be the song that artist play always after random violin music. Being happy or Troubles is not suitable option here.They play cricket is not relevant option here.,unpredictable,unpredictable,unpredictable
A night owl is what you'd head at sunset and you'd hear a what at sunrise?,"morning person, early bird, lark, early riser, rooster",A lark is a bird that one can hear at sunrise. All the other options are not related to a night owl.,lark,lark,lark
Where can you buy eggs along side many other types of food?,"egg carton, supermarket, refridgerator, breakfast, chicken coop",supermarket have eggs and many variety of other food and supermarket is place where all food items are sold.egg carton doesnt have any other food but eggs.refridgerator is not place where eggs are sold. breakfast is meal not place where food item are sold.chicken coop doesnt have any other food item for sale.,supermarket,supermarket,supermarket
The child was taken against its will and what the parents?,"for or, away from, being for, because, for someone",Children's will is to generally live with their parents and against children's will would to be to take them away from parents. All the other options are not what happens when children are taken against their parents.,away from,away from,for someone
"The person answered the door when the mailman knocked, what likely happened next?","arm himself, cross street, feel sleepy, dog barked, receive mail","Mailman is a person who brings mail. When a mailman comes to one's door, the person usually receives mail. One does not arm himself when a mailman knocks on the door. People do not cross street when a mailman knocks on the door. Feel sleepy is an irrelevant option. Dogs do not always bark when a mailman knocks on the door.",receive mail,receive mail,receive mail
"The water spout wouldn't turn off.  Eventually, what was totally filled?","the kitchen, sink, fountain, access to water, florida",A sink can be found filled with water. As the water spout wouldn't turn off so eventually sink was totally filled. The kitchen cant be found filled with water. Fountain cant be filled if water sout wouldn't turn off. Access to water is not a correct option. Florida and water spout are not related to each other.,sink,sink,sink
What does a round glass do?,"break easily, many different colors, shattering, hold my doughnuts, hold water",A round glass is a container made to hold substances like liquids. So a round glass holds water. A round glass doesn't do anything else as given in the other options.,hold water,hold water,hold water
Where would you find cloth to sleep on?,"kitchen, linen closet, fabric store, bedroom, garage","Bedroom can have clothes and one sleeps in the bedroom and not in the kitchen, fabric store or a garage. Bedroom is a room in the house unlike a linen closet.",bedroom,bedroom,bedroom
Where would you find several businesses in the same location?,"park, skyscraper, art, big city, office building",An office business can have several businesses which can exist in the same location. Office building has a registered address unlike art or a big city. A part cannot have several businesses and a skyscraper need not only have businesses.,office building,office building,office building
what happens to a company when it is bankrupt?,"liquidated, own resources, branch out, commit crime, game over","When a company is bankrupt, its liquidated as its assets are converted into cash. A bankrupt company doesn’t have resources are its converted to cash. It can’t branch out nor commit crime as its not functioning being liquidated. Game over is not a valid answer because there is no game in a company going bankrupt.",liquidated,liquidated,liquidated
Where would you find a monitor wall that is used for watching moving lines?,"studios, security office, hospital, department store, guard station",A hospital has monitor walls with moving lines that show details of people like heartbeat etc. All the other options do not have moving lines that one can see.,hospital,hospital,hospital
"A person wants to be successful, the end goal is to what?","delicious food, self esteem, acquire wealth, compliments, eat dinner","People consider gaining wealth as becoming successful. When people want to successful, it usually means they want to acquire wealth. Delicious food is an irrelevant option. Self esteem has no relation to becoming successful. One does not aim to be successful to gain compliments. The ultimate goal of becoming successful is not eating dinner.",acquire wealth,acquire wealth,acquire wealth
What should my family and I look into getting if we don't want an egg from the supermarket?,"farm, henhouse, chicken coop, plate, bird's nest",hen house is shed for keeping poultry in and poultry gives you eggs and hen house doesnt require you to go supermarket for eggsfarm doesnt have pultry only.chicken coop are made in large poultry farms generally not in houses.plate cannot provide you eggs. bird's nest doesnt have eggs always.,henhouse,henhouse,henhouse
"Though the drawing of the object was ambiguous at best, the people playing the drawing game were able to identify the item because it was what?","certain, distinct, common, known, specific",Common means something prevalent and people will be able to identify something easily if it is prevalent. So the people were able to identify the object even when it was ambiguous because it was common. Something will be known when it is common and something ambiguous cannot be what the other options say.,common,common,common
Danny noticed a ceramic object on the table and picked a grape out of it.  What might have been on the table?,"kitchen, painting of fruits, fruit basket, bowl of fruit, fruit stand",Ceramic objects are made of clay and many tableware like fruit bowls are ceramic. Danny noticed the ceramic object of a bowl of fruit on table and picked a fruit out of it. One cannot pick out grape from painting of fruits and other options aren't ceramic objects.,bowl of fruit,bowl of fruit,fruit basket
What is rain a type of?,"snow, disneyland, air, weather, forest",Rain is type of a weather. Disneyland isnt a type of rain. Air dont fits here. Forest dont suits here. Rain is not a snow.,weather,weather,weather
"The news held a forum on who people would choose, they had a group that was what?","undecided, reject, predetermination, force, blank","There can be a group of undecided people and not blank people. Undecided refers to not making a decision while rejection, predetermination and forcing do not.",undecided,undecided,undecided
