Question,Choices,Ground Truth Explanation,Correct Choice,T5 Prediction,LLaMA Prediction
"Sometimes a human has an office job, being seated all day means they should big a quality and comfortable what?","chair, desk, workplace, internet cafe, submarine","Office job, being seated all day means they should have a big, good quality and a comfortable chair. Desk is not true as it is not meant for sitting for a whole day work. Workplace is not true because office jobs are to be done at a workplace. Internet café is not for sitting in an office job. Submarine is not for sitting in an office job.",chair,office,chair
John cooled the steam. What did the steam become?,"condensate, electric smoke, smoke, liquid water, cold air",Steam on cooling becomes liquid water. Steam cannot become cold air or smoke or electric smoke. ,liquid water,liquid water,liquid water
Sally was a senior in the House.  What might she be a member of?,"assisted living facility, old people's home, high school or college, republican party, organization",Republican party contains senior members. Member of republican party are senior in house. A senior may not be the member of assisted living facility. Old people's home is not a party having members. Member of high school or college are not senior in the house. One may not be senior if he is member of any organisation.,republican party,republican party,republican party
What does answering questions correctly lead to?,"embarassment, children will learn, better grade, failure, discussion",Better grade means getting more marks and answering questions correctly leads to getting more marks. Answering questions correctly does not lead to the things mentioned in the other options.,better grade,better grade,better grade
"The ticket booth informed riders that the train was running late, so where was the ticket booth located?","movie theatre, sports arena, school, metro station, auditorium",The ticket booth was located at the metro station that provides information like the train was running late to the riders. Ticket booth located at movie theater and auditorium dont give train's information. There is no ticket booth at sports arena or school.,metro station,metro station,metro station
"A skateboard can have a steep learning curve, but once the basics are mastered you can what?","relax, teenager, freedom, have fun, give up","Skating leads to fun. Any sports if mastered in basics, then it leads to fun at a later stage. Relax or freedom is not the thing, we skate for fun. Teenager is not an activity or feeling. After learning basics, no one gives up.",have fun,have fun,have fun
Simon put crayon pictures on the wall of what?,"classroom, labyrinth, zoo, art show, prison",Classroom is a place where crayon pictures can be seen. Simon put crayon pictures on the wall of classroom. Crayon pictures cant be seen on the wall of labyrinth. There are no crayon picture in zoo. Art show dont contain any crayon picture.. On the wall of a prison crayon pictures is not seen.,classroom,classroom,classroom
"He was bound to get hired quickly apply for job, he had a reputation for what?","frustration, humor, working hard, stress, rejection",Companies generally like people who work hard and hire them. So he was bound to get hired as he was hard working. Companies generally don't want to hire people with any qualities from the other options.,working hard,working hard,working hard
If you need an item is it a good idea to wait for a sale before what?,"buying, clothing store, k mart, overpriced, expensive","One waits for sale before buying. Buying from a sale is less expensive. Clothing store, overpriced or expensive is not an activity. One dont wait for a sale before kmart.",buying,k mart,buying
"She always wondered how safe it was to use her hair dryer straight after a hot shower, it was always so wet and steamy in the what?","jungle, drug store, box, beauty salon, bathroom","Bathroom is a place where people bath and freshup and hot shower is a way of bathing, so it was always so wet and steamy in the bathroom. One cannot have a hot shower in all the other options.",bathroom,bathroom,bathroom
What does a person do when something is arriving at an undisclosed time?,"washing dishes, wait patiently, stand erect, cross street, waiting room","A person does not know the exact time of arrival when the time is undisclosed. The person has to wait patiently as he is unaware of the specific time of arrival. Washing dishes is not related to something arriving at an undisclosed time. Stand erect, cross street and waiting room are irrelevant options.",wait patiently,wait patiently,wait patiently
"Bob thought that his Pokemon cards were common and worthless, but he was wrong about them. They were really what?","personal, special, shiny, rare, irregular","Bob’s Pokemon cards were rare and valuable because they were not common. Personal, special, shiny and irregular things aren't necessarily worthless and not common.",rare,special,rare
"The lizard was at the zoo, the protester stole it and returned it to the what?","wild, glass cage, restaurant, garden, galapagos archipelago",The protestor wanted to take the animal from the zoo and returned it to its original place which can anywhere in wild. While garden can be a place but it is not somewhere a lizard belongs.All the other options are also not home to lizards.,wild,wild,wild
"The people wanted to take the scenic route, they chose the highway that cut through the what?","countryside, united states, beach, atlas, developed land","Countryside highways are passing through farm’s, field’s and mountains with lush green scenic views. Whereas Atlas and Developed lands are not the option for a scenic route. Highways don’t usually cut through beaches and the whole of United States.",countryside,countryside,countryside
"He lowered and raised the bucket but it was empty, the what had run dry?","garden shed, utility closet, towards disk washer, laundry, well","A well can run dry which otherwise stores water and a bucket can be lowered into it unlike into a dishwasher. A garden shed, utility closet and a laundry do not store water.",well,well,well
"He controlled all traffic taking off and landing from the control room, what military facility did he work at?","nuclear plant, recording studio, airbase, shopping mall, building",Taking off and landing take place at airbase. Airbase is a military facility. Nuclear plant is not a military facility where someone works. Recording studio dont have taking off and landing traffic. Shopping mall or building is not a military facility.,airbase,nuclear plant,airbase
Washing hands too often can cause what?,"health, dry skin, pink hands, become wet, wet floor","Washing hands too often can cause dry skin. Health is not a correct option. Hands might not become pink by washing them too often. To become wet is not a cause. At the time of washing hands, floor might not become wet.",dry skin,dry skin,dry skin
Where might students need to use pens the most?,"backpack, office, conference, drawing, school",Students use pens and pencils to study. Students come to school for studying. Students use pens mostly at school. Backpack is not a place to study. Students do not go to office or conferences. Students generally do not use pens for drawing.,school,school,school
John needed a new lock to lock his antique pirate artifact. What might that artifact be?,"plastic sword, ignition switch, controlling access, drawer, firearm","Out of all the options, a firearm is the most expensive and antique firearm would be costly and need protection through locks. All other options even if are antique are not as costly as the firearm.",firearm,firearm,firearm
"What would anyone want to do during a hot day, even if they cannot swim or have alergies?","cool off, dive, eat ice cream, buy beer, wear shorts","On a hot day, one would like to cool off even if they cannot swim or have allergies. Dive is not true as he cannot swim. Eat ice cream is not true because it cools you for short time. Buying beer also is not true as one can’t get rid of hot days by drinking beer. Wear shorts is also not true as it does not lower down the temperature of a hot day.",cool off,cool off,cool off
Where would a local terrorist end up if they are caught?,"airport, hijack planes, prison, hotel, afghanistan",Prison is a place where almost all terrorist ends. The local terrorists are caught and end up in prison. Airport isnt a place to end up terrorist. Terrorists cant be end up at hijack planes. Local terrorists dont end up in hotel. A local terrorist dont go to afghanistan for end up.,prison,prison,airport
"Sometimes when animals meet, what happens?","fight each other, procreate, sleep, live lives, listen to each other","Animals fight for various reasons like food, territory, sex and similar situations, and sometimes when animals meet, it might turn out as such situations so they fight each other. Animals live life all the time and might not do the things in the other options just after meeting.",fight each other,fight each other,fight each other
Where would you put your garden?,"park, fence, ground, backyard, balcony",Ground is the solid surface of land on earth. We can put a garden on the ground. Parks and backyards are on ground too. Gardens cannot be put on in the other options.,ground,ground,ground
Where do people go to pray?,"go to church, kneel, ground, ignorance, speak to god","people go to church for praying . speak to god, kneel and ignorance are not a place to pray.Prayer is not done at ground.",go to church,go to church,go to church
James was hit on the head and suffered a concussion.  He found himself losing consciousness at annoying times.  He also suffered from something else.  What was it?,"coma, falling down, pain, death, forgetfulness",James had suffered a head injury which led to consussions and forgetfullness as brain is the part of human body that remembers things. Both death and coma are wrong as he is fully alive. Falling down does not make sense and pain is what is felt during such injuries.,forgetfulness,forgetfulness,forgetfulness
"If I wanted to analyze some material, where should I go?","city hall, anything, fabric store, physical world, science lab","Out of all the options, a science lab is place where one can go to analyze material. All the other options are not a place where one can go to analyze material.",science lab,science lab,science lab
"The exercise involved long and deep breathing, this slowed the heart and led to what?","warm air, stay alive, calmness, living, relaxation","Relaxation results from long and deep breathing and it slows down the heart. Heart does not slow down because of warm air, staying alive, calmness or living.",relaxation,relaxation,warm air
"If you were Greek and saw a shark here, where are you?","pool hall, mediterranean sea, seafood restaurant, gulf of mexico, south pacific",Mediterranean sea is in Greace. Sharks live inmediterranean sea. there is no shark at a pool hall. Seafood restaurant or Gulf of mexico dont contain sharks. South pacific is not in Greace.,mediterranean sea,mediterranean sea,mediterranean sea
What is the opposite of foolhardy?,"thoughtful, discreet, calculated, cautious, careful",a foolhardy is a person who does not think and its opposite is thoughtful which means someone who thinks. All the other options are not fesiable as they do not mean opposite of foolhardy.,thoughtful,thoughtful,thoughtful
What could have a knob and emits light and sound?,"television, doorway, uncle fred, hardware store, control panel",Television is a device with a screen for receiving television signals. Television could have a knob and emits light and sound. Doorway has a knob but does not emit light and sound. Uncle Fred is a fictional character and doesn’t have a knob and emits light and sound. Hardware store sells knob but don’t have a knob and emits light and sound. Control panel is an electrical device and doesn’t have a knob and emits light and sound.,television,television,television
"If you are deep in a cave, what would you follow to find your way out?","deepfelt, light, high, frivolous, mountain","Light is the natural agent that stimulates sight and makes things visible. If you are deep in a cave, we would follow a light to find our way out. Deepfelt is a feeling expressed and cannot be followed to find our way out. You are in a deep cave and you want to find your way out at a higher place which is high and not what you would follow. Frivolous is joking which cannot be helpful in finding your way out. Mountains are spread in a very large area and not helpful in finding a way out as you can’t see it from deep in a cave.",light,light,light
What is a clever way to say someone isn't very good at what they do?,"clumsy, dull, stupid, dummy, ineffectual","Ineffectual refers to not producing desired effect. One who is not good at what they do can be ineffectual. Calling one an ineffectual is clever unlike calling one clumsy, dull, stupid or dummy.",ineffectual,ineffectual,ineffectual
There is often a final exam at the end of each quarter of what?,"quarterlight, hour, school year, semester, hundredweight",Quarter is part of a year and Exams are held in school so school year fits here. Quarter is not part of a quarterlight or a hundredweight. Quarter cannot be a part of an hour. Semester itself is a part of a school year,school year,school year,semester
"The person was frustrated when she couldn't find what she was looking for online, what did she desire?","food and water, acknowledgment, freedom of information, information, freedom of expression","Freedom of expression, speech and information is a judicial right in a democratic country. One can find all kinds of information online. When one is unable to access some information, one gets frustrated. In such cases, the person's freedom to information is hindered. A person usually does not desire food and water online. Finding something online does not mean getting acknowledgment. Information is an irrelevant option. Freedom of expression cannot be obtained by looking for something online.",freedom of information,freedom of information,freedom of information
"The exhausted man needed to have rest, he soon fell to what?","relax, sit down, sleep, his death, closing eyes",Exhausted means loss of all energy and losing all energy causes sleep. Exhausion generally does not cause death and one does not fall into all the other options.,sleep,sleep,sleep
"The student pulled an all-nighter before attending lecture, what did he do upon arriving?","getting bored, go to sleep, gain knowledge, use the restroom, inspiration",Going to sleep means resting with eyes closed and all-nighters make one need rest the next day. The student pulled an all-nighter before attending lecture and went to sleep upon arriving. Getting bored may cause one to go to sleep and inspiration is not an action to do. One may not do the other options the day after an all-nighter right upon arriving at a lecture.,go to sleep,go to sleep,Invalid Prediction
"Much like a jaunt on the treadmill, thinking hard and long can cause what?","depression, revelation, new thought, fatigue, knowledge","Thinking hard and long can cause fatigue. Just by thinking hard, depression cant happen. Revelation is not the result of thinking hard. New thoughts and knowledge cant come on a treadmill as treadmill is a device used for exercise, consisting of a continuous moving belt on which to walk or run.",fatigue,fatigue,fatigue
What does hitting the side of a horse cause?,"movement, fear, stiffness, running, bouncing","Hitting the side of a horse, then the horse moves. It is indication to horse to start moving. Hitting dont cause fear. Stiffness is not cause by mere hitting. Horse dont run or bounce by mere hitting.",movement,fear,movement
Why would you be unable to win when you play games?,"entertaining, distracted, bored, have fun, challenge","In a game when a challange happens, all people work equally hard to win. This challange can lead to one not winning. All the other options are not the most fesiable reason os one being unable to win hence are incorrect.",challenge,challenge,challenge
If someone has a strong feeling of greed and wants to make some quick money what might they try to do?,"play poker, dominate world, advance into battle, conquer opponent, make friends","Poker is a card game played by two or more people who bet on the value of the hands dealt to them, which is a gambling game. People with greed and the want to make quick money may do gambling like playing poker and not anything from the other options.",play poker,play poker,play poker
"The person wanted to fix his car, what did he order?","selling things, gas, feel resentful, machine part, cross street","Once can repair automobiles by replacing its ruined part. One can get new spare parts by ordering it. Selling things, feel resentful and cross street are irrelevant options. Ordering gas is not helpful in fixing one's car.",machine part,gas,machine part
The parents concern was met opposingly by what on behalf of the teacher?,"carefree, uncaring, indifference, apathy, carelessness","The parents concern was met opposingly on behalf of the teacher’s indifference as the teacher lacked interest, concern or sympathy. The teacher wouldn’t oppose the parents’ concern if the teacher was carefree, without any worries and uncaring and not sympathetic. It’s not necessary that the teacher would oppose the parents’ concern if the teacher had apathy or lack of interest. The teacher wouldn’t oppose the parents’ concern if the teacher was careless and indifferent.",indifference,carelessness,indifference
"The high rollers began playing poker, there were no blinds so they all did what?","skill, losing money, bet their shoes, ante, attention","Ante and blind are two ways in which initial money in pot is contributed in poker. If there is no blinds, people opt for ante. All the other options are not correct as they are not related to no blinds no blinds in game of poker.",ante,ante,ante
What can some day be combined to form?,"hackday, morning, twenty four, week, night","When seven days are combined together, it is called a week. All the other options are incorrect as they are not what some days combined are known as.",week,week,week
My company's auditors are extremely worried about my practices. Should I care?,"liquidated, commit crime, branch out, go for a ride, own resources","I should care if I did commit crime by misrepresenting the company’s records.An auditor the accuracy of a company’s records. I could be charged with committing a crime for maintaining inaccurate records to siphon off the company’s money or resources. If my auditors are worried with my practices, having the company liquidated or to branch out may or may not solve their concerns. To go for a ride will not solve their concerns about my practices. Managing my own resources will not solve their concerns.",commit crime,liquidated,Invalid Prediction
What holds a lit cigarette when no one is around?,"hand, cool lip, light fire, ashtray, carton","Ash tray holds a lit cigarette unlike carton. Ash tray can be used when no one in around and is a thing while hand, cool lip and lighting fire are not things.",ashtray,ashtray,ashtray
James imported ugly cabinets because they were cheap.  They wouldn't be seen so it didn't matter what they looked like.  Where might they be installed?,"kitchen, planes, mexico, bathroom, pantry",Things inside the pantry are not visible outside unlike in the kitchen. Pantry can have ugly cabinets while planes do not. Pantry is a place to store food while Mexico and bathroom are not.,pantry,pantry,pantry
Where would one find a captive monkey?,"rain forest, tree tops, toy store, zoological gardens, great outdoors",A monkey can be kept captive at a zoological garden as many animals are kept there for people to see. All the other options are incorrect as they do not have captive monkeys.,zoological gardens,zoological gardens,zoological gardens
Where would you bring a tote bag with papers in it?,"shopping cart, the garage, house, school, closet",You would bring a tote bag to the school with papers in it. Shpping cart is not a place where a tote bag can be brought. A tote bag is not needed at the garage. A tote bag containing papers is not required in a house. Closet dont require a tote bag with papers in it.,school,school,shopping cart
What is likely the mood of those going to a party?,"stress relief, have fun, happiness, babies, laughter","A party is a social gathering of invited guests involving eating, drinking, and entertainment which generally gives happiness. All the other options are not moods.",happiness,happiness,happiness
John is a human who is in a wheelchair due to an accident.  Where would he go to get to the third floor of his apartment building?,"space shuttle, detroit, stairs, downtown, elevator",Elevator is a platform or compartment housed in a shaft for raising and lowering people or things to different levels. John in wheelchair uses an elevator to get to the third floor of his apartment. Space shuttle is not used for raising and lowering people in an apartment. Detroit is a city and not a platform for raising and lowering people in an apartment. Stairs are or can be used by healthy peoples who are not disabled. John on wheelchair cannot use stairs. Downtown is an area and not a platform for raising and lowering people in an apartment.,elevator,elevator,elevator
"Sally isn't beautiful.  She looks okay, just plain. But she doesn't think so. She has image issues and thinks that she's what?","ugly, overweight, bad, average, hideous",Having image issues means thinking low of how they look and people who think low of how they look think they are ugly. Sally thinks she is ugly because of image issues. Hideous comes under ugly and the other options are not image issues.,ugly,hideous,hideous
Where would a business man keep a plane ticket with other documents?,"briefcase, boarding plane, airport, pocket, shirt sleeve",Businessmen end to carry briefcases. They keep important documents in the briefcase. Plane ticket is an important document. Boarding plane is not a place to keep plane ticket or documents. Airport is not a place to keep plane ticket or documents. Businessmen do not keep documents in the pocket. People do not keep plane ticket and documents in the shirt sleeve.,briefcase,briefcase,briefcase
John put the book in his pack and then went off to work.  Where might he be working?,"public library, backpack, briefcase, suitcase, synagogue","Those working in a place of worship such as the synagogue are required to carry the holy book which is a type of book and can be carried in a backpack. Public library, back, briefcase and suitcase are not places of worship.",synagogue,synagogue,synagogue
"The roadway had a fast speed limit, but there were children nearby, what was safety concerned for?","neighborhood, suburbs, countryside, city, subdivision","A neighbourhood has roadway speed limits but if children are nearby, they get concerned as vehicles might hurt them. All the other options usually do not have roadways or do not have speed limits whch still are concern for people with children.",neighborhood,neighborhood,neighborhood
"It was a cold morning, so staying staying in bed brought warm what?","resting, comfort, stubborn, bed sores, missing out",Comfort can be received by staying in bed. Since it was a cold morning so staying staying in bed brought warm comfort. Resting cant be warm. Staying in bed is not stubborn. Bed sores arent warm. Missing out is not warm when a person stays in bed in a cold morning.,comfort,comfort,comfort
"The beaver swam through the country he symbolized, where was he likely to be?","japan, ontario, washington, woodlands, books",Beaver is the official emblem of Canada and Ontario is a Canadian province so beaver is likely to be there after swimming through the country. All the other options are not countries.,ontario,ontario,ontario
What does watching something entertaining cause people to have?,"they cant watching recognize and hospitality, talent, recognize, fun, intelligence",people have fun while watching something entertaining.you cannot have hospitality by watching something entertaining.people cannot have talent by watching entertainment programs always.watching entertainment program doesnt make you recognize something. watching entertainment program doesnt make you have intelligence.,fun,fun,fun
"The employees were complaining about lack of air conditioning, so where did the boss decide to install it?","on the tables, movie theatre, offices, car, house",Employees are people who work in offices and they were complaining about lack of ACs so the boss decided to get them installed in the offices. Table is a furniture and air conditioners cannot be fit on furniture and employees do not work in the places given by other options.,offices,offices,offices
"After I urinate and flush the toilet and wash my hands, what should I do next?","flush toilet, dry hands, zip pants, eat, wash hands",You should eat after urinating and washing hands. A person will not flush toilet again and again after washing hands. It is not necessary to dry hands as hands can be wiped off with towel. Person might not zip pants. A person will not wash hands again and again.,eat,eat,eat
"Despite doctor's orders, she ate breakfast in bed, what did she feel?","happiness, feel guilty, weight gain, spills, indigestion",eating breakfast in bed can cause indigestion if you have digestion issues.One cannot feel happiness when she has digestion issue and eat breakfast in bed. person may feel guilty but after getting indigestion due to eating on bed.you dont feel weight gain by eating on bed. Spill is not feeling,indigestion,indigestion,indigestion
