Question,Choices,Ground Truth Explanation,Correct Choice,T5 Prediction,LLaMA Prediction
If you're committing murder what would happen to your victim?,"sad, dying, regret, fear, killing","Committing murder results in the death and loss of life of the victim. The victim can’t feel sad, regret and fear as the murdered victim isn’t alive. The victim can’t kill anyone as the victim isn’t alive after being murdered.",dying,dying,killing
What often happens to students faces when learning about science?,"smiles, satisfaction, accidents, frustration, become educated","Smile means a pleased, kind, or amused expression, typically with the corners of the mouth turned up and the front teeth exposed. Smiles often happens to students faces when learning about science. Satisfaction never comes to the face when learning about science because being science a vast field you may never end up learning all and get satisfied. Accident happens when learning about science is not what often happens to students faces when learning about science as science is not about an accident. Science is an interesting subject and one cannot get frustration when learning about science. Become educated feelings never come when learning about science as science being a vast field you may never end up learning all.",smiles,smiles,smiles
Where would you find many computers in a group of work spaces?,"office building, canteen, backpack, house, box",You would find many computers in a group of work spaces in an office building as it houses different offices with groups of work spaces with computers. A canteen doesn’t house many computers nor group of work spaces. A backpack is a piece of equipment designed for use while being carried on the back and doesn’t house many computers in a group of work spaces. A house and a box don’t house many computers in a group of work spaces.,office building,office building,office building
Joe wanted to know the truth because he was an academic and south to learn as much as possible.  He would do anything in pursuit of what?,"work to advantage, matter to, further knowledge, free mind, finding the way",Joe wanted to know the truth so he would do anything in pursuit of further knowledge because he was an academic and south to learn as much as possible. Work to advantage dont suits here. Matter to is not something to be pursued. A person would not do anything in pursuit of finding the way or free mind.,further knowledge,further knowledge,further knowledge
What is needed mentally to ready one's self to begin detailed work?,"concentrate, shoes, apply for job, shave, shower",To concentrate is to give full attention to something and one should be attentive to begin detailed work. So concentration is needed mentally to ready one's self to begin detailed work. The other options aren't something to be mentally needed.,concentrate,concentrate,concentrate
Where is a good place to set an attache case other than a desk?,"business meeting, hospital, lawyer's office, chair, professional",Chair is a seat having back and legs where one may set an attache case to. So a chair is a good place to set an attache case to other than a desk. All the other options aren’t places to set attache cases in.,chair,chair,chair
"The robot shockingly began to read book after book, it had apparently done what?","choose one, get comfortable, bought a book, learn to read, open up","Reading book after book is possible only if someon learns to read. He is reading book after book, not only one. Robot getting comfortable is very strange. Robot cannot buy a book. Robot is not a person who can open up easily.",learn to read,learn to read,learn to read
An arch is a very strong way to have a doorway in a what?,"cathedral, bridge, building, ancient rome, hole",Doorway is an entrance to building and an arch is a very strong way to have a doorway in a building. Cathedral comes under a building and the other options do not have doorways.,building,cathedral,cathedral
"The person was bad, but everything he said was what?","just, sufficient, true, badarse, prime",Truth is something in accordance with facts and bad people can also speak facts. The person was bad but everything he sad was true. Bad people are generally not just and one need not be bad to be badarse. Prime and sufficient are not relevant to what a bad person says.,true,true,true
What is the closest place to eat when you are not out on the town?,"serving drinks, food court, shopping center, own house, downtown",People are out of town when they are away from home. People are close to own house when they are not out of town. Own house is the closest place to eat when one is not out of town. Serving drinks is an irrelevant option. Food court is not always the closest place to eat. Shopping center is not necessarily the closest place to eat. Downtown may not always be the closest thing to eat.,own house,own house,own house
How bad is the punishment for someone who is over indulgent?,"severe, harsh, hard, strict, self denying","Indulgent means lenient with someone or overly generous. Severe is very great and intense. Severe is the punishment for someone who is overindulgent. Harsh, Hard, Strict and self-denying are as discussed not the punishment for overindulgent.",severe,severe,severe
Sarah was cooling off too quickly after exercising hard.   She started doing what?,"relaxation, sweating, shivering, palpitate, chills",Muscles generally shake uncontrollably after getting fatigued due to exercise and hence lead to shivering. Sarah was cooling off after exercising hard since she started shivering. Exercising isn’t relaxing and one may not always sweat after exercising hard. Palpitating comes under shivering and chills aren’t an action to do.,shivering,shivering,shivering
What would you use to see a clip?,"desk drawer, woman's hair, scissors, television show, office building",Clip is an episode of a television show and not of a scissors or an office building. Television show can be watched and it gives entertainment while desk drawer and woman's hair do not.,television show,television show,television show
The company was very cheap.  The didn't do what?,"have coffee, mail clients, commit crime, own factory, pay employees",The company was cheap. It could not afford to pay employees. The company would mail clients and have coffee even if it is cheap. Company cannot commit crime. Not every company owns factory.,pay employees,mail clients,pay employees
Spending too much time contemplating can lead to what kind of pain?,"relaxation, deciding, regret, revelations, headache",Spending too much time contemplating and deeply thinking can lead to pain like headache. Relaxation is the state of having no contemplation and thoughts. Deciding is not a sort of pain. It’s not necessary to have regret or sadness for something that you did by spending too much time thinking deeply. You get a revelation which is divine or surprising fact when you spend a lot of time contemplating and thinking deeply about ideas.,headache,headache,headache
Where would you put a ficus if you do not want it to get your carpet dirty?,"ground, arboretum, apartment, refrigerator, california",Ficus tree can be put in the ground to save the carpet of the house from getting dirty andEvery person can put the ficus in ground easily.Person cannot put his ficus in the arboretum.Ficus cannot be kept in the apartment if person wants his carpet to be cleaned. Ficus cannot be kept in the refrigerator as refrigerator is not for keeping the plants.Every person cannot put the ficus in california.,ground,ground,ground
If you have a need for finding information through instruction what should you do?,"listen to online lessons, learn, ask questions, death, go to school",School have teachers to instruct you for finding the information. Person cannot listen to online lessons as it doesn't have instructor live to guide the listner always. Generally person cannot Learn by self when he already needs instructor to find the information. Asking questions need some instructor who may answer questions.Death is not relevant option.,go to school,listen to online lessons,learn
What type of gift shop can you by replicas of paintings?,"railway station, disneyland, airport, museum, hotel","A museum is a building in which objects of artistic, cultural, historical, or scientific interest are stored and exhibited. You can buy replicas of paintings in gift shops in a museum. Other options do not have objects of artistic, cultural, historical, or scientific interest in their gift shops.",museum,museum,museum
What could a real estate agent do if his or her customer wants to get a house?,"misrepresent, cover up, offer price, deceive, leave town",A real estate agent could offer prices if the customer wants to get a house. An agent cant misrepresent to his or her customer. An agent cant cover up. An agent cant deceive their customer in getting a house. It is not possible for an agent to leave town when his customer wants a house.,offer price,offer price,offer price
What is the largest group of books in North America?,"desk, school house, library of congress, closet, classroom","The largets library in North America is located in Washington D.C. It is named Library of Congress and has the largest group of books. Desk, school house and classroom do not have the largest group of books and closet is not located in Washington D.C.",library of congress,library of congress,library of congress
Where would you find the closest items made from wood?,"own home, lumberyard, electric store, carpet, boat",Closet can be found in home. You would find the closet items that are made from wood in your own home. The closet cant be found in a lumberyard. Items made from wood might not be found in electric store. Carpet is not a place where wooden items can be found. Boat is not a place where you can find the closet.,own home,own home,own home
John was cleaning up and found pics from his trip to California in something old.  What did he probablt find them in?,"suitcase, television, attic, fridge, newspaper",Old things are usually kept safely for the purpose of memories and preservation. A suitcase is a safe place to keep old pictures and other things. People do not keep their belongings in a television. People generally do not keep photos in the attic just like that. People do not keep old photos in the fridge. Newspaper is an irrelevant option.,suitcase,suitcase,suitcase
Where is a man likely to keep his sunglasses?,"drugstore, shirt pocket, purse, jeans pocket, bag",men wear shirts. Shirt pocket is a good place to keep sunglasses. Sunglasses cant be stored at a drugstore. Men dont keep purse with them. Jeans pocket or bag is not a good place to keep sunglasses.,shirt pocket,shirt pocket,shirt pocket
Where should I have a map that I want to use soon?,"posession, suitcase, backpack, rest area, shirt",If one has a map in posession that is owns a map they can keep it anywhere and use it whenever they want. All the other options are rigid places but not everyone can have them.,posession,posession,posession
"The man was sick of not attracting women and began to practice grooming, what was his goal?","tardiness, neatness, bathe, late, looking good","Grooming is the practice of brushing and cleaning which makes one look good. Looking good can attract the people of the opposite sex, so his goal was to look good. All the other options were not his goal as they do not attract women.",looking good,looking good,looking good
"The had a reputation for celebrating in a  debaucherous manner, what often happened as a result?","drunkenness, enjoyment, have fun, hang over, fighting","Extreme celebrations can lead to drunkenness and not to fighting. Extreme celebration is called debauchery. Drunkenness refers to the state of being drunk unlike enjoyment, having fun and hang over.",drunkenness,drunkenness,drunkenness
How should a person's health improve after getting in shape?,"feeling better, feel stronger, feel depressed, pain, look better",Getting in shape refers to losing cholesterol which increases health and makes us feel good. All other options do not necessarily happen on getting in shape.,feeling better,feeling better,feeling better
After the sun has risen what happens at the end of the day?,"deep dive, fall, lower, below, sun set",Sunset happens at end of day. Sunset happens after sunrise has taken place. Deep dive or below doesnt happen at end of day. Sun dont fall or lowers in sky.,sun set,sun set,Invalid Prediction
James went to the best steakhouse outside of the South.  Where is James?,"dairy farm, texas, building, michigan, florida",Michigan is not in south. As James went to the best steakhouse outside of the South so James is in michigan. James is not in a dairy farm. Florida abd texas might not have the best steakhouse. James might not be in a building.,michigan,michigan,florida
Where might you find a row of apple tree?,"new york, washington state, valley, park, fields",Park is a public place with aisles where people can walk and the aisles in parks have trees on either sides in rows. So park is where one might find rows of apple trees. Not all of Washington state and New York has rows of apple trees and the other options might not have rows of apple trees.,park,park,park
When people have a birthday what normally happens?,"talk to each other, loud sounds, work in teams, kiss each other, receive gifts",Giving gifts to birthday person is a common trend. People usually recieve gifts during their birthdays. Loud sounds are specific to birthdays. Work in teams is an irrelevant option. People generally do not kiss eachother on birthdays. Talking to eachother is not restricted to only birthdays.,receive gifts,receive gifts,Invalid Prediction
"People wanted to get to their destination quickly, what did they invent?","confession, toilets, national park, vehicles, supermarket",People use different modes of transporation to reach their destination quickly. These modes of transportation are called vehicle. Confession is an irrelevant option. Toilets do not help people in fast transportation. National park or supermarket are not modes of transportation.,vehicles,vehicles,vehicles
What is another way to say someone is a failure?,"insulted, hold back, illusion, lower expectations, amount to nothing",If someone's efforts amounts to nothing then that can be considered as failure of that person. Person doesnt get insulted only when he fails.Holding back cannot be considered as failure but it may lead to failure in future.Illusion are not real so cannot be considered as failure even though you have illusion of something. Lower expectations of success doesnt mean failure.,amount to nothing,hold back,Invalid Prediction
Playing chess is like most things where practice helps to build your what at it?,"sharking abilities, opponent, thought, skill, intelligence",A skill is an ability of a person that can be built over time by practce like in playing game of chess. All the other options are not related to what can be built like in game of chess henec are incorrect.,skill,skill,skill
Where could you find some large pieces of paper that are not for sale?,"cabinet, computer printer, suitcase, office supply store, artist's studio","Artists work on large pieces of paper, but due to a lot of changes and mistakes, the artist studio has a lot of large pieces of paper. All the other options are incorrect as they do not have large pieces of paper.",artist's studio,artist's studio,artist's studio
"The snake was cold, what did it seek?","warm place, wooded area, blanket, sleeping bag, tropical forest","As the snake was cold so it seeks a warm place. A cold snake may not seek a wooded area. Blanket dont fits here. Sleeping bag might not be seeked by a cold snake. When a snake is cold, it might not seek tropical forest.",warm place,warm place,warm place
The lizard tried to stay cool by resting in what sort of location?,"sunny place, rocky areas, shady spot, garden, dirt","Shady spots are places free from sunlight, therefore they are cool. Sunny place, garden, rocks may or may not be cool as they can have sunlight and dirt is not a place.",shady spot,shady spot,shady spot
"If someone saved up for a new bass, where would they go to get it?","freshwater lake, seafood restaurant, music store, barbershop quartette, river","Music store is a place which sells musical instruments like bass. So if someone saved up for a new bass, they’d go to the music store to get it. Barbershop quartette is not a place for a bass to be sold in and bass isn’t sold in places in the other options.",music store,music store,music store
Where are there more than 1 trillion planets like earth?,"god's creation, ball stopped, gravity, milky way, universe",Universe have more than trillion planets like earth.God's creation is not scientifically proven thing.stopped ball is not place.gravity is not place where planets can be but its kind of force. milky way contain our galaxy and have billions of planets.,universe,universe,universe
What might lock after someone drives in?,"mouths, doorknob, gate, entrance, front door","A gate can lock after someone drives in it to protect. All the other options like mouth, doorknobs etc. are not something that can close itself.",gate,gate,gate
What is a place that sells food but does not usually sell suntan lotion?,"deli counter, pharmacy, shop, beach bag, grocery store","At grocery store, food is available. At grocery store, suntan lotion is not sold. At deli counter, food is not sold. At pharmacy, suntan lotion is available. At shop, suntan lotion can be found. Beach bag is not a place.",grocery store,grocery store,deli counter
Where might someone need a small table?,"kitchen, demonstration, apartment, corner, furniture store","Someone might need a small table in apartment. Small table is not needed in kitchen. Demonstration is not a place. At furniture store, someone might not need a small table. A small table might not be needed in a corner.",apartment,apartment,apartment
The aorta is the main artery in what area of the body?,"neck, own brain, human body, torso, heart",The aorta artery originates from the heart and extends to abdomen. This whole area is known as torso. All the other body parts are just mere parts and aorta is not a part of them.,torso,torso,torso
What can occur in fencing if you are not careful?,"competition, severe injuries, fever, perspiration, small cuts",Fencing requires use of equipments that are very sharp and Person can get severe injuries by those sharp equipment in fencing if he is not careful. Competition in fencing doesn't happen due to carelessness. Players doesn't get fever if dont be careful in fencing.Perspiration doesn't always happen in fencing.Small cuts occurs even though the person is careful in fencing.,severe injuries,severe injuries,severe injuries
"John hated getting in line, but he wanted anyway.  Not breaking line was just what?","agitation, common sense, civil, fatigue, longer lines",Breaking line in a queue is not good manners and unfair to others so it's common sense to not break like. All other options are not why people don't break lines.,common sense,common sense,common sense
"I am looking to buy honey right from an apiary, where should I go?","jar, stick to fingers, beehive, stick to fingers, farmer's market","Apiary is a collection of beehives. Farmers cultivate beehives. Jar is what you fill honey in, while stick to fingers, Beehive and stick to fingers are not where a man gets honey right from beehives.",farmer's market,farmer's market,jar
What is a very common color in flowers?,"yellow, fragrant, orange, perennial, annuals",Yellow is the common color in flowers and Yellow is a color. Fragrant is not a color.Orange cannot be considered as color always as its fruit also. perennial is not color but its type of plant.Annuals is not a color.,yellow,yellow,yellow
A modern farmer needs many skills common for who in order to manage finances and increase sales?,"harvesting, business man, city dweller, farm land, industrial",Business man requires many skills to run the business and Modern farmer use modern science and technologies in farming to increase the farming productions. and increased sales requires good finance planning.Harvesting doesn't require many skills.City dweller doesn't have many skills always. Farm land doesn't require many skills to do farming. Industrial is not grammatically suitable here.,business man,business man,business man
"It was going to be a long winter during his commute, the heater had gone out in his what?","office, house, automobile, living room, public building","Automobile is a vehicle used to transport and commute means travel some distance between one's home and place of work on a regular basis, which is done using an automobile. It was going to be a long winter during his commute as the heater in his automobile gone out. All the other options are not means of commute.",automobile,automobile,automobile
John went into the front garden of his palatial mansion.  Where might his mansion be located?,"sunny yard, urban area, front yard, outside of house, michigan","A palatial mansion is generally built in a place with large free space, so John's mansion might be located in michigan. Such a mansion cannot be built in places given by other options.",michigan,michigan,michigan
"The bald eagle has been a protected species, this is in part due to a dwindling what?","nest, everglades, high places, in washington, natural habitat",Animals are put in protected species category when their populations reduce and animals’ population reduces when their natural habitat dwindles. Bald eagles has been a protected species as their natural habitat has been dwindling. High places come under the natural habitat and Washington is not where bald eagles live. Other options do not dwindle.,natural habitat,high places,natural habitat
What's a good thing for people to do with other people?,"shave their legs, believe in god, use drugs, make friends, stand upright",Friends usually help one another when need be. Being friends is a good thing. Friendship is usually done and maintained between two or more people. People generally do not shave their legs with other people. Believing in god does not require to be done with others. People usually do not use drugs with other people. Stand upright is an irrelevant option.,make friends,make friends,make friends
What does someone need to do to begin creating art?,"relax, controversy, pleasure, frustration, needs theater",Creating art requires calm mind so artist needs to be relax to begin the creation as Relaxed mind can get good ideas and concerntration for creating the art.Controversy or pleasure is not required for creating the art.Frustration is not needed to begin creating art as it doesn't allow the artist to concertrate on his work.To begin the creating art doesn't needs theater always as not all the art requires theatre.,relax,relax,relax
"The young boy was scared to dance, he found a corner of the auditorium and spent the whole evening doing what?","am happy, celebrate, moving, partner, sitting still",The young boy was sitting still as he was scared to dance. He found a corner in the auditorium where he spent the whole evening by sitting still. He was not happy as he was scared to dance. Young boy didnt celebrate in corner of auditorium. He spent the whole evening by not moving. Partner is not an activity that a person can do.,sitting still,sitting still,sitting still
It is a well known adage that you should not mix business with what?,"fun, nonprofit, art, pleasure, personal","Pleasure is a feeling that results in happiness and which when mixed with business can cause a loss. Mixing business with fun cannot cause a loss. Nonprofit, art and personal are not feelings.",pleasure,pleasure,pleasure
Where would you find a shark that is not alive?,"great barrier reef, deep ocean, maritime museum, ocean, pool hall","Maritime museum contains dead sharks. In museum, usually not alive things are kept. Great barrier reef is not a place where sharks are found. In deep ocean or ocean, live sharks are found. Sharks are not found in pools.",maritime museum,maritime museum,maritime museum
"If you're relaxing with friends and you agree with one but not the other, what have you done?","keep secrets, side with, hang out, lying, talking about","Friends can have casual arguments and in any argument, one can take either of 3 positions, for, or against, or neutral. If you are agreeing with one, that means you are siding with that friend. You don't keep secrets or hang out or lie down in an argument and talking about something is still taking someone's side.",side with,side with,Invalid Prediction
"A fox was thirsty searching for water during the drought, where was he?","painting, hen house, california, virginia, movie hall","Almost half of California is in a moderate drought and its deserts experience very hot summers, spiking to 80°F or more. A thirsty fox searched for water during drought in California. Virginia has no deserts. Foxes won't be in henhouses or movie halls. And not all paintings can depict the said condition.",california,california,california
What happens when you are drinking alcohol too much?,"vomiting, defecation, intoxication, frequent urination, nausea","Drinking too much alcohol makes your stomach overflowed and upset and that makes you vomiting.defecation doesn't happen on drinking too much alcohol. intoxication doesn't happen when you are drinking. frequent urination doesn't happen when drinking too much alcohol only ,any drink in too much quantity make you frequent urination nausea doesn't happen when drinking too much alcohol.",vomiting,vomiting,vomiting
