Question,Choices,Ground Truth Explanation,Correct Choice,T5 Prediction,LLaMA Prediction
Sam turned on the projector and showed his powerpoint presentation to his partners.  Where might he be?,"theatre, conference, show films, movies, meeting",Powerpoint presentation are shown in meetings where business partners are present. Powerpoint presentation are not shown at theaters or conference. show films or movies are not a place.,meeting,meeting,meeting
If you are starting a fire on purpose and are caught what will happen?,"death, burns, warmth, go to jail, get a reward",If you are caught while starting a fire on purpose then you will have to go to jail. Death might not happen by starting a fire on purpose. Burns dont happens if a person is caught. Warmth is not a correct option. A person might not get a reward on being caught when starting a fire on purpose.,go to jail,go to jail,go to jail
What is it called when you are killing people because they are bad?,"war, get arrested, joy, going to prison, vengeance",Vengeance means punishment inflicted or retribution exacted for an injury or wrong. It is called vengeance when you are killing people because they are bad. Killing people is not a war. War is between countries or group of people and not restricted to a particular person. Get arrested is the action taken by police for the crime done and is not called as when you are killing people. Joy and killing people are in no way interrelated and killing people doesn’t bring joy and so irrelevant. Going to prison is when you are convicted for killing peoples and not because you are bad and killing peoples.,vengeance,vengeance,vengeance
Why might someone be going into a trance?,"disorientation, loss of control, closed eyes, hallucination, confusion",Trance is the state of unconsciousness of surroundings thereby causing loss of control. Loss control is reason for going into trance. Other options won't cause trance.,loss of control,loss of control,loss of control
"What room, that doesn't normally have a side chair, helps you work from home?","bedroom, bathroom, building, table, office",Work can be done from an office room. There is no side chair in an office room. Bedroom or bathroom is not a place from where we can work from home. Building or table is not a room.,office,office,office
How does a bishop move from one place to another?,"chess game, church, in a car, queen, cathedral",Bishop is the name of a piece in chess who can move when the game of chess is running. A bishop won’t be in a car and a queen is a person and not a way to move. The bishop in the other options won’t move from one place to another.,chess game,chess game,chess game
What does an emotional person tend to be?,"expressive, excited, drunk, headache, eat every day",A person is called emotional when he shows a lot of emotions. A person who shows a lot of emotions is called expressive. Emotional people are not always excited or drunk. Headache is not related to being an emotional person. Eating everyday is not related to being emotional.,expressive,expressive,expressive
"If people are shot in the head by a bullet, what is the likely result?","believe in god, migraine, complete high school, die suddenly, cross river","Head holds the most important organ of the body, brain. A person cannot be alive without a brain. If someone is shot in the brain, he dies immediately. Believe in god, complete high school and cross river are irrelevant options. Migraine is not the result of gun shot wound in the head.",die suddenly,die suddenly,die suddenly
"The security detail had to keep an eye on the entire crowd, they were constantly scanning all the what?","potato, body, focus, faces, person's head",There are different faces in the crowd. The security detail were constantly scanning all the faces. Focus cant be scanned. They dont scan person's head or potato or body.,faces,faces,faces
What would you be if you comfort friend?,"cook, make tea, hurtful, friendly, hug","When friend is sad, we should comfort them by understanding their situation and showing friendly gesture. In no means we can comfort a friend by cooking or making a tea. Also hug is not necessary to comfort friend and being hurtful is an opposite thing of comfort.",friendly,friendly,friendly
Where would a soprano sing live for money?,"opera house, movie, choit, theater, choir",A soprano would sing live at an opera house for money. Soprano dont sing in a movie. A soprano might not sing live in choit or choir. Theater is not a place where a soprano sing.,opera house,opera house,opera house
What do you do after you reproduce?,"accidently got pregnant somehow, have children, raise children, offspring, extra copies for gang","You need to raise children after you reproduce. You cant accidently or somehow got pregnant after you reproduce. After you reproduce you dont immediately have children. Offsprings do not, immediately, came into existence after you reproduce. 'Extra copies of gang' do not suits with the given question.",raise children,raise children,raise children
"The shark realized it was in northern california, where was it likely?","sea world, tropical waters, tomales bay, aquarium, great oceans",Tomales bay is in northern california. Sharks are there at tomales bay. Sea world is not a place at northern california. Tropical waters or great oceans are not there at northern california. Sharks are not there in acquarium.,tomales bay,tomales bay,tomales bay
What type of areas have parking lots for stores?,"urban area, business district, airport, amusement park, commercial",Stores are small shopping places which are seen in urban areas. These places have designated parking lots. Other options do not have stores or parking lots specifically for stores.,urban area,urban area,urban area
The audience got up at intermission and bought pop corn.  What might they be watching?,"movies, school, theatre, event, new york",Movie is a cinema film with a short break called an intermission. The audience who got up at intermission were watching a movie. All the other options are not something that can be watched.,movies,movies,movies
A motorcycle is quicker because it isn't as what as a car?,"heavy, shiny, red, obesity, expensive","Car is a heavy vehicle and not an obese vehicle. Motorcycle is not a heavy vehicle and being heavy makes vehicles go slower while being shiny, red and expensive do not.",heavy,heavy,heavy
Is there a way for people going into trance to see things that do not exist?,"meditate, medicated, confusion, epilepsy, hallucination",Hallucination means imagining unreal things which are things that don't exist. People in trance can have hallucinations. Other options may not cause one to see things that don't exist.,hallucination,hallucination,hallucination
"Where might I ruin some papers if I place my coffee mug there, and it spills?","table, cupboard, shelf, kitchen, desktop","We work on desktop with papers and if we place coffee mug on desktop, it spills and some papers might get ruined. However we do not work on table hence papers are not lying on table. While cupboard and shilf are not meant to put papers and similarly we do not take papers in kitchen",desktop,desktop,table
What do you compete against someone in?,"fair, false start, competitive, in competition, practice",You compete against someone in a competition because it’s a contest in which people participate to establish superiority in a particular area. Fair isn’t a valid answer because it’s a travelling show with games and rides. False start isn’t a valid answer as a race will be invalid if a racer started before the official start signal. Being competitive isn’t the valid answer as there maybe competitors who’re not competitive. Practice isn’t the valid because one doesn’t practice among their competitors.,in competition,in competition,Invalid Prediction
What does a child learn to do in a lake?,"become adult, row boat, drive, go out to play, begin school","One needs to learn to row boat which is done in a lake while driving, going out to play and beginning school are not. Rowing boat is an activity while becoming adult is not.",row boat,row boat,row boat
"A man was driving himself to the airport, where did he put his luggage?","closet, at hotel, sidewalk, bus stop, trunk","When the man is driving towards airport, he will keep his luggage at back in trunk of vehicle. While a man is driving towards airport, he cannot keep it in closet as he does not carry cupboard. Hotels are not used while driving and sidewalk and bus stop are invalid options as they are not in driving towards airport.",trunk,trunk,trunk
"The atheist extolled virtues of secular thought, what ideas was he likely opposing?","eternal, religious, church, monastic, unpredictable","Atheist is the one who dont believe in religion. Religious views are ideas that are opposed by an atheist. Church, eternal or Unpredictable is not an idea. Atheist are monastic.",religious,religious,religious
What is the reason for having a gardener?,"manicure the lawn, garden backyards, water plants, grow plants, pick flowers","Plants need to be taken care of, for them to grow well. So we need a gardener to do it. All other options come under growing plants.",grow plants,grow plants,garden backyards
"A regular everyday human would just call it a meeting, but people like cardinals might call it a what?","conclave, sanctuary, homes, mortuary, stadium","Cardinals are a leading dignitary of the roman catholic church, nominated by pope which elects succeeding popes. Cardinals always be specific in words and so Conclave is a private meeting. Sanctuary, Homes, Mortuary and Stadium is not what cardinals might call a meeting pace.",conclave,conclave,conclave
"If a person wants to sort a pile of stuff, they must start by what?","control computer, go on vacation, cross street, gain weight, separate things","Sorting means arranging things in an orderly fashion. One must separate things first to sort them. Controlling computer is not helpful in sorting a pile of stuff. Going on a vacation, cross street and gain weight are not helpful in sorting a pile of stuff.",separate things,separate things,separate things
What can we assume about people who get up early?,"go sleep early, ask spouse to wake, fix up alarm, go to bed early, get rooster","People generally try to maintain a steady sleep cycle so if they get up early, they go to sleep early. Going to bed early doesn't necessarily mean they'll go to sleep and people generally don't get a rooster. Not all spouses ask the other spouse to wake up after getting up and those who get up early may not need to fix up alarm..",go sleep early,go to bed early,go to bed early
Starting in the mouth and passing through the throat what organ is where food passes through the body?,"neck, upper respiratory tract, throatplate, throatplate, alimentary canal","Alimentary canal is the whole passage along which food passes through the body from mouth to anus during digestion. Starting in the mouth and passing through throat food passes through the body by alimentary canal. By neck, food cant pass throughout the body. Upper respiratory tract is not used for passing the food. Throatplate is not any organ in the body.",alimentary canal,alimentary canal,alimentary canal
Why do people want to read fiction books?,"having fun, falling asleep, learn new things, learn unknown concepts, memorize","For having fun, people want to read fiction books. Fiction book dont let a person to learn unknown concepts, new things and fall asleep. The word memeoize dont fits in the given sentence.",having fun,having fun,having fun
If a person strives for happier circumstances in what is it called?,"american dream, better life, complimented, headache, own house",The American Dream is a national ethos of the United States. The ethos today implies an opportunity for Americans to achieve prosperity through hard work. Striving for happier circumstances means working hard for achieving prosperity. Striving for better circumstances does not mean better life. Complimented and headache are irrelevant options. Happier circumstances does not always mean having own house.,american dream,american dream,american dream
"In the children's book the cat was a great knight, it had finished its quest and was returning to the castle to what?","see king, meow, have fleas, sleep all day, live many years",One can see the king inside the castle and cannot meow or sleep all day. A great knight can see the king and cat is a non-human animal but a great knight cannot have fleas or live many years.,see king,see king,see king
"If something's weight isn't light, what is it?","crucial, darkness, cumbersome, heavy, darkness","Heavy is of great weight, difficult to lift or move. If something's weight isn't light, it is heavy. Crucial is decisive or critical but not when something’s weight isn’t light. Darkness is absence of light, the light of sun and not that is light in weight. Cumbersome is too heavy in every aspect that is size, shape and weight therefore difficult to carry or use.",heavy,cumbersome,heavy
Bob is in a dressing room.  He's putting on waterproof trunks and goggles.  What sort of facility is he most likely visiting?,"swimming pool, actors and actresses, fancy restaurant., gym, theatre",Bob is putting on waterproof trunks and goggles in dressing room that are used usually at swimming pool so bob is likely to visit swimming pool.Actors and actresses are not facility that bob may visit. Visiting fancy restaurants and gym and theatre doesn't require waterproof trunks and goggles,swimming pool,swimming pool,swimming pool
Why would you be going for run if you are not ill?,"mouth wash, breathlessness, losing weight, better health, satisfaction","People go for run for fitness and good health. Going for run while not being ill is generally for fitness. Fitness comes under losing weight so if you go for run while not ill, losing weight is the reason. Mouth wash and breathlessness are not reasons to go for a run and other options come under losing weight.",losing weight,losing weight,losing weight
"Playing tennis can be a great workout, all the lateral movement really gets the whats?","legs, skill, hand, competition, tennis racket","Legs are a part of body which when played tennis, have a lateral workout. All the other options are not fesiable as they are not related to where the lateral workput gets.",legs,legs,legs
"She looked longingly at her unrequited love, what did she want to be for him?","get money from, go to college, fall down, whatever, matter to",Unrequited means not returned and one would return love to someone if they matter. She wanted to matter to him as she loved him but did not get love in return. She did not want to be whatever to him and all the other options are not positions in which a person can be.,matter to,matter to,matter to
Bill suffered from boredom. He'd stare off and do what?,"work, see visions., fiddle, play games, dream",Dreaming happens when one stares off for a long time and it keeps the mind occupied which further breaks boredom. Staring off for a long time neither leads to working nor leads to playing games. Fiddling and seeing visions do not break boredom.,dream,dream,dream
"Mark's semen was very thick, but after his vasectomy it was also what?","blank, sparse, thin, clear, free flowing","Vasectomy is a means of sterilization hence it clears semen . Semen after vasectomy, becomes clear. Semen cant be blank, sparse. Semen cant become thin after vasectomy. Semen cant flow free if vasectomy is done",clear,clear,clear
What water feature has a pool at the bottom?,"waterfall, hose, neighbor's house, backyard, at hotel","Waterfalls are a water feature and have a pool like thing on its bottom as the water collects there. Neighbour house, backyard and hotels are not a water feature whereas hose do not have pool at its bottom.",waterfall,waterfall,waterfall
WHat does someone feel for someone that they entertain?,"please, hot, happy, liked, enjoyable",you like someone if he entertains you.you cannot please someone if he is already entertaining. entertainment cannot make you feel hot you have the feeling of liking more than being happy for someone who entertains you. enjoyable is not feeling.,liked,liked,liked
"He was a trivia hound and loved being able to answer anything, he loved studying to do what?","better grades, higher intelligence, increasing knowledge, inspiration, strain eyes",Knowledge is increased by studying. As study increases knowledge so he loved studying and being able to answer anything. He dont loves study for better grades. Studying might not give him higher intelligence. Inspiration cant be done by someone. A person dont love studying to strain their eyes.,increasing knowledge,increasing knowledge,increasing knowledge
James drove down the thoroughfare though his home what?,"house, country, city, town, traffic","Home town is a proper word. Throughfare can be drove through the home town. Home house, home country or home city is not any word. One cant drive through his home traffic.",town,town,town
"The mom liked giving assistance to her children, why did she do it?","law suits, feel loved, contractual obligation, happiness, out of pocket",Assisting others generally causes the feelings of pleasure and fulfillment and feeling loved means feeling pleasure and fulfillment. Mom gave assistance to her children as she felt loved. Happiness comes under feeling loved and mothers assist their childern not because of the other options.,feel loved,feel loved,feel loved
Where does water enter in a dam to create electricity?,"wet clothes, power turbine, cracks, thin soup, dribble","Electricity runs through power. In a dam, water enters the power turbine to create electricity. Wet clothes cant create electricity. Water cant enter cracks. Thin soup is not related to dam. Dribble is not a place.",power turbine,power turbine,power turbine
What do adults do with their clothing?,"smoke cigarettes, drive vehicle, dress themselves, park, drink beer",Clothes are meant to dress yourself. Adults dress themselves using clothing.Clothing is not related to driving vehicles or smoking cigarettes. Clothes cannot be parked. One cant drink beer using clothes.,dress themselves,dress themselves,dress themselves
If you're on the terrace enjoying warm Mediterranean breezes in what part of the continent are you?,"garden, spain, rice paddy, house, southern europe","Southern Europe is the southern region of the European continent. If you're enjoying warm Mediterranean breezes on the terrace then you are at southern europe. Terrace is not present in a garen. Spain is a country and not a continent. At rice paddy or house, you cant enjoy mediterranean breezes.",southern europe,southern europe,southern europe
Where might a yard be tiny?,"farmland, neighborhood, city, property, subdivision","At city, there might be a tiny yard. Farmland might not have a yard. A yard cant be found in a neighborhood. Property is not a place where a tiny yard can be found. A tiny yard cant be found at subdivisions as it is not a place.",city,city,farmland
Sally went out to look for a stepladder.  Where might she have gone?,"construction worker's vehicle, tool shed, hardware store, elevator, store room","A stepladder can be kept in a tool shed. Sally might have gone to the tool shed when she went out to look for a stepladder. Construction worker's vehicle isnt a place to look for a stepladder. To look for a stepladder, she might not have gone to hardware store. An elevator is not a place to look for a stepladder. As Sally went out to look for a stepladder so she might not have gone to store room.",tool shed,tool shed,tool shed
Cows outnumber people 4 to 1 in what state north of Kansas?,"advertisement, nebraska, countryside, fairy tale, iowa","Nebraska is a midwestern U.S. state encompassing the prairies of the great plains, the towering dunes of the sandhills and the panhandle’s dramatic rock formations. Cows outnumber people 4 to 1 in Nebraska state north of Kansas. Advertisement is an announcement in a public medium and not a state where cows outnumbered people. Countryside is a rural area and not a state where cows outnumbered people. Fairy tale is a children’s story and not a state where cows outnumbered people. Iowa is not a state where cows outnumbered people.",nebraska,nebraska,nebraska
Where is cheese likely to be dangerous for some creatures?,"refrigerator, mouse trap, fridge, outside, plate","Mouse trap is dangerous for some creatures and cheese is placed on a mouse trap and not outside. Mouse trap is a cruel device unlike refrigerator, fridge and plate.",mouse trap,mouse trap,refrigerator
What is often an outward expression of happiness?,"love, laughter, spread, tears, limp",Laughter is the expression of laughing due to amusement which includes happiness. So laughter is often an outward expression of happiness. Other options may not be expressions of happiness.,laughter,laughter,laughter
Where would a captain be on the sea?,"military, bridge of ship, battleship, basketball team, cruise ship",A battleship sails on the sea unlike the military or a basketball team. A battleship also has a captain and is a warship while bridge of ship and cruise ship are not warships.,battleship,battleship,battleship
"John lives in a farhouse well away from anyone. He doesn't farm himself, the farm shut down long ago.  How would you describe the area where he lives?","farming community, rural area, cow's shed, michigan, housing farmer and family",Rural area can have farm house and person can live in farmhouse as it has farm and house both and Rural area is generally far from city area and rural area can have farmhouse even though farming is stopped long ago.Generally farming community doesn't have farmhouse in which farm is shut down as farming community's primary activity is local food production. Cow' shed is not an area where person can live.Everybody cannot live in Michigan. Housing farmer and family is not an area where person can live.,rural area,farming community,rural area
Where are you likely to find melted cheese?,"refrigerator, bread, fridge, pizza, market","Pizza contains cheese and is an italian dish unlike bread. Pizza is an edible product while refrigerator, fridge and market are not.",pizza,pizza,pizza
Sarah loved riding horse but she was having pain in his legs because of it. She was experiencing what sesation?,"bouncing, shaky, fear, movement, stiffness",Stiffness in legs cause pain. Riding horse sometimes cause stiffness in legs. PAin dont cause bouncing experience. Pain in leg is not shaky. Pain is not related to fear. Movement is not a sensation.,stiffness,stiffness,stiffness
"Where could there be many couch, all with people sitting on them?","restaurant, rest area, apartment, neighbor's house, waiting room",Waiting room is a place where people wait for someone or something and people generally wait by sitting on couches. The places from all the other options may not have couches.,waiting room,waiting room,waiting room
Where can you enjoy a hike and maybe an enccouter with a fox?,"mountains, arctic tundra, great outdoors, open meadow, city","The great outdoors refers to all of the nature and wilderness outside, where we can enjoy a hike and encounter a fox too. All other options come under great outdoors.",great outdoors,great outdoors,great outdoors
What is learning about the world and how it works likely to cause?,"pleasure, laughter, anger, loss of innocence, sadness","Loss of innocence is often seen as an integral part of coming age. It is usually thought of as an experience or period in a person’s life that leads to a greater awareness of evil, pain and /or suffering in the world around them. Learning about the world and how it works likely to cause Loss of innocence. Pleasure is a feeling of satisfaction and not a cause. Laughter is not caused by learning about the world as world is not the funny place. Anger being a strong feeling of annoyance whereas you don’t get angry while learning about the world. Sadness is not the cause of learning about the world.",loss of innocence,loss of innocence,loss of innocence
If a beautiful person sprays you with a hose what will you be?,"wet, cold, dull, bad, rainy","Hose is flexible tube conveying water and spraying on one means pouring water. When water falls on someone, they get wet. So when a person sprays with a hose, we become wet. Cold is a feeling of being wet and rainy is a weather and not what someone can be. One won’t be what the other options say when sprayed by a hose.",wet,wet,wet
What will you do if you do not turn and you do not move either?,"twist, going straight, twist, stand still, go straight","If you do not turn and move either, you will stand still. You will not be able to twist untill you will turn. Without even moving, you cant be going straight. If you do not move then you cant so straight.",stand still,stand still,twist
Where are gallons of beer held in one container?,"outside, friend's house, neighbor's house, keg, refrigerator",Keg is a small barrel with a capacity from 10 to 30 gallons. Gallons of beer can be held in one keg. All the other options are not containers.,keg,keg,keg
Where would a brave squirrel be found?,"street, forest, tree, yard, park",A brave squirrel would be found on the streets. Forest or tree or yard or park is not a place where a brave squirrel can be found.,street,street,street
